,id,rating,recipeName,sourceDisplayName
295,Pea-Soup-With-Smoked-Sausage-And-Peppers-1707056,4,Pea Soup With Smoked Sausage And Peppers,Cooking With Love
296,Spicy-Kale-and-Chickpea-Soup-1252487,4,Spicy Kale and Chickpea Soup,Tori Avey
297,Watermelon-Gazpacho-1696281,4,Watermelon Gazpacho,Nutrition Stripped
298,Slow-Cooker-Chicken-Rice-Soup-1706659,4,Slow Cooker Chicken Rice Soup,Kathryn Seppamaki
299,Roasted-Red-Pepper_-Tomato-and-Basil-Soup-1709088,4,"Roasted Red Pepper, Tomato and Basil Soup",Profer Foodie
300,Cheese-Soup-With-Carrots-And-Shrimp-1696095,4,Cheese Soup With Carrots And Shrimp,Good food. Best Recipes
301,Cream-of-Parsnip-Soup-1704196,4,Cream of Parsnip Soup,Welcome to my kitchen
302,Tomatoes-Red-Lentils-Coconut-Soup-1703758,4,Tomatoes Red Lentils Coconut Soup,Innocent Delight
303,Conch-Chowder-1694211,4,Conch Chowder,Beer Girl Cooks
304,Cream-Soup-Substitute-for-Recipes-1687291,4,Cream Soup Substitute for Recipes,Recipes That Crock
305,Cauliflower-Chowder-1708090,4,Cauliflower Chowder,Welcome to my kitchen
306,Mexican-Chicken-Soup-Whole-30-1633633,4,Mexican Chicken Soup – Whole 30,I Heart Nap Time
307,Cauliflower-Watercress-Soup-1700087,4,Cauliflower Watercress Soup,Skinnytaste
308,Mac-And-Cheese-Soup-Recipe-_Even-The-Kids-Will-Love-It__-1688754,4,Mac And Cheese Soup Recipe (Even The Kids Will Love It!),Couponing for 4
309,Chickpea-_-rice-soup-with-a-little-kale-334446,5,Chickpea & Rice Soup With A Little Kale,Post Punk Kitchen
310,Roasted-Red-Pepper-and-Tomato-Soup-1627636,4,Roasted Red Pepper and Tomato Soup,Ahead of Thyme
311,Spicy-Shrimp-Soup-1697289,4,Spicy Shrimp Soup,Blog to Taste
312,Poor-Mans-Soup-1681299,4,Poor Man’s Soup,All She Cooks
313,Butternut-Squash-Soup-1631758,4,Butternut Squash Soup,Add a Pinch
314,Creamy-Vegan-Broccoli-Soup-1688689,4,Creamy Vegan Broccoli Soup,Veggie Souls
315,Roasted-Red-Pepper-and-Tomato-Soup-1691259,4,Roasted Red Pepper and Tomato Soup,Dinner with Julie
316,Chicken-Enchilada-Soup-1701772,4,Chicken Enchilada Soup,Roti n Rice
317,Diet-Beet-Soup-1690813,4,Diet Beet Soup,Our Meals
318,Recipe-Vegetable-Quinoa-Soup-1712520,4,Recipe Vegetable Quinoa Soup,Cook Elite
319,Keto-Beef-Stroganoff-Soup-1690714,4,Keto Beef Stroganoff Soup,Keto Diet
320,Smoked-Salmon-Chowder-1705926,4,Smoked Salmon Chowder,Seafood and Shellfish
321,Creamy-cauliflower-soup-352374,5,Creamy Cauliflower Soup,Skinnytaste
322,Winter-Greens-_-Ginger-Soup-1704660,4,Winter Greens + Ginger Soup,Local Milk
323,Cream-of-Tomato-Soup-1603364,4,Cream of Tomato Soup,Soup Maker Club
324,Quick-Cauliflower-Coconut-Stew-1694712,3,Quick Cauliflower Coconut Stew,Dr. Mark Hyman
325,Skinny-Broccoli-Cheese-Soup-1327931,4,Skinny Broccoli Cheese Soup,Tone & Tighten
326,Mushroom-Zoodle-Soup-1704013,4,Mushroom Zoodle Soup,Belly Rumbles
327,Chorizo-_-White-Bean-Soup-1536132,4,Chorizo & White Bean Soup,Unilever North America
328,Egg-Drop-Soup-989369,4,Egg Drop Soup,South Beach Diet Recipes
329,30-minute-Healthy-Meatball-Soup-1703943,4,30-minute Healthy Meatball Soup,My Mommy Style
330,Slow-Cooker-Creamy-Potato-Corn-Chowder-1664003,4,Slow Cooker Creamy Potato Corn Chowder,Real Food Whole Life
331,Best-Clam-Chowder-1613536,4,Best Clam Chowder,Reluctant Entertainer
332,Hearty-Vegetable-Soup-1624074,3,Hearty Vegetable Soup,Beachbody
333,Pasta-E-Fagioli-_pasta-And-Beans_-1703010,3,Pasta E Fagioli (pasta And Beans),Gourmet Traveller
334,30-Minute-Lighter-Italian-Wedding-Soup-1473974,4,30-Minute Lighter Italian Wedding Soup,Girl versus Dough
335,PEA-SOUP-629626,3,PEA SOUP,Bea's Cookbook
336,Creamy-Tahini-_-Lemon-asparagus-Soup-_-V-1646668,3,Creamy Tahini & Lemon-asparagus Soup | V,dollyandoatmeal.com
337,Cold-cucumber-soup-_Tarator_-1192944,4,Cold cucumber soup (Tarator),Confessions of a Spoon
338,Slow-Cooker-Cheesy-Potato-Soup-_Recipe-1620655,4,Slow Cooker Cheesy Potato Soup #Recipe,My Favorite Recipes
339,The-Ultimate-Corn-Chowder-In-The-Soup-Maker-1521748,4,The Ultimate Corn Chowder In The Soup Maker,Recipe This
340,Sesame-Ginger-Daikon-Noodle-Soup-with-Bok-Choy_-Snow-Peas-and-Shiitake-Mushrooms-1709658,4,"Sesame-Ginger Daikon Noodle Soup with Bok Choy, Snow Peas and Shiitake Mushrooms",Inspiralized
341,Easy-Tomato-Basil-Soup-962960,4,Easy Tomato Basil Soup,Beauty in the Mess
342,Roasted-Tomato-and-Red-Pepper-Soup-1257190,4,Roasted Tomato and Red Pepper Soup,Deliciously Ella
343,Clam-Chowder-1706857,3,Clam Chowder,Team Beachbody
344,Chicken-Corn-Chowder-1689743,4,Chicken Corn Chowder,Southern Bite
345,Curried-Coconut-Carrot-Soup-1688662,4,Curried Coconut-Carrot Soup,Veggie Souls
346,Creamy-Chicken-Mushroom-Soup-1697772,4,Creamy Chicken Mushroom Soup,Jennifer Meyering
347,Rice-_-Black-Bean-Soup-With-Chorizo-1537301,4,Rice & Black Bean Soup With Chorizo,Unilever North America
348,Avgolemono-Soup-_aka-Greek-Lemon-Chicken-Soup_-1587365,4,Avgolemono Soup (aka Greek Lemon Chicken Soup),Closet Cooking
349,Spinach-Soup-With-Rosemary-Croutons-1705666,3,Spinach Soup With Rosemary Croutons,Everyday Health
350,Cold-Cucumber-Soup-1228335,4,Cold Cucumber Soup,The Healthy Foodie
351,New-England-Clam-Chowder-1703788,4,New England Clam Chowder,Not Starving Yet
352,Summer-Garden-Gazpacho-1698824,3,Summer-Garden Gazpacho,Health
353,Slow-Cooker-Chicken-Noodle-Soup-1687091,4,Slow Cooker Chicken Noodle Soup,Back to the Book Nutriton
354,Pappa-al-Pomodor-1699928,4,Pappa al Pomodor,Souffles and Sawdust
355,Low-Fat-Creamy-Mushroom-Soup-933409,4,Low Fat Creamy Mushroom Soup,Skinnytaste
356,Roasted-Chicken-Bone-Broth-1682809,4,Roasted Chicken Bone Broth,No Fail Recipes
357,Chicken-And-Vegetable-Soup-With-Vermicelli-1663109,4,Chicken And Vegetable Soup With Vermicelli,Everyday healthy recipes
358,Spinach-bisque-slow-cooker-310353,5,Spinach Bisque Slow Cooker,A Year of Slow Cooking
359,Creamy-Spinach-Soup-751247,3,​Creamy Spinach Soup,Kashi
360,Perfect-Potato-Soup-1327377,4,Perfect Potato Soup,The Pioneer Woman
361,Sweet-Corn-Yellow-Tomato-Soup-1640483,4,Sweet Corn Yellow Tomato Soup,Honey And Birch
362,Old-Fashioned-Chicken-Noodle-Soup-1690415,4,Old-Fashioned Chicken Noodle Soup,The Cake Chica
363,Dal-Maharani---No-Onion-Garlic-1702831,4,Dal Maharani - No Onion-Garlic,Simplyvegetarian777
364,Weight-Loss-Wonder-Soup-1643649,4,Weight Loss Wonder Soup,Enjoy cooking
365,Spicy-Thai-Coconut-Soup-1705833,3,Spicy Thai Coconut Soup,PepperScale
366,Roasted-asparagus-soup-333986,5,Roasted Asparagus Soup,Pictures & Pancakes
367,Bulletproof-Bone-Broth-1378930,4,Bulletproof Bone Broth,Rodale Wellness
368,Beefy-Nacho-Soup-1579469,3,Beefy Nacho Soup,Betty Crocker
369,Zucchini-Soup-1697188,4,Zucchini Soup,Ann's Entitled Life
370,Chilled-Carrot-Soup-w_-Coconut-Cream-_-Lemongrass-1707243,4,Chilled Carrot Soup w/ Coconut Cream & Lemongrass,My Paleo Marin
371,Hearty-Tortilla-Soup-1290887,3,Hearty Tortilla Soup,Old El Paso
372,Pumpkin-ginger-soup-345474,5,Pumpkin Ginger Soup,Elana's Pantry
373,Tuscan-Sausage-Soup-1706048,4,Tuscan Sausage Soup,Kathryn Seppamaki
374,Tomato-Soup-_Salmorejo_-1690687,4,Tomato Soup (Salmorejo),Perspective Portions
375,Thai-Chicken-Noodle-Soup-1709211,3,Thai Chicken Noodle Soup,Delicious.
376,Dad_s-cauliflower-soup-352580,5,Dad's Cauliflower Soup,Skinnytaste
377,Ham-and-Split-Pea-Soup-1612185,3,Ham and Split Pea Soup,Food & Wine
378,Beer-cheese-soup-333359,5,Beer Cheese Soup,How Sweet It Is
379,Carrot-ginger-soup-336037,5,Carrot Ginger Soup,Simply Recipes
380,Potato-leek-soup-352367,5,Potato Leek Soup,Skinnytaste
381,Spring-Green-Pea-Soup-1696283,4,Spring Green Pea Soup,Nutrition Stripped
382,Vegetarian-west-african-peanut-soup-345982,5,Vegetarian West African Peanut Soup,Cookie and Kate
383,Celeriac-And-White-Bean-Soup-With-Crispy-Chorizo-And-Glazed-Apple-1707005,3,Celeriac And White Bean Soup With Crispy Chorizo And Glazed Apple,Delicious.
384,Homemade-Potato-Soup-1238052,4,Homemade Potato Soup,Simple Homemaking
385,Creamy-Broccoli-_-Leek-Soup-With-Cheese-1553465,4,Creamy Broccoli & Leek Soup With Cheese,Unilever North America
386,Split-Pea-Soup-1580044,4,Split Pea Soup,Rachel Cooks
387,Slow-Cooker-Chicken-Noodle-Soup-994242,4,Slow Cooker Chicken Noodle Soup,Bobbi's Kozy Kitchen
388,Slow-Cooker-Lentil-Miso-Soup-_Vegan_-1701224,3,Slow-Cooker Lentil Miso Soup [Vegan],One Green Planet
389,Broccoli-and-Cheddar-Soup-Closet-Cooking-54988,5,Roasted Broccoli and Cheddar Soup,Closet Cooking
390,Slow-Cooker-Enchilada-Soup-1699896,4,Slow Cooker Enchilada Soup,12Tomatoes
391,Cauliflower-Cheddar-Soup-1010521,4,Cauliflower Cheddar Soup,Prevention RD
392,Chicken-noodle-soup-345471,5,Chicken Noodle Soup,Elana's Pantry
393,Creamy-Wild-Garlic-Soup-with-Dandelion-Leaves-_vegan_-1663217,4,Creamy Wild Garlic Soup with Dandelion Leaves (vegan),Vienna Sunday Kitchen
394,Dairy-free-pumpkin-soup-_-For-2-1623700,4,Dairy free pumpkin soup | For 2,Pretty Wee Things Blog
395,Cauliflower-Leek-Soup-976135,4,Cauliflower Leek Soup,Green Kitchen Stories
396,Quick-_-Delicious-Cauliflower-Soup-1631502,4,Quick & Delicious Cauliflower Soup,Julie Daniluk
397,Chunky-Crockpot-Tomato-Soup-1697197,4,Chunky Crockpot Tomato Soup,A Mom's Take
398,Udon-miso-noodle-soup-315064,5,Udon Miso Noodle Soup,Steamy Kitchen
399,French-Lentil-Soup-905411,3,French Lentil Soup,Bon Appétit
400,Creamless-Tomato-Soup-1020780,4,Creamless Tomato Soup,Tried and Tasty
401,Strawberry-Gazpacho-1694448,4,Strawberry Gazpacho,Miz Helen's Country Cottage
402,Rosemary-Potato-Soup-with-Crispy-Carrots-1698873,3,Rosemary Potato Soup with Crispy Carrots,Recipe.com
403,THAI-SPICY-TOM-YUM-GOONG-TOMATO-GAZPACHO-1704688,4,THAI SPICY TOM-YUM-GOONG TOMATO GAZPACHO,Lady and Pups
404,Spiced-Carrot-Soup-With-Lime-1689078,3,Spiced Carrot Soup With Lime,New York Times Cooking
405,Slow-Cooker-Potato-Soup-1425308,4,Slow Cooker Potato Soup,Gimme Some Oven
406,Chicken-Soup-with-Homemade-Noodles-1707846,4,Chicken Soup with Homemade Noodles,Cooks&Books&Recipes
407,Cream-of-Mushroom-Soup-Simply-Recipes-42907,5,Cream of Mushroom Soup,Simply Recipes
408,Instant-Pot-Barley-Mushroom-Soup-1705973,4,Instant Pot Barley Mushroom Soup,Skinny Me Recipes
409,Chicken-and-Dumplings-from-Scratch-1572752,4,Chicken and Dumplings from Scratch,Simple Living Mama
410,Easy-Egg-Drop-Soup-1598266,3,Easy Egg Drop Soup,Akron Ohio Moms
411,Pumpkin-Soup-1310493,4,Pumpkin Soup,The Pioneer Woman
412,Cozy-Turkey-and-Pepper-Soup-772030,4,Cozy Turkey and Pepper Soup,
413,Roasted-Butternut-Squash-_-Fennel-Soup-with-Parsley-Oil-1567344,4,Roasted Butternut Squash & Fennel Soup with Parsley Oil,Grab a Plate
414,Roasted-Cauliflower-Soup-with-Cheddar-1620814,4,Roasted Cauliflower Soup with Cheddar,Rachel Cooks
415,Delightful-Butternut-Soup-1542293,3,Delightful Butternut Soup,Halaal Recipes
416,Easy-Homemade-Ramen-779567,4,Easy Homemade Ramen,Damn Delicious
417,Homemade-Creamy-Tomato-Soup-1635479,4,Homemade Creamy Tomato Soup,Rainy Day Gal
418,Matzo-ball-soup-345666,5,Matzo Ball Soup,Elana's Pantry
419,Roasted-Red-Pepper-and-Blue-Crab-Bisque-from-the-Chesapeake-Bay-1708468,4,Roasted Red Pepper and Blue Crab Bisque from the Chesapeake Bay,Chili Pepper Madness
420,CC_s-Greek-Chickpea-Soup-1689615,3,CC's Greek Chickpea Soup,Food Network Canada
421,White-Bean-Soup-755561,3,White Bean Soup,Saveur
422,Creamy-Red-Gazpacho-1687060,4,Creamy Red Gazpacho,Keto Diet
423,Mushroom-Soup-1589363,4,Mushroom Soup,Good food. Best Recipes
424,Savory-Spinach-_-Potato-Soup-1534848,4,Savory Spinach & Potato Soup,Unilever North America
425,Slow-Cooker-Chicken-Tortilla-Soup-1394512,4,Slow Cooker Chicken Tortilla Soup,Dishes and Dust Bunnies
426,Carrot-and-ginger-soup-335553,5,Carrot and Ginger Soup,Baked Bree
427,Cream-of-Broccoli-I-Adore-Food_-200803,4,Cream of Broccoli,I Adore Food!
428,FISH-MAW-SOUP-1701481,4,FISH MAW SOUP,What To Cook Today
429,Won-Ton-Soup-1092047,4,Won Ton Soup,Dinner from the Heart
430,One-Pot-Creamy-Tomato-Tortellini-Soup-1533410,4,One-Pot Creamy Tomato Tortellini Soup,Gal on a Mission
431,Corn-chowder-with-philadelphia-cream-cheese-slow-cooker-310338,5,Corn Chowder with PHILADELPHIA Cream Cheese Slow Cooker,A Year of Slow Cooking
432,Black-Bean-Soup-Once-Upon-A-Chef-200036,5,Black Bean Soup,Once Upon A Chef
433,Cabbage-Soup-Recipe-Tips-1628753,3,Cabbage Soup Recipe Tips,Cabbage Soup Diet 2.0
434,Stuffed-Pepper-Soup-1642139,4,Stuffed Pepper Soup,The Spring Mount Six Pack
435,Creamy-Garlic-Soup-461527,5,Creamy Garlic Soup,Saveur
436,Chicken-Corn-Chowder-1557394,4,Chicken Corn Chowder,Honey And Birch
437,Creamy-Root-Vegetable-Miso-Soup-_Vegan_-1701225,3,Creamy Root Vegetable Miso Soup [Vegan],One Green Planet
438,Fire-roasted-spicy-tomato-soup-334226,5,Fire Roasted Spicy Tomato Soup,The Naptime Chef
439,Chunky-Garden-Gazpacho-1709150,3,Chunky Garden Gazpacho,Emeril
440,Slow-Cooked-French-Onion-Soup-1631272,4,Slow Cooked French Onion Soup,Jessy and Melissa
441,Corn-and-Potato-Soup-_glutenfree-1083494,4,Corn and Potato Soup – #glutenfree,Vegetarian Mamma
442,Slow-Cooker-Meatball-Zoodle-Soup-1629891,4,Slow Cooker Meatball Zoodle Soup,Fit SlowCooker Queen
443,Creamy-carrot-ginger-soup-352026,5,Creamy Carrot Ginger Soup,Skinnytaste
444,Matt-Preston_s-Soup-1630764,3,Matt Preston's Soup,Tenplay
445,Crock-Pot-Chicken-Enchilada-Soup-1696461,4,Crock Pot Chicken Enchilada Soup,Skinnytaste
446,Easy-Slow-Cooker-Taco-Soup-1324556,4,Easy Slow Cooker Taco Soup,Wholesomelicious
447,Split-Pea-Soup-1634140,4,Split Pea Soup,I Can't Believe I Made That!
448,Spicy-Chicken-Miso-Soup-With-A-Poached-Egg-1699984,4,Spicy Chicken Miso Soup With A Poached Egg,GoodFood
449,Black-Bean-Soup-1617986,4,Black Bean Soup,Fit and Fab Living
450,Beef_-Vegetable-and-Barley-Soup-1690410,4,"Beef, Vegetable and Barley Soup",The Cake Chica
451,Rustic-Vegetable-Soup-with-White-Beans-and-Spicy-Herbed-Meatballs-1705085,4,Rustic Vegetable Soup with White Beans and Spicy Herbed Meatballs,The Cozy Apron
452,Easy-Lentil-Spinach-Soup-1694135,4,Easy Lentil Spinach Soup,Veggie Souls
453,Vegetarian-split-pea-soup-308819,5,Vegetarian Split Pea Soup,101 Cookbooks
454,Slow-Cooker-Sausage_-White-Bean-and-Spinach-Soup-1687492,4,"Slow Cooker Sausage, White Bean and Spinach Soup",A Day in Motherhood
455,Ham-and-Bean-Soup-1314465,4,Ham and Bean Soup,Home Sweet Homemade
456,Thai-spiced-pumpkin-soup-308914,5,Thai-spiced Pumpkin Soup,101 Cookbooks
457,Japanese-Mushroom-Soup-1533178,3,Japanese Mushroom Soup,It'sTasty
458,Vegan-French-Onion-Soup-1688526,4,Vegan French Onion Soup,Veggie Souls
459,Cream-Of-Leek-1665923,4,Cream Of Leek,Good food. Best Recipes
460,Tuscan-Soup-1620591,4,Tuscan Soup,Jaque's Kitchen
461,Tomato-Soup-965752,4,Tomato Soup,Oh My Dish
462,Elegant-Chilled-Spring-Pea-Soup-1684758,4,Elegant Chilled Spring Pea Soup,Just a Little Bit of Bacon
463,Roasted-Tomato-and-Shrimp-Gazpacho-1703725,4,Roasted Tomato and Shrimp Gazpacho,Melanie Makes
464,Vegetable-Cheese-Chowder-1688812,4,Vegetable Cheese Chowder,Female Foodie
465,Classic-New-England-Clam-Chowder-1479422,3,Classic New England Clam Chowder,Yankee
466,Easy-Pumpkin-Soup-_glutenfree-_vegan-1083491,4,Easy Pumpkin Soup – #glutenfree #vegan,Vegetarian Mamma
467,20-Minute-Broccoli-Cheese-Soup-1311351,4,20 Minute Broccoli Cheese Soup,Spend with Pennies
468,Coconut-Chicken-Curry-Soup-1699180,4,Coconut Chicken Curry Soup,GoodLife Eats
469,Beet-Gazpacho-1617489,4,Beet Gazpacho,The Essential Baker
470,Broccoli-Soup-994919,3,Broccoli Soup,BBC
471,Chickpea_-Leek-_-Spinach-Soup-1641213,3,"Chickpea, Leek & Spinach Soup",Better Homes and Gardens
472,Lentil-Soup-1292696,4,Lentil Soup,All Food Considered
473,Quick-Tomato-and-Basil-Soup-1627755,3,Quick Tomato and Basil Soup,Berries and Spice
474,Lentil-Soup-1602186,3,Lentil Soup,Blue Zones
475,Quick-_-Easy-Salsa-Verde-Chicken-and-White-Bean-Soup-1683429,4,Quick + Easy Salsa Verde Chicken and White Bean Soup,Root and Revel
476,RecipeCream-of-Broccoli-Soup-1623365,3,RecipeCream of Broccoli Soup,Joy Bauer
477,Creamy-Carrot-Pumpkin-Soup-1688692,4,Creamy Carrot Pumpkin Soup,Veggie Souls
478,Skinny-Thai-Chicken-Soup-1704857,3,Skinny Thai Chicken Soup,Betty Crocker
479,Ham-and-Poato-Soup-1187964,4,Ham and Poato Soup,Panlasang Pinoy
480,Creamy-Parsnip-Soup-In-The-Soup-Maker-1521250,4,Creamy Parsnip Soup In The Soup Maker,Recipe This
481,How-To-Make-Chicken-Broth-In-A-Crock-Pot-1698534,4,How To Make Chicken Broth In A Crock Pot,So Let's Hang Out
482,Meatball-Soup-1276981,4,Meatball Soup,That Girl Shannon
483,Butternut-Pumpkin-Soup-1092086,4,Butternut Pumpkin Soup,weightloss.com.au
484,Leek-Potato-and-Fennel-Soup-1688681,4,Leek Potato and Fennel Soup,Veggie Souls
485,Chicken-Bacon-Crock-Pot-Chowder-1697722,4,Chicken Bacon Crock Pot Chowder,"Peace, Love and Low Carb"
486,How-to-Clarify-Stock-1559209,4,How to Clarify Stock,Served From Scratch
487,New-Potato-Chicken-Soup-1685380,4,New Potato Chicken Soup,Reluctant Entertainer
488,New-England-Clam-Chowder-1690412,4,New England Clam Chowder,The Cake Chica
489,Creamy-Zucchini-Soup-1698674,4,Creamy Zucchini Soup,Olga's Flavor Factory
490,Garlic-soup-345089,5,Garlic Soup,Lottie + Doof
491,Cheeseburger-and-Fries-Chowder-1684768,4,Cheeseburger and Fries Chowder,Mantitlement
492,Hungarian-Cherry-Soup-_Cold-Sour-Cherry-Soup_-1703812,4,Hungarian Cherry Soup (Cold Sour Cherry Soup),Love Food Life Alchemy
493,Homemade-Bone-Broth-1653885,4,Homemade Bone Broth,Kale Cuties
494,Cleansing-Detox-Soup-_Vegan_-1534836,3,Cleansing Detox Soup [Vegan],One Green Planet
495,Cauliflower_-Coconut-_-Lime-Soup-1119690,4,"Cauliflower, Coconut & Lime Soup",Coconut and Berries
496,Quick-Chicken-Tortilla-Soup-1663750,3,Quick Chicken Tortilla Soup,Pillsbury.com
497,New-Orleans-SHRIMP-and-ARTICHOKE-SOUP-1636106,4,New Orleans SHRIMP and ARTICHOKE SOUP,52 Ways to Cook
498,Spinach-stracciatella-soup-with-orzo-351993,5,Spinach Stracciatella Soup with Orzo,Skinnytaste
499,Chilled-Avocado-Soup-with-Grilled-Chili-Spiced-Shrimp-1701737,4,Chilled Avocado Soup with Grilled Chili Spiced Shrimp,Suburban Soapbox
