id,rating,bitter,meaty,piquant,salty,sour,sweet,cookTimeInSeconds,ingredientCount,numberOfServings,prepTimeInSeconds,totalTimeInSeconds,ingredient_list,course
French-Toast-Sticks-1705316,4,,,,,,,1200.0,7,4,300.0,1500,"[Texas toast bread, eggs, heavy cream, vanilla extract, cinnamon, sugar, butter]",Breakfast_Brunch
French-Toast-Waffles-1110520,4,,,,,,,,6,4,,1200,"[large eggs, whole milk, maple syrup, vanilla, salt, day old bread]",Breakfast_Brunch
French-Toast-With-Banana-And-Caramel-Sauce-1707040,4,0.666666666667,0.166666666667,0.0,0.833333333333,0.166666666667,0.5,,9,4,,1200,"[bread, medium eggs, milk, sugar, butter, brown sugar, water, bananas]",Breakfast_Brunch
French-Toast-with-Grand-Marnier-and-Warm-Berry-Compote-1690269,4,,,,,,,,13,4,,2400,"[fresh orange juice, granulated sugar, dark rum, corn starch, water, frozen mixed berries, large eggs, whole milk, gran marnier, vanilla extract, brioche, melted butter]",Breakfast_Brunch
French-Toast-with-Strawberries-1270296,4,0.166666666667,0.166666666667,0.0,0.166666666667,0.833333333333,0.333333333333,,5,4,,1500,"[eggs, skim milk, whole wheat bread, strawberries, powdered sugar]",Breakfast_Brunch
French-Toast-with-Vegan-Nog-964692,4,,,,,,,,7,4,,1800,"[soy, chia seeds, vanilla extract, gluten free all purpose flour, gluten-free bread, maple syrup, coconut oil]",Breakfast_Brunch
French-Vanilla-Chocolate-Chip-Breakfast-Oat-Bars-1565414,4,0.833333333333,0.333333333333,0.0,0.666666666667,0.166666666667,0.666666666667,,8,4,,3000,"[oats, sugar, baking powder, salt, chocolate chips, coffee, creamer, eggs]",Breakfast_Brunch
French-omelets-368530,4,0.666666666667,0.833333333333,0.333333333333,0.333333333333,0.5,0.166666666667,,5,1,,1200,"[eggs, butter, gruyere cheese, ground pepper, chopped parsley]",Breakfast_Brunch
French-toast-365422,5,,,,,,,600.0,7,4,900.0,1500,"[milk, day old bread, eggs, cinnamon, butter, maple syrup, berries]",Breakfast_Brunch
French-toasted-egg-in-a-hole-365383,5,0.833333333333,0.666666666667,0.0,0.833333333333,0.166666666667,0.166666666667,300.0,6,2,300.0,600,"[eggs, milk, salt, pepper, butter, bread]",Breakfast_Brunch
Fresh-Herb-Omelet-and-Lavender-Roasted-Potatoes-1679724,4,,,,,,,300.0,7,1,600.0,900,"[large eggs, milk, unsalted butter, freshly ground black pepper, fresh herbs, havarti cheese, lavender]",Breakfast_Brunch
Fresh-Tomato-Omelets-with-Mozzarella-Cheese-630059,3,0.5,0.5,0.0,0.5,0.166666666667,0.166666666667,,7,2,,900,"[eggs, salt, ground black pepper, nonstick spray, fresh oregano, sliced tomatoes, shredded mozzarella cheese]",Breakfast_Brunch
Fried-Bread-_British-Style_-1053884,4,0.833333333333,0.5,0.0,0.833333333333,0.166666666667,0.166666666667,,5,4,,1500,"[bacon, bread, eggs, salt, pepper]",Breakfast_Brunch
Frittata-Lyonnaise-1705620,4,0.666666666667,0.833333333333,0.0,0.833333333333,0.166666666667,0.166666666667,1500.0,12,4,300.0,1800,"[sausages, bacon, red potato, onions, garlic, eggs, grated Gruyère cheese, half & half, fresh parsley, salt, pepper, olive oil]",Breakfast_Brunch
Frozen-Healthy-Breakfast-Burritos-1634592,4,0.5,0.5,0.5,0.666666666667,0.833333333333,0.166666666667,,8,10,,2400,"[eggs, skim milk, red pepper, green pepper, onions, turkey sausage, reduced fat cheddar cheese, whole wheat tortillas]",Breakfast_Brunch
Fruit-_-Nut-Breakfast-Tarts-1511932,4,0.166666666667,0.166666666667,0.0,0.166666666667,0.166666666667,0.833333333333,600.0,9,6,300.0,900,"[dates, honey, coconut oil, rolled oats, chia seeds, flax seeds, greek yogurt, mixed fruit, sliced almonds]",Breakfast_Brunch
Fruitful-Morning-Muesli-760983,4,,,,,,,,5,4,,1500,"[Quaker Oats, apple juice, sliced fresh fruit, chopped nuts, vanilla]",Breakfast_Brunch
Fruity-Pebbles-Confetti-Pancakes-1054268,3,,,,,,,,7,5,,1800,"[Fruity Pebbles Cereal, flour, baking powder, eggs, milk, low-fat vanilla yogurt, strawberries]",Breakfast_Brunch
Fruity-Whole-Grain-Breakfast-Porridge-1706525,3,,,,,,,,12,8,900.0,33300,"[steel-cut oats, wild rice, pearl barley, cinnamon sticks, orange peel, raw honey, sea salt, dried apricot, unsweetened dried cranberries, water, walnuts, unsweetened almond milk]",Breakfast_Brunch
Fruity-Whole-Grain-Breakfast-Porridge-1706525,3,,,,,,,,12,8,900.0,33300,"[steel-cut oats, wild rice, pearl barley, cinnamon sticks, orange peel, raw honey, sea salt, dried apricot, unsweetened dried cranberries, water, walnuts, unsweetened almond milk]",Breakfast_Brunch
Fruity-Whole-Grain-Breakfast-Porridge-1706525,3,,,,,,,,12,8,900.0,33300,"[steel-cut oats, wild rice, pearl barley, cinnamon sticks, orange peel, raw honey, sea salt, dried apricot, unsweetened dried cranberries, water, walnuts, unsweetened almond milk]",Breakfast_Brunch
Fruity-Whole-Grain-Breakfast-Porridge-1706525,3,,,,,,,,12,8,900.0,33300,"[steel-cut oats, wild rice, pearl barley, cinnamon sticks, orange peel, raw honey, sea salt, dried apricot, unsweetened dried cranberries, water, walnuts, unsweetened almond milk]",Breakfast_Brunch
Full-english-breakfast-recipe-306011,5,,,,,,,,13,8,,3000,"[black, sausages, bacon, cherry tomatoes, baked beans, whole wheat bread, butter, maple syrup, eggs, button mushrooms, olive oil, salt, pepper]",Breakfast_Brunch
Funfetti-Waffles-1704310,4,,,,,,,900.0,9,6,300.0,1200,"[flour, sugar, baking powder, salt, eggs, milk, vegetable oil, pure vanilla extract, rainbow sprinkles]",Breakfast_Brunch
GLUTEN-FREE-BANANA-PANCAKES-_IN-A-BLENDER_-1687320,4,0.5,0.166666666667,0.0,0.166666666667,0.333333333333,0.5,,6,2,,1200,"[rolled oats, almond flour, baking powder, sea salt, bananas, almond milk]",Breakfast_Brunch
Garden-veggie-frittata-with-chives-and-parmesan-309642,4,,,,,,,,7,6,,2100,"[eggs, olive oil, veggies, Spike Seasoning, ground pepper, chives, grated parmesan cheese]",Breakfast_Brunch
Garlic-Fried-Eggs-with-Kale-Pesto_-Toast-Points_-and-Lemon-Bacon-Vinaigrette-1706511,4,0.5,0.833333333333,0.0,0.833333333333,0.833333333333,0.166666666667,900.0,16,2,900.0,1800,"[garlic, kale, pinenuts, olive oil, kosher salt, bacon, lemon, bacon fat, ground black pepper, unsalted butter, white bread, butter, eggs]",Breakfast_Brunch
Garlic-Spinach_-Millet_-and-Eggs-1707658,4,0.833333333333,0.666666666667,0.0,0.666666666667,0.333333333333,0.166666666667,,10,2,,2100,"[millet, sea salt, black pepper, unsalted butter, garlic, spinach, large eggs, hummus, olive oil]",Breakfast_Brunch
German-Pancake-Gluten-Free-1631689,4,0.166666666667,0.166666666667,0.0,0.166666666667,0.666666666667,0.333333333333,1200.0,7,2,600.0,1800,"[large eggs, whole milk, gluten free all purpose flour, salt, unsalted butter, fresh lemon, powdered sugar]",Breakfast_Brunch
German-Pancakes-1257775,4,0.166666666667,0.5,0.0,0.166666666667,0.166666666667,0.166666666667,,6,4,,2100,"[eggs, milk, flour, salt, vanilla, butter]",Breakfast_Brunch
German-Pancakes-1273823,4,0.333333333333,0.333333333333,0.0,0.666666666667,0.166666666667,0.166666666667,,5,4,,2400,"[butter, eggs, milk, flour, salt]",Breakfast_Brunch
German-Pancakes-1617106,4,0.166666666667,0.5,0.0,0.166666666667,0.0,0.166666666667,1500.0,6,4,300.0,1800,"[whole milk, all-purpose flour, large eggs, vanilla extract, salt, unsalted butter]",Breakfast_Brunch
German-Pancakes-1712465,4,0.333333333333,0.333333333333,0.0,0.666666666667,0.166666666667,0.166666666667,,5,4,,2100,"[eggs, milk, flour, salt, butter]",Breakfast_Brunch
German-Pancakes-in-the-Slow-Cooker-1048420,4,0.333333333333,0.5,0.0,0.666666666667,0.166666666667,0.166666666667,,5,6,,3600,"[flour, milk, eggs, salt, melted butter]",Breakfast_Brunch
Gingerbread-Pancakes-1682411,4,0.833333333333,0.166666666667,0.0,0.5,0.166666666667,0.5,,11,4,,1200,"[non dairy milk, egg whites, blackstrap molasses, chia seeds, gluten, stevia, chickpea flour, gluten-free baking powder, ground cinnamon, ground ginger, ground cloves]",Breakfast_Brunch
Gingerbread-Waffles-1680923,4,0.833333333333,0.166666666667,0.0,0.833333333333,0.166666666667,0.833333333333,900.0,14,4,600.0,1500,"[all-purpose flour, ground cinnamon, ground ginger, ground cloves, grated nutmeg, baking powder, baking soda, table salt, milk, molasses, dark brown sugar, granulated sugar, large eggs, butter]",Breakfast_Brunch
Gluten-Free-Almond-Flour-Waffles-661872,4,0.166666666667,0.833333333333,0.0,0.833333333333,0.166666666667,0.666666666667,,7,7,,2400,"[blanched almond flour, salt, baking soda, ground cinnamon, eggs, vanilla extract, honey]",Breakfast_Brunch
Gluten-Free-Belgian-Waffles-with-Buttermilk-Syrup-1682921,4,0.166666666667,0.166666666667,0.0,0.166666666667,0.166666666667,0.666666666667,,10,4,,2100,"[large eggs, gluten free all purpose flour, xanthan gum, milk, coconut oil, butter, sugar, buttermilk, glutenfree vanilla, baking soda]",Breakfast_Brunch
Gluten-Free-Blender-Pancakes-1613251,4,0.833333333333,0.166666666667,0.0,0.833333333333,0.166666666667,0.5,600.0,6,6,300.0,900,"[pancake mix, milk, eggs, coconut oil, pure maple syrup, chocolate chips]",Breakfast_Brunch
Gluten-Free-Blueberry-Protein-Pancakes-1698419,4,0.666666666667,0.833333333333,0.0,0.666666666667,0.166666666667,0.333333333333,,13,14,,1800,"[extra large eggs, safflower oil, vanilla extract, splenda, low-fat buttermilk, sea salt, baking soda, baking powder, gluten, whey protein powder, frozen blueberries]",Breakfast_Brunch
Gluten-Free-Blueberry-Walnut-Banana-Pancakes-1709982,4,0.166666666667,0.166666666667,0.0,0.166666666667,0.333333333333,0.666666666667,,9,1,,1500,"[nonstick spray, bananas, large eggs, coconut oil, cinnamon, baking powder, blueberries, chopped walnuts, pure maple syrup]",Breakfast_Brunch
Gluten-Free-Buckwheat-and-Rice-Porridge-1693646,4,,,,,,,,4,4,,900,"[buckwheat flakes, rice, mashed banana, chia seeds]",Breakfast_Brunch
Gluten-Free-Buttermilk-Pancakes-1591869,4,0.666666666667,0.166666666667,0.0,0.666666666667,0.166666666667,0.5,,8,10,1500.0,1500,"[gluten free all purpose flour, granulated sugar, baking powder, salt, eggs, buttermilk, canola oil, pure vanilla]",Breakfast_Brunch
Gluten-Free-Chocolate-Chip-Protein-Pancakes-1581172,4,,,,,,,900.0,5,3,300.0,1200,"[oats, cottage cheese, egg whites, chocolate chips, cooking spray]",Breakfast_Brunch
Gluten-Free-Coconut-Flour-Waffles-1680213,3,0.5,0.833333333333,0.0,0.666666666667,0.166666666667,0.666666666667,,6,4,,300,"[butter, coconut flour, eggs, applesauce, honey, salt]",Breakfast_Brunch
Gluten-Free-Crepes-1065733,4,0.166666666667,0.166666666667,0.0,0.166666666667,0.166666666667,0.333333333333,,5,8,,1800,"[eggs, coconut oil, honey, gluten free oat flour, almond milk]",Breakfast_Brunch
Gluten-Free-Dutch-Baby-with-Blueberry-Maple-Syrup-1702716,4,0.166666666667,0.333333333333,0.0,0.166666666667,0.166666666667,0.666666666667,1200.0,11,4,600.0,1800,"[fresh blueberries, maple syrup, large eggs, gluten-free rolled oats, whole milk, baking powder, pure vanilla extract, ground cardamom, kosher salt, unsalted butter, sugar]",Breakfast_Brunch
Gluten-Free-French-Toast-1068884,4,0.333333333333,0.5,0.0,0.5,0.166666666667,0.166666666667,600.0,7,6,300.0,900,"[milk, salt, nutmeg, cinnamon, vanilla, eggs, oil]",Breakfast_Brunch
Gluten-Free-Pancakes-1208533,4,0.833333333333,0.666666666667,0.0,0.833333333333,0.166666666667,0.5,,7,4,,1500,"[gluten free all purpose flour, baking powder, salt, almond milk, eggs, olive oil, honey]",Breakfast_Brunch
Gluten-Free-Pancakes-541642,3,0.333333333333,0.166666666667,0.0,0.166666666667,0.0,0.166666666667,,4,3,,1500,"[gluten-free flour, eggs, low-fat milk, butter]",Breakfast_Brunch
Gluten-Free-Pancakes-On-A-Stick-_Made-With-Almond-Flour_-1712051,3,,,,,,,1320.0,12,9,300.0,1620,"[almond flour, baking soda, salt, whole milk, eggs, pure vanilla extract, raspberries, blueberries, fruit, strawberries, bananas, sweetener]",Breakfast_Brunch
Gluten-Free-Ricotta-Lemon-Pancakes-479308,4,0.166666666667,0.5,0.0,0.166666666667,0.833333333333,0.166666666667,,4,6,,1200,"[ricotta cheese, eggs, lemon, salt]",Breakfast_Brunch
Gluten-Free-Veggie-Breakfast-Bakes-1528332,4,0.333333333333,0.166666666667,0.0,0.166666666667,0.833333333333,0.166666666667,,6,4,,2400,"[mushrooms, garlic cloves, tomatoes, spinach, eggs, olive oil]",Breakfast_Brunch
Gluten-Free-Waffles-1629571,4,,,,,,,,9,9,,1800,"[gluten free blend, ground flax, cane sugar, sea salt, gluten-free baking powder, eggs, melted butter, glutenfree vanilla, milk]",Breakfast_Brunch
Gma_s-Featherlight-Pancakes-1016140,4,0.833333333333,0.166666666667,0.0,0.833333333333,0.166666666667,0.5,,7,4,,1800,"[all-purpose flour, baking powder, sugar, salt, eggs, milk, oil]",Breakfast_Brunch
Go-To-Vegan-Pancakes-1596915,3,0.833333333333,0.166666666667,0.0,0.833333333333,0.333333333333,0.333333333333,,8,6,,1800,"[unbleached all-purpose flour, sugar, baking powder, salt, non dairy milk, apple cider vinegar, coconut oil, vanilla extract]",Breakfast_Brunch
Golden-Spice-Pancakes-481155,4,0.833333333333,0.166666666667,0.0,0.833333333333,0.833333333333,0.5,900.0,11,10,300.0,1200,"[whole wheat flour, unbleached flour, baking powder, baking soda, salt, cinnamon, nutmeg, ground cloves, orange rind, orange juice, golden raisins]",Breakfast_Brunch
Good-For-You-Overnight-Oats-1621700,4,,,,,,,,8,2,,1200,"[rolled oats, coconut milk, chia seeds, flax seeds, mashed banana, strawberries, blueberries, vanilla protein powder]",Breakfast_Brunch
Good-Old-Fashioned-Pancakes-604249,3,0.833333333333,0.166666666667,0.0,0.833333333333,0.166666666667,0.333333333333,,8,4,,1800,"[all-purpose flour, baking powder, salt, white sugar, milk, eggs, butter]",Breakfast_Brunch
Gooey-Baked-Cacao-Oatmeal-623228,3,,,,,,,,6,4,,2100,"[oats, almond milk, bananas, baking powder, vanilla extract, cacao powder]",Breakfast_Brunch
Gorgonzola-Scramble-1621049,4,0.666666666667,0.833333333333,0.0,0.666666666667,0.5,0.166666666667,,5,4,,1500,"[eggs, 2% reduced-fat milk, gorgonzola, spinach, olive oil]",Breakfast_Brunch
Grain-Free-Applesauce-Pancakes-1062467,4,0.666666666667,0.5,0.0,0.333333333333,0.166666666667,0.5,900.0,6,2,300.0,1200,"[eggs, applesauce, almond meal, baking powder, vanilla extract, maple syrup]",Breakfast_Brunch
Grain-Free-Buttermilk-Pancakes-1680220,4,0.333333333333,0.5,0.0,0.666666666667,0.166666666667,0.833333333333,,6,4,,1800,"[coconut flour, baking soda, cinnamon, buttermilk, eggs, raw honey]",Breakfast_Brunch
Grandma-Donna_s-Sourdough-Pancakes-1570464,4,0.833333333333,0.333333333333,0.0,0.833333333333,0.166666666667,0.5,,7,4,,600,"[sourdough starter, eggs, oil, sugar, salt, baking soda, milk]",Breakfast_Brunch
Grandma-Rocks-Secret-Pancake-1690204,4,0.833333333333,0.166666666667,0.0,0.833333333333,0.166666666667,0.333333333333,,8,4,,1800,"[flour, sugar, salt, baking powder, eggs, milk, vegetable oil, vanilla]",Breakfast_Brunch
Granola-Clusters-For-Real_-1708614,4,0.833333333333,0.833333333333,0.0,0.166666666667,0.0,0.5,2400.0,6,4,600.0,3000,"[oats, nuts, maple syrup, coconut oil, salt, vanilla]",Breakfast_Brunch
Greek-Omelet-with-Feta-1617849,3,,,,,,,1200.0,7,4,1200.0,2400,"[baby spinach leaves, purple onion, minced garlic, tomatoes, eggs, fat free milk, Athenos Traditional Crumbled Feta Cheese]",Breakfast_Brunch
Greek-Style-Eggs-with-Tomato-with-Feta-Cheese-_aka-Kagianas-or-Strapatsada_-1683758,3,0.5,0.666666666667,0.5,0.5,0.5,0.166666666667,,9,4,,1800,"[tomatoes, eggs, sea salt, ground pepper, sugar, thyme, oregano, extra-virgin olive oil, feta cheese]",Breakfast_Brunch
Greek-Yogurt-Blueberry-Pancakes-747400,4,0.166666666667,0.166666666667,0.0,0.666666666667,0.166666666667,0.333333333333,,5,6,,1500,"[plain greek yogurt, eggs, flour, baking soda, fresh blueberries]",Breakfast_Brunch
Greek-Yogurt-Breakfast-Bark-1568935,4,0.166666666667,0.166666666667,0.0,0.0,0.333333333333,0.5,,5,6,600.0,7800,"[plain greek yogurt, maple syrup, granola, blueberries, strawberries]",Breakfast_Brunch
Greek-Yogurt-Breakfast-Bowl-with-Blueberries-and-Pumpkin-Seeds-1030029,4,0.166666666667,0.166666666667,0.0,0.166666666667,0.166666666667,0.5,,5,4,,900,"[greek yogurt, blueberries, chia seeds, ground flaxseed, pumpkin seeds]",Breakfast_Brunch
Greek-Yogurt-Pancakes-1047007,4,0.166666666667,0.166666666667,0.0,0.833333333333,0.0,0.166666666667,,4,4,,1500,"[plain greek yogurt, eggs, flour, baking soda]",Breakfast_Brunch
Greek-Yogurt-Pancakes-1541785,4,,,,,,,600.0,6,5,300.0,900,"[large eggs, milk, greek yogurt, baking powder, all-purpose flour, coconut oil]",Breakfast_Brunch
Greek-Yogurt-Pancakes-1681804,4,0.333333333333,0.166666666667,0.0,0.666666666667,0.166666666667,0.5,900.0,13,4,300.0,1200,"[all-purpose flour, baking powder, sugar, salt, oil, eggs, vanilla, plain greek yogurt, milk, powdered sugar, honey, fruit, syrup]",Breakfast_Brunch
Greek-Yogurt-Pancakes-1702014,4,0.166666666667,0.166666666667,0.0,0.833333333333,0.166666666667,0.5,,5,4,,1500,"[nonfat greek yogurt, large eggs, flour, baking soda, fresh blueberries]",Breakfast_Brunch
Greek-Yogurt-Pancakes-473152,5,,,,,,,,5,91,600.0,1500,"[nonfat greek yogurt, large eggs, Gold Medal All Purpose Flour, baking soda, fresh blueberries]",Breakfast_Brunch
Greek-Yogurt-Pancakes-544511,4,0.333333333333,0.166666666667,0.0,0.833333333333,0.166666666667,0.166666666667,,4,2,,1500,"[greek yogurt, eggs, flour, baking soda]",Breakfast_Brunch
Greek-Yogurt-Pancakes-_-2-Smartpoints-_-1634276,4,0.166666666667,0.166666666667,0.0,0.833333333333,0.166666666667,0.5,,5,2,,1500,"[nonfat greek yogurt, large eggs, all-purpose flour, baking soda, fresh blueberries]",Breakfast_Brunch
Greek-Yogurt-Parfait-1596593,4,0.166666666667,0.166666666667,0.0,0.166666666667,0.166666666667,0.5,,4,4,,300,"[greek yogurt, vanilla extract, granola, fruit]",Breakfast_Brunch
Greek-Yogurt-Waffles-1053120,4,0.666666666667,0.166666666667,0.0,0.5,0.166666666667,0.166666666667,900.0,7,4,600.0,1500,"[eggs, milk, plain greek yogurt, sugar syrup, flour, baking powder, salt]",Breakfast_Brunch
Greek-Yogurt-Waffles-1599225,4,0.666666666667,0.166666666667,0.0,0.5,0.166666666667,0.166666666667,900.0,7,4,600.0,1500,"[eggs, milk, plain greek yogurt, sugar syrup, flour, baking powder, salt]",Breakfast_Brunch
Greek-yogurt-with-berries_-nuts-and-honey-352045,5,0.166666666667,0.166666666667,0.0,0.166666666667,0.5,0.833333333333,,4,4,,120,"[nonfat plain greek yogurt, honey, berries, walnuts]",Breakfast_Brunch
Green-Chile-and-Cheese-Egg-Bake-473092,5,0.666666666667,0.666666666667,0.833333333333,0.666666666667,0.833333333333,0.166666666667,,7,8,900.0,900,"[green chile, sharp cheddar cheese, large eggs, milk, all-purpose flour, salt, bacon]",Breakfast_Brunch
Green-Eggs-for-Breakfast-502301,4,0.833333333333,0.333333333333,0.0,0.833333333333,0.666666666667,0.166666666667,,6,4,,1500,"[eggs, frozen spinach, shallots, butter, salt, pepper]",Breakfast_Brunch
Green-Smoothie-Pancakes-1069141,3,0.166666666667,0.166666666667,0.0,0.166666666667,0.333333333333,0.5,,7,5,,1200,"[fresh spinach, unsweetened vanilla almond milk, ground flax, peanut butter, bananas, maple syrup, buttermilk]",Breakfast_Brunch
Green-Veggie-Frittata-1697495,4,0.333333333333,0.166666666667,0.5,0.666666666667,0.833333333333,0.166666666667,0.0,10,8,0.0,1800,"[eggs, coconut milk, spinach, onions, green pepper, zucchini, dried parsley, salt, garlic powder, coconut oil]",Breakfast_Brunch
Greens-for-Breakfast-990688,4,,,,,,,600.0,7,4,120.0,720,"[greens, eggs, grating cheese, olive oil, salt, pepper, crushed red pepper flakes]",Breakfast_Brunch
Grilled-Egg-Stuffed-Peppers-1629032,4,0.166666666667,0.333333333333,0.666666666667,0.166666666667,0.833333333333,0.166666666667,1800.0,8,8,600.0,2400,"[bell pepper, eggs, fresh spinach leaves, skim milk, garlic powder, onion powder, italian seasoning, sharp cheddar cheese]",Breakfast_Brunch
Grilled-French-Toast-1692821,4,,,,,,,,14,4,,2100,"[strawberry jam, fresh blueberries, water, lemon juice, sugar, cream cheese, compote, eggs, milk, cinnamon, ginger, french bread, syrup]",Breakfast_Brunch
Grilled-French-Toast-Skewers-1697146,4,,,,,,,900.0,7,4,600.0,1500,"[cubed bread, eggs, milk, vanilla, cinnamon, syrup, fruit]",Breakfast_Brunch
Grilled-French-Toast-Stuffed-with-Strawberry-Basil-Cream-Cheese-1632392,4,0.166666666667,0.166666666667,0.0,0.166666666667,0.833333333333,0.5,600.0,10,6,900.0,1500,"[cream cheese, preserves, challa, large eggs, whole milk, honey, pure vanilla extract, blueberries, raspberries, strawberries]",Breakfast_Brunch
Grits-and-Sausage-Casserole-1693447,4,0.166666666667,0.166666666667,0.0,0.666666666667,0.166666666667,0.166666666667,1800.0,7,4,1200.0,3000,"[ground pork sausage, water, salt, quickcooking grits, shredded sharp cheddar cheese, cream cheese, black pepper]",Breakfast_Brunch
Gyeran-Mari-_Korean-Egg-Roll_-_-1700870,4,,,,,,,600.0,7,4,600.0,1200,"[eggs, salt, green onions, red chili peppers, carrots, spam, cooking oil]",Breakfast_Brunch
HOOTENANNY-or-Oven-Pancake-1066732,4,0.166666666667,0.666666666667,0.0,0.5,0.166666666667,0.166666666667,,5,4,,2400,"[white flour, milk, eggs, salt, butter]",Breakfast_Brunch
HOW-TO-MAKE-THE-PERFECT-OMELETTE-1699564,4,0.833333333333,0.833333333333,0.0,0.833333333333,0.166666666667,0.166666666667,,5,1,,600,"[eggs, salt, black pepper, butter, grated Gruyère cheese]",Breakfast_Brunch
Ham-And-Egg-Cups-1696308,4,,,,,,,900.0,7,12,600.0,1500,"[ham, eggs, whole milk, spring onions, bacon, grating cheese, vegetables]",Breakfast_Brunch
Ham-Bird_s-Nests-1048521,4,,,,,,,,7,12,,3300,"[cooking spray, hash brown potatoes, milk, eggs, diced ham, shredded cheddar cheese, shredded swiss cheese]",Breakfast_Brunch
Ham-Egg-and-Cheese-Muffin-Cups-1117615,4,0.833333333333,0.833333333333,0.0,0.833333333333,0.166666666667,0.166666666667,,6,4,,2100,"[cooked ham, eggs, milk, seasoning salt, ground black pepper, sharp cheddar cheese]",Breakfast_Brunch
Ham-Mashed-Potato-Breakfast-Cups-1683422,4,0.833333333333,0.166666666667,0.5,0.833333333333,0.5,0.166666666667,,5,6,,1800,"[ham, mashed potatoes, scallions, shredded sharp cheddar cheese, paprika]",Breakfast_Brunch
Ham-_-Cheese-Omelette-772447,4,0.833333333333,0.833333333333,0.166666666667,0.833333333333,0.166666666667,0.166666666667,,7,2,,1500,"[eggs, milk, sharp cheddar cheese, ham, butter, freshly ground pepper, salt]",Breakfast_Brunch
Ham-and-Asparagus-Quiche-Cups-1553398,4,0.5,0.666666666667,0.0,0.666666666667,0.166666666667,0.166666666667,,8,4,,3000,"[flour, butter, ice water, eggs, ricotta cheese, ham, asparagus, shredded cheddar cheese]",Breakfast_Brunch
Ham-and-Cheese-Hash-Brown-Casserole-1581302,4,0.833333333333,0.5,0.0,0.833333333333,0.333333333333,0.166666666667,,6,11,,4500,"[frozen hash brown potatoes, diced ham, condensed cream of potato soup, sour cream, shredded sharp cheddar cheese, grated parmesan cheese]",Breakfast_Brunch
Ham-and-Cheese-Potato-Pancakes-1568472,4,0.5,0.166666666667,0.0,0.5,0.833333333333,0.166666666667,,12,6,,1500,"[potatoes, onions, chives, all-purpose flour, cooked ham, cheddar cheese, salt, pepper, eggs, vegetable oil, applesauce, sour cream]",Breakfast_Brunch
Ham-and-Cheese-Waffles-1706765,3,,,,,,,600.0,14,4,600.0,1800,"[all-purpose flour, gruyere cheese, deli ham, grated parmesan cheese, baking powder, sugar, kosher salt, freshly ground black pepper, milk, unsalted butter, vegetable oil, large eggs, scallions, waffle]",Breakfast_Brunch
Ham-and-Egg-Cupcakes-for-Breakfast-979905,4,0.833333333333,0.833333333333,0.0,0.833333333333,0.166666666667,0.166666666667,1500.0,5,12,300.0,1800,"[large eggs, salt, pepper, diced ham, shredded cheese]",Breakfast_Brunch
Ham-and-egg-crepe-squares-368803,5,0.5,0.5,0.0,0.833333333333,0.166666666667,0.166666666667,,9,9,,3300,"[flour, sugar, salt, milk, large eggs, melted butter, ham, eggs, fresh parsley]",Breakfast_Brunch
Ham_-Cheese_-and-Spinach-Breakfast-Quinoa-Cups-1028290,4,,,,,,,,7,4,,2400,"[cooked quinoa, medium eggs, shredded cheese, cooked ham, spinach, pepper, salt]",Breakfast_Brunch
Ham_-Egg-and-Cheese-Breakfast-Cupcakes-1222942,4,0.833333333333,0.666666666667,0.0,0.833333333333,0.166666666667,0.166666666667,,6,12,,1800,"[eggs, milk, diced ham, cheddar cheese, pepper, scallions]",Breakfast_Brunch
Handful-of-Spinach-and-Eggs-Over-Easy-1340151,4,0.333333333333,0.666666666667,0.0,0.166666666667,0.166666666667,0.166666666667,300.0,3,1,,300,"[eggs, baby spinach, butter oil]",Breakfast_Brunch
Hash-Brown-Breakfast-Cups-1048703,4,0.5,0.166666666667,0.0,0.333333333333,0.833333333333,0.166666666667,,7,4,,2700,"[potatoes, egg whites, salt, pepper, parsley, eggs, oil]",Breakfast_Brunch
Hash-Brown-Cups-1689300,4,0.833333333333,0.5,0.0,0.833333333333,0.666666666667,0.166666666667,,5,12,,3900,"[hash brown, salt, eggs, olive oil, mild cheddar cheese]",Breakfast_Brunch
Hash-Brown-Potato-Pie-A-great-Sunday-breakfast_-1546192,4,0.833333333333,0.833333333333,0.0,0.833333333333,0.333333333333,0.166666666667,,7,5,,3300,"[large eggs, milk, Ore-Ida® Country Style Hash Browns, green onions, salt, sharp cheddar cheese, bacon]",Breakfast_Brunch
Hash-Browns-Martha-Stewart-196021,4,,,,,,,,6,4,,2100,"[olive oil, butter, onions, potatoes, pepper, salt]",Breakfast_Brunch
Hashbrown-and-Bacon-Frittata-1631074,4,0.166666666667,0.5,0.0,0.166666666667,0.5,0.166666666667,900.0,8,6,300.0,1200,"[bacon, oil, potatoes, onions, garlic, parsley, pepper, eggs]",Breakfast_Brunch
Health-Proof-Your-Morning-with-this-Dragon-Fruit-Chia-Oats-Breakfast-1257498,3,0.333333333333,0.166666666667,0.0,0.166666666667,0.833333333333,0.5,,6,4,,900,"[oats, chia seeds, almond milk, pitaya, frozen banana, blueberries]",Breakfast_Brunch
Healthier-Homemade-Granola-1200383,4,,,,,,,,5,4,,2700,"[old-fashioned oats, applesauce, maple syrup, brown sugar, vanilla extract]",Breakfast_Brunch
Healthy-Banana-Nut-Pancakes-1641740,4,0.166666666667,0.166666666667,0.0,0.166666666667,0.166666666667,0.5,,15,6,,1200,"[bananas, egg whites, oats, whole wheat flour, ground flaxseed, baking powder, vanilla, cinnamon, club soda, walnut pieces, maple syrup, whipped cream]",Breakfast_Brunch
Healthy-Blueberry-Banana-French-Toast-_Vegan_-1685783,3,,,,,,,,12,4,,1500,"[bananas, fresh blueberries, vanilla, unsweetened vanilla almond milk, cane sugar, vegan butter, bread, maple syrup, blueberry syrup, cinnamon, blueberries]",Breakfast_Brunch
