id,rating,bitter,meaty,piquant,salty,sour,sweet,cookTimeInSeconds,ingredientCount,numberOfServings,prepTimeInSeconds,totalTimeInSeconds,ingredient_list,course
1-2-3-Gluten-Free-Pancakes-1533270,4,0.333333333333,0.5,0.0,0.166666666667,0.166666666667,0.5,,4,4,,1200,"[bananas, peanut butter, eggs, vanilla extract]",Breakfast_Brunch
15-Minute-Breakfast-Pizza-1697470,4,0.666666666667,0.833333333333,0.0,0.833333333333,0.0,0.166666666667,600.0,4,6,300.0,900,"[pizza crust, large eggs, cooked bacon, cheddar cheese]",Breakfast_Brunch
18-Aug-Almond-Bread-French-Toast-Gluten-Free-1635186,4,0.166666666667,0.833333333333,0.0,0.166666666667,0.166666666667,0.166666666667,,5,4,,1200,"[eggs, coconut cream, vanilla extract, vanilla, coconut oil]",Breakfast_Brunch
2--Minute-Low-Carb-English-Muffin-1697908,4,,,,,,,120.0,7,2,120.0,240,"[cashew butter, butter, almond flour, salt, baking powder, unsweetened almond milk, eggs]",Breakfast_Brunch
2-INGREDIENT-PANCAKES-1683615,4,,,,,,,,9,4,,1500,"[bananas, eggs, mini chocolate chips, blueberries, strawberries, Nutella, peanut butter, honey, maple syrup]",Breakfast_Brunch
2-Ingredient-Pancakes-1264118,4,0.166666666667,0.166666666667,0.0,0.166666666667,0.333333333333,0.5,,4,6,,1200,"[bananas, eggs, baking powder, ground cinnamon]",Breakfast_Brunch
2-Ingredient-Pancakes-1686555,4,0.166666666667,0.166666666667,0.0,0.166666666667,0.333333333333,0.5,,2,4,,600,"[eggs, bananas]",Breakfast_Brunch
2-Ingredient-Pancakes-_gluten-free-_-dairy-free__-1081864,4,0.166666666667,0.166666666667,0.0,0.166666666667,0.166666666667,0.5,,4,4,,1500,"[bananas, medium eggs, fruit, eggs]",Breakfast_Brunch
2-Ingredient-Protein-Crepes-1684862,4,0.833333333333,0.833333333333,0.0,0.5,0.666666666667,0.166666666667,,2,2,,900,"[egg whites, vanilla protein powder]",Breakfast_Brunch
2-Ingredient-Sweet-Potato-Pancakes-1221168,4,0.166666666667,0.166666666667,0.0,0.166666666667,0.166666666667,0.333333333333,,4,2,,1500,"[sweet potatoes, eggs, vanilla extract, cinnamon]",Breakfast_Brunch
2-Minute-French-Toast-in-A-Cup-629750,3,0.333333333333,0.166666666667,0.0,0.166666666667,0.166666666667,0.166666666667,,4,4,,300,"[eggs, milk, cinnamon, vanilla extract]",Breakfast_Brunch
2-Minute-Omelette-in-a-Mug-977874,4,0.833333333333,0.833333333333,0.5,0.833333333333,0.166666666667,0.166666666667,,7,4,,900,"[eggs, meat, salsa, shredded cheese, olive oil spray, salt, pepper]",Breakfast_Brunch
21-Day-Fix-Spinach-Pesto-Frittata-1269076,4,0.166666666667,0.166666666667,0.0,0.333333333333,0.166666666667,0.166666666667,900.0,7,4,300.0,1200,"[eggs, pesto, shredded mozzarella cheese, olive oil, cherry tomatoes, pepper, salt]",Breakfast_Brunch
3-Ingredient-Bacon-Asparagus-Frittata-1602561,4,0.666666666667,0.833333333333,0.0,0.5,0.166666666667,0.166666666667,2400.0,3,4,1800.0,4200,"[bacon, asparagus, eggs]",Breakfast_Brunch
3-Ingredient-Banana-Pancakes-1561724,4,0.333333333333,0.166666666667,0.0,0.166666666667,0.333333333333,0.5,,3,4,,600,"[bananas, eggs, oatmeal]",Breakfast_Brunch
3-Ingredient-Egg-Breakfast-Skillet-1540181,3,0.833333333333,0.5,0.0,0.833333333333,0.666666666667,0.166666666667,,7,4,,1200,"[frozen hash brown potatoes, colby jack cheese, eggs, olive oil, salt, pepper, parsley]",Breakfast_Brunch
3-Ingredient-Kimchi-Hash-Browns-1625722,4,,,,,,,,6,3,,1500,"[vegetable oil, hash brown potatoes, kimchi, fine salt, freshly ground black pepper, scallions]",Breakfast_Brunch
3-Ingredient-Peanut-Butter-Pancakes-579838,4,0.166666666667,0.166666666667,0.0,0.166666666667,0.333333333333,0.5,,4,4,,1800,"[bananas, eggs, peanut flour, almond milk]",Breakfast_Brunch
3-Ingredient-Protein-Powder-Pancakes-1563205,4,0.166666666667,0.5,0.0,0.166666666667,0.166666666667,0.5,600.0,3,4,300.0,900,"[eggs, almond butter, vanilla powder]",Breakfast_Brunch
3-Ingredient-Weight-Loss-Pancakes-1109709,3,0.166666666667,0.166666666667,0.0,0.166666666667,0.5,0.5,,5,1,,1200,"[bananas, protein powder, egg whites, blueberries, honey]",Breakfast_Brunch
3-Ingredient-Wholemeal-Pancakes-1569330,4,0.166666666667,0.166666666667,0.0,0.166666666667,0.333333333333,0.166666666667,600.0,4,2,120.0,720,"[wholemeal flour, almond milk, eggs, coconut oil]",Breakfast_Brunch
3-ingredient-Banana-Pancakes-1040595,4,0.833333333333,0.333333333333,0.0,0.166666666667,0.333333333333,0.5,600.0,4,1,600.0,1200,"[bananas, eggs, almond meal, baking powder]",Breakfast_Brunch
30-Minutes-To-Homemade-SURE_JELL-Plum-Freezer-Jam-1700829,3,,,,,,,1800.0,4,112,1800.0,3600,"[fruit, water, sugar, Sure Jell Fruit Pectin]",Breakfast_Brunch
30-Minutes-To-Homemade-SURE_JELL-Strawberry-Freezer-Jam-1700703,3,,,,,,,1800.0,4,72,1800.0,3600,"[strawberries, sugar, water, Sure Jell Fruit Pectin]",Breakfast_Brunch
4-Ingredient-Banana-Pancakes-1684831,4,,,,,,,900.0,8,3,1200.0,2100,"[bananas, eggs, coconut flour, baking powder, frozen strawberries, maple syrup, tapioca starch, whipped cream]",Breakfast_Brunch
4-Ingredient-Dutch-Cream-Waffles-991900,4,,,,,,,600.0,6,3,600.0,1200,"[flour, salt, eggs, heavy whipping cream, sugar syrup, fruit]",Breakfast_Brunch
4-Ingredient-Seaside-Breakfast-Salad-1635361,4,,,,,,,600.0,6,2,300.0,900,"[sardines, eggs, arugula, marinated artichoke hearts, sea salt, black pepper]",Breakfast_Brunch
4-Ingredient-Super-Fluffy-Vegan-Protein-Pancakes-1589744,4,0.833333333333,0.166666666667,0.0,0.833333333333,0.166666666667,0.333333333333,600.0,6,6,300.0,900,"[all-purpose flour, protein powder, baking powder, salt, maple syrup, water]",Breakfast_Brunch
4-Simple-Breakfasts-with-Berries_-Yogurt_-and-Donuts-1695469,4,,,,,,,,5,4,,600,"[bananas, vanilla yogurt, mixed berries, slivered almonds, granola]",Breakfast_Brunch
45-Calorie-Fat-Free-Waffle-1528466,4,,,,,,,,7,6,,1200,"[whole wheat flour, salt, baking powder, unsweetened applesauce, unsweetened almond milk, egg whites, splenda]",Breakfast_Brunch
5-Ingredient-Blender-Pancakes-1684451,4,0.666666666667,0.166666666667,0.0,0.166666666667,0.166666666667,0.5,900.0,8,6,600.0,1500,"[bananas, unsweetened applesauce, old-fashioned oats, eggs, baking powder, ground cinnamon, chocolate chips, chopped nuts]",Breakfast_Brunch
5-Ingredient-Cheddar-and-Chive-Waffles-with-a-Fried-Egg-1632517,4,0.833333333333,0.833333333333,0.0,0.833333333333,0.166666666667,0.166666666667,900.0,5,4,600.0,1500,"[waffle mix, eggs, canola oil, sharp cheddar cheese, chives]",Breakfast_Brunch
5-Ingredient-Quinoa-Breakfast-Pots-1222695,4,0.166666666667,0.166666666667,0.0,0.166666666667,0.833333333333,0.333333333333,,5,4,,1500,"[almond milk, quinoa, strawberries, pistachios, honey]",Breakfast_Brunch
5-Ingredient-Quinoa-Breakfast-Pots-1698919,4,0.166666666667,0.166666666667,0.0,0.166666666667,0.833333333333,0.333333333333,,5,4,,1500,"[almond milk, quinoa, strawberries, pistachios, honey]",Breakfast_Brunch
5-Ingredient-Vegan-Banana-French-Toast-1640908,4,,,,,,,420.0,7,2,600.0,1020,"[bananas, unsweetened almond milk, flaxseed, cinnamon, wheat bread, vanilla extract, almond meal]",Breakfast_Brunch
5-Minute-Chocolate-Oatmeal-568037,4,,,,,,,,8,1,,1200,"[rolled oats, milk, bananas, cocoa powder, salt, pure vanilla extract, sweetener, chocolate chips]",Breakfast_Brunch
5-Minute-Extra-Fluffy-Pancakes-1208351,4,,,,,,,,9,4,,300,"[canola oil, eggs, vanilla, milk, all-purpose flour, sugar, baking powder, salt, cooking spray]",Breakfast_Brunch
5-Minute-Protein-Pancakes-1267630,4,0.666666666667,0.666666666667,0.0,0.166666666667,0.666666666667,0.333333333333,,5,4,,600,"[unsweetened vanilla almond milk, protein powder, bananas, cinnamon, egg whites]",Breakfast_Brunch
7-Ingredient-Superfood-Quinoa-Breakfast-Bowl-1550560,4,0.166666666667,0.166666666667,0.0,0.166666666667,0.666666666667,0.333333333333,300.0,7,1,900.0,1200,"[cooked quinoa, unsweetened vanilla almond milk, fresh raspberries, bananas, chopped almonds, peanut butter, cacao nibs]",Breakfast_Brunch
A-Bit-Weird-Easy-Cinnamon-Eggs-599837,3,,,,,,,120.0,6,1,180.0,300,"[fine sea salt, ground cinnamon, almond milk, eggs, egg whites, coconut oil]",Breakfast_Brunch
A-Classic-Breakfast-Idea-1693356,4,0.833333333333,0.833333333333,0.0,0.833333333333,0.166666666667,0.166666666667,,5,4,,1500,"[butter, eggs, toast, salt, pepper]",Breakfast_Brunch
Absolute-Best-Pancake-Syrup-Allrecipes,5,0.166666666667,0.166666666667,0.0,0.5,0.166666666667,0.833333333333,300.0,7,2,300.0,600,"[butter, sugar, buttermilk, vanilla extract, corn syrup, ground cinnamon, baking soda]",Breakfast_Brunch
Acapulco-Eggs-1712547,4,,,,,,,,9,6,,1800,"[unsalted butter, eggs, unsweetened almond milk, cottage cheese, green chile, nopales, salt, black pepper, cheddar cheese]",Breakfast_Brunch
Aebleskivers-782383,4,0.666666666667,0.166666666667,0.0,0.333333333333,0.0,0.333333333333,,7,20,,2100,"[wheat flour, sugar, baking powder, salt, eggs, whole milk, melted butter]",Breakfast_Brunch
African-Pancakes-1618969,4,0.166666666667,0.5,0.0,0.166666666667,0.166666666667,0.666666666667,900.0,8,4,4200.0,5100,"[flour, milk, sugar, eggs, melted butter, vanilla flavoring, nutmeg, oil]",Breakfast_Brunch
Akoori-_Indian-Scrambled-Eggs_-1216460,4,0.166666666667,0.333333333333,0.666666666667,0.333333333333,0.833333333333,0.166666666667,900.0,9,4,900.0,1800,"[butter, yellow onion, garlic, green chilies, ground cumin, medium tomatoes, cilantro, large eggs, salt]",Breakfast_Brunch
Alanna_s-peanut-butter-oatmeal-309979,5,,,,,,,,6,4,,600,"[oatmeal, water, salt, peanut butter, ground cinnamon]",Breakfast_Brunch
Almond-Blueberry-French-Toast-1690330,4,,,,,,,,9,4,,1500,"[bread, eggs, milk, almond extract, sugar, ground cinnamon, frozen blueberries, whipped cream, maple syrup]",Breakfast_Brunch
Almond-Butter-Pancakes-1087916,4,0.333333333333,0.833333333333,0.0,0.166666666667,0.166666666667,0.5,,5,3,,900,"[almond flour, almond butter, eggs, honey, cinnamon]",Breakfast_Brunch
Almond-Butter-Pancakes-1694236,4,0.833333333333,0.833333333333,0.0,0.666666666667,0.5,0.5,600.0,12,5,600.0,1200,"[whole wheat white flour, baking powder, salt, almonds, large eggs, pure maple syrup, vanilla extract, coconut oil, almond butter, berries, maple syrup]",Breakfast_Brunch
Almond-Butter-Pancakes-_Grain-Free_-1052062,4,0.833333333333,0.833333333333,0.0,0.5,0.166666666667,0.333333333333,,6,2,,1800,"[almond butter, unsweetened applesauce, eggs, baking soda, cinnamon, vanilla extract]",Breakfast_Brunch
Almond-Flour-Pancakes-1372156,4,0.166666666667,0.166666666667,0.0,0.166666666667,0.166666666667,0.5,,7,4,,2100,"[almond flour, baking powder, salt, eggs, pure vanilla extract, almond milk, pomegranate juice]",Breakfast_Brunch
Almond-Flour-Pancakes-1582168,3,0.166666666667,0.833333333333,0.0,0.166666666667,0.0,0.166666666667,600.0,4,4,180.0,780,"[almond flour, eggs, vanilla extract, coconut oil]",Breakfast_Brunch
Almond-Flour-Waffles-Gluten-Free-980012,4,0.5,0.833333333333,0.0,0.666666666667,0.166666666667,0.166666666667,,6,8,,1500,"[almond flour, baking powder, salt, heavy cream, oil, eggs]",Breakfast_Brunch
Almond-Pancakes-989950,3,0.833333333333,0.666666666667,0.0,0.833333333333,0.333333333333,0.166666666667,,6,4,,2100,"[almond meal, almond milk, baking powder, sea salt, flax seed meal, cinnamon]",Breakfast_Brunch
Almond-Pancakes-with-Almond-Breeze-1631862,4,0.166666666667,0.833333333333,0.0,0.833333333333,0.166666666667,0.666666666667,,7,4,,2100,"[large eggs, vanilla extract, honey, almond flour, salt, baking soda, cinnamon]",Breakfast_Brunch
Almond-Poppy-Seed-Waffles-1642252,4,0.166666666667,0.166666666667,0.0,0.166666666667,0.166666666667,0.5,,6,4,,1200,"[waffle mix, milk, vegetable oil, applesauce, almond extract, poppy seeds]",Breakfast_Brunch
Almond-Protein-Pancakes-1635203,4,,,,,,,,4,4,,1200,"[eggs, almond flour, water, coconut oil]",Breakfast_Brunch
Almond-Quinoa-Muffins-with-Cherries_-Apricots-and-Pistachios-1686963,4,0.333333333333,0.5,0.0,0.166666666667,0.166666666667,0.666666666667,2400.0,13,11,600.0,3000,"[unsweetened vanilla almond milk, vanilla extract, quinoa, apricots, cherries, honey, ground cardamom, sea salt, almond butter, fresh ginger, large eggs, egg whites, pistachios]",Breakfast_Brunch
Amazing-Breakfast-Balls-638765,4,,,,,,,,8,16,1200.0,1200,"[pitted dates, almond extract, cacao powder, rolled oats, peanuts, sunflower seeds, apples, flax seeds]",Breakfast_Brunch
Amazing-Vegan-Waffles-1092673,4,,,,,,,900.0,7,9,300.0,1200,"[all-purpose flour, baking powder, salt, vanilla almondmilk, orange juice, vegetable oil, powdered sugar]",Breakfast_Brunch
American-Breakfast-Hash-1686977,4,0.333333333333,0.166666666667,0.166666666667,0.166666666667,0.833333333333,0.166666666667,900.0,14,2,480.0,1380,"[potatoes, onions, florets, mushrooms, sour cream, parsley, scallions, olive oil, oregano, black pepper, crushed red pepper flakes, fat, salt]",Breakfast_Brunch
American-style-Blueberry-Pancakes-1707717,4,0.5,0.166666666667,0.0,0.5,0.166666666667,0.5,,10,4,,1200,"[plain flour, baking powder, sugar, large eggs, arrowroot, milk, butter, salt, fresh blueberries, vegetable oil]",Breakfast_Brunch
An-Easy-Pancake-1621224,3,,,,,,,600.0,9,4,300.0,900,"[pancake, all-purpose flour, baking powder, sugar, salt, eggs, milk, flour]",Breakfast_Brunch
Angel-food-french-toast-344569,5,0.333333333333,0.166666666667,0.0,0.833333333333,0.5,0.333333333333,,13,5,,1800,"[angel food cake, large eggs, milk, flour, vanilla extract, salt, cinnamon, butter, whipped cream, strawberries, blueberries, maple syrup, fresh mint]",Breakfast_Brunch
Another-Gluten-Free-Pancake-1690464,3,,,,,,,,7,6,,1800,"[buckwheat flour, vegan mayonnaise, baking soda, salt, honey, crepes, water]",Breakfast_Brunch
Apam-Balik-1053258,4,0.166666666667,0.833333333333,0.0,0.333333333333,0.166666666667,0.666666666667,,8,4,,2700,"[all-purpose flour, baking soda, instant yeast, large eggs, cane sugar, water, roasted peanuts]",Breakfast_Brunch
Apple-Bumpkin-Breakfast-Bake-1682890,4,0.166666666667,0.166666666667,0.0,0.166666666667,0.166666666667,0.5,,13,4,,2700,"[apples, bananas, eggs, almond flour, pumpkin purée, coconut milk, vanilla bean seeds, apple juice, cinnamon, nutmeg, salt, slivered almonds, coconut flakes]",Breakfast_Brunch
Apple-Carrot-Cake-Pancakes-With-Maple-Cream-Cheese-Topping-781261,4,,,,,,,900.0,17,2,300.0,1200,"[flour, baking powder, salt, cinnamon, ginger, nutmeg, clove, eggs, brown sugar, vanilla, unsweetened almond milk, grated carrot, apples, cream cheese, maple syrup]",Breakfast_Brunch
Apple-Cider-Pancakes-with-Caramel-Apple-Syrup-677337,4,0.166666666667,0.166666666667,0.0,0.833333333333,0.166666666667,0.833333333333,900.0,11,4,900.0,1800,"[all-purpose flour, sugar, baking powder, baking soda, salt, yoplait, apple cider, eggs, butter, brown sugar]",Breakfast_Brunch
Apple-Cinnamon-Baked-French-Toast-1298248,4,0.166666666667,0.166666666667,0.0,0.166666666667,0.166666666667,0.5,1200.0,9,1,300.0,1500,"[unsweetened applesauce, unsweetened vanilla almond milk, nut butter, maple syrup, ground cinnamon, vanilla extract, bread, quick oats, apples]",Breakfast_Brunch
Apple-Cinnamon-Breakfast-Quinoa-1536800,4,0.166666666667,0.166666666667,0.0,0.0,0.166666666667,0.5,,8,2,,1500,"[quinoa, applesauce, water, apples, cinnamon, nutmeg, almonds, maple syrup]",Breakfast_Brunch
Apple-Cinnamon-French-Toast-1624670,4,0.166666666667,0.166666666667,0.0,0.166666666667,0.166666666667,0.666666666667,600.0,12,4,600.0,1200,"[apples, brown sugar, butter, vanilla, cinnamon, white bread, eggs, milk, flour, powdered sugar]",Breakfast_Brunch
Apple-Cinnamon-Oatmeal-1106147,4,0.166666666667,0.333333333333,0.0,0.166666666667,0.166666666667,0.5,,6,4,,1800,"[oats, rice milk, salt, cinnamon, almonds, apples]",Breakfast_Brunch
Apple-Cinnamon-Oatmeal-1629567,4,,,,,,,,8,4,,1200,"[gluten, water, sea salt, apples, cinnamon, maple syrup, shelled hemp seeds, ground flax]",Breakfast_Brunch
Apple-Cinnamon-Overnight-Cereal-and-Oatmeal-1263186,3,,,,,,,,6,4,300.0,28800,"[Yoplait® Greek 100 apple pie yogurt, quick-cooking oats, Honey Nut Cheerios Cereal, diced apples, raisins, cinnamon]",Breakfast_Brunch
Apple-Cinnamon-Overnight-Oatmeal-1701420,4,0.166666666667,0.166666666667,0.0,0.166666666667,0.166666666667,0.5,300.0,5,1,300.0,600,"[oatmeal, milk, honey, stevia, apples]",Breakfast_Brunch
Apple-Cinnamon-Overnight-Oats-1012630,4,,,,,,,,6,1,28800.0,28800,"[unsweetened almond milk, gala apples, oats, cinnamon, vanilla extract, slivered almonds]",Breakfast_Brunch
Apple-Cinnamon-Pancakes-1680204,4,0.333333333333,0.166666666667,0.0,0.5,0.166666666667,0.5,,10,4,,1500,"[all-purpose flour, brown sugar, baking powder, salt, ground cinnamon, milk, applesauce, apples, eggs, vegetable oil]",Breakfast_Brunch
Apple-Cinnamon-Pancakes-1690479,4,0.833333333333,0.166666666667,0.0,0.666666666667,0.166666666667,0.5,600.0,11,3,600.0,1200,"[oats, ground flaxseed, milk, cinnamon, ginger, nutmeg, honey, eggs, baking powder, baking soda, apples]",Breakfast_Brunch
Apple-Cinnamon-Quinoa-Breakfast-Bake-574503,3,0.166666666667,0.166666666667,0.0,0.166666666667,0.166666666667,0.5,4800.0,10,6,,4800,"[quinoa, cinnamon, nutmeg, ground cloves, apples, raisins, eggs, vanilla soy milk, maple syrup, almonds]",Breakfast_Brunch
Apple-Cinnamon-Slow-Cooker-Oatmeal-with-Truvia-Brown-Sugar-Blend-746837,4,0.166666666667,0.166666666667,0.0,0.166666666667,0.166666666667,0.5,,10,6,,2100,"[apples, Truvía® Brown Sugar Blend, cinnamon, nutmeg, salt, lemon juice, steel-cut oats, skim milk, eggs, water]",Breakfast_Brunch
Apple-Cinnamon-Syrup-1597843,4,0.166666666667,0.166666666667,0.0,0.166666666667,0.166666666667,0.5,,11,2,,1800,"[apple juice, cinnamon, honey, corn starch, water, bread, milk, eggs, salt, sugar]",Breakfast_Brunch
Apple-Fritter-Pancakes-1324814,4,,,,,,,600.0,9,5,300.0,900,"[gluten free all purpose flour, baking powder, cinnamon, salt, almond milk, maple syrup, coconut oil, apples]",Breakfast_Brunch
Apple-Oatmeal-1687284,4,,,,,,,,6,2,,1800,"[oatmeal, water, peeled apples, ground cinnamon, pitted dates, chopped walnuts]",Breakfast_Brunch
Apple-Pancakes-1103486,4,0.5,0.166666666667,0.0,0.666666666667,0.166666666667,0.5,480.0,9,4,300.0,780,"[flour, eggs, milk, canola oil, salt, baking powder, sugar, cinnamon, apples]",Breakfast_Brunch
Apple-Pie-Overnight-Oatmeal-1694463,4,,,,,,,28800.0,7,1,300.0,29100,"[rolled oats, applesauce, vanilla almondmilk, apple pie spice, chopped walnuts, apples, honey]",Breakfast_Brunch
Apple-Pie-Overnight-Oats-1689508,4,,,,,,,,7,2,,1500,"[rolled oats, milk, whey, medjool date, dried apple, cinnamon, ginger]",Breakfast_Brunch
Apple-Pie-Pancakes-1210691,4,0.166666666667,0.166666666667,0.0,0.166666666667,0.166666666667,0.5,240.0,7,4,300.0,540,"[all-purpose flour, baking powder, brown sugar, cinnamon, eggs, milk, apples]",Breakfast_Brunch
Apple-Pie-Quinoa-Breakfast-Bowl-1312050,4,0.166666666667,0.166666666667,0.0,0.166666666667,0.166666666667,0.5,900.0,8,4,600.0,1500,"[quinoa, unsweetened vanilla almond milk, unsweetened applesauce, apple pie spice, vanilla extract, salt, apples, pure maple syrup]",Breakfast_Brunch
Apple-Pie-Refrigerator-Oatmeal-1335854,4,0.166666666667,0.166666666667,0.0,0.166666666667,0.166666666667,0.5,,6,1,300.0,300,"[oats, diced apples, greek yogurt, apple butter, cinnamon, chopped walnuts]",Breakfast_Brunch
Apple-Raspberry-French-Toast-Bake-1623816,4,0.166666666667,0.166666666667,0.0,0.166666666667,0.166666666667,0.5,2700.0,12,6,600.0,3300,"[whole wheat bread, eggs, low-fat milk, apple butter, vanilla, cinnamon, nutmeg, raspberries, chopped walnuts, brown sugar, maple syrup, butter]",Breakfast_Brunch
Apple-_-Blueberry-Baked-Oatmeal-1699695,4,0.666666666667,0.166666666667,0.0,0.333333333333,0.166666666667,0.666666666667,,13,4,,3000,"[pink lady apple, rolled oats, toasted almonds, baking powder, cinnamon, salt, milk, maple syrup, large eggs, unsalted butter, vanilla extract, blueberries, brown sugar]",Breakfast_Brunch
Apple-pancakes-307171,5,0.166666666667,0.166666666667,0.0,0.333333333333,0.166666666667,0.5,,10,4,,2100,"[eggs, milk, all-purpose flour, baking powder, salt, sugar, apples, flavoring, vegetable oil, confectioners sugar]",Breakfast_Brunch
Apples-_-Cinnamon-Oatmeal-with-Cranberries-and-Pecans-760988,4,,,,,,,,3,1,,600,"[Quaker Instant Oatmeal, dried cranberries, pecans]",Breakfast_Brunch
Apples-and-cinnamon-breakfast-quinoa-351953,5,0.166666666667,0.166666666667,0.0,0.166666666667,0.166666666667,0.333333333333,,9,4,,1500,"[quinoa, water, cinnamon, vanilla extract, unsweetened applesauce, golden raisins, fat free milk, gala apples, pecans]",Breakfast_Brunch
Apricot-Honey-Oatmeal-760980,4,,,,,,,300.0,5,4,600.0,1200,"[dried apricot, ground cinnamon, honey, water, Quaker Oats]",Breakfast_Brunch
Apricot-Vanilla-Cashew-Refrigerator-Oatmeal-1698206,4,,,,,,,28800.0,6,1,300.0,29100,"[rolled oats, greek yogurt, vanilla almondmilk, apricots, cashew nuts, cinnamon]",Breakfast_Brunch
Asparagus-Goat-Cheese-Frittata-982463,4,0.833333333333,0.833333333333,0.0,0.666666666667,0.333333333333,0.166666666667,,9,4,,1500,"[olive oil, onions, asparagus, mushrooms, eggs, parsley, crumbled goat cheese, salt, pepper]",Breakfast_Brunch
Asparagus-Scramble-939770,4,0.666666666667,0.5,0.0,0.5,0.5,0.166666666667,,6,1,,1200,"[oil, salt, large eggs, asparagus spears, green onions, cheddar cheese]",Breakfast_Brunch
Asparagus-_-Feta-Egg-Scramble-1696204,4,0.666666666667,0.166666666667,0.166666666667,0.666666666667,0.5,0.166666666667,,10,4,,1200,"[large eggs, salt, ground pepper, olive oil, minced garlic, asparagus, matchstick carrots, baby spinach, grape tomatoes, feta cheese crumbles]",Breakfast_Brunch
Asparagus-_-Goat-Cheese-Frittata-1705952,4,0.833333333333,0.833333333333,0.0,0.833333333333,0.166666666667,0.166666666667,,10,6,,1800,"[large eggs, whipping cream, garlic, salt, pepper, butter, asparagus, goat cheese]",Breakfast_Brunch
Asparagus-and-Bacon-1687089,4,0.833333333333,0.833333333333,0.0,0.833333333333,0.333333333333,0.166666666667,600.0,5,4,300.0,900,"[asparagus, bacon, olive oil, salt, pepper]",Breakfast_Brunch
Aunt-Judy_s-Baked-Oatmeal-1682887,4,0.166666666667,0.166666666667,0.0,0.166666666667,0.166666666667,0.5,,11,5,,1800,"[oats, flax seed meal, almond milk, water, apples, dried cranberries, pecans, baking powder, maple syrup, nutmeg, cinnamon]",Breakfast_Brunch
Authentic-Belgian-Waffles-1545798,4,,,,,,,900.0,8,5,600.0,1500,"[all-purpose flour, sugar, baking powder, eggs, milk, butter, vanilla extract, waffle]",Breakfast_Brunch
Avocado-Bacon-and-Eggs-1019540,4,,,,,,,,5,4,,1500,"[avocado, eggs, cooked bacon, low-fat cheese, salt]",Breakfast_Brunch
Avocado-Baked-Eggs-1564295,4,0.833333333333,0.666666666667,0.833333333333,0.833333333333,0.666666666667,0.166666666667,,7,4,,2400,"[avocado, eggs, salt, black pepper, cayenne pepper, bacon bits, green onions]",Breakfast_Brunch
Avocado-Breakfast-Bake-627945,3,0.833333333333,0.833333333333,0.0,0.666666666667,0.5,0.166666666667,900.0,5,4,300.0,1200,"[avocado, eggs, bacon, salt, pepper]",Breakfast_Brunch
Avocado-Pancakes-with-Lemon-Parsley-Butter-1691182,3,,,,,,,,16,3,,1800,"[coconut flour, baking soda, salt, eggs, coconut milk, avocado, green onions, butter, avocado slices, spring greens, lemon slices, sliced green onions, parsley, lemon juice]",Breakfast_Brunch
BANANA-OATMEAL-PANCAKES-1631508,4,,,,,,,,12,4,,1500,"[flour, eggs, plain yogurt, water, baking powder, cardamon]",Breakfast_Brunch
BASIC-DUTCH-BABY-1618980,3,0.166666666667,0.5,0.0,0.333333333333,0.166666666667,0.166666666667,,5,3,,1800,"[flour, salt, eggs, milk, butter]",Breakfast_Brunch
BA_s-Best-Soft-Scrambled-Eggs-1182854,3,0.833333333333,0.833333333333,0.0,0.833333333333,0.0,0.166666666667,,4,2,,600,"[large eggs, kosher salt, unsalted butter, sea salt flakes]",Breakfast_Brunch
BAs-Best-Buttermilk-Pancakes-1711249,4,0.333333333333,0.166666666667,0.0,0.833333333333,0.166666666667,0.5,,9,4,,1200,"[flour, granulated sugar, baking powder, baking soda, kosher salt, large eggs, buttermilk, unsalted butter, maple syrup]",Breakfast_Brunch
BLUEBERRY-BREAKFAST-BAKE-1711986,4,0.5,0.5,0.0,0.666666666667,0.166666666667,0.5,,10,4,,4200,"[baguette, blueberries, cheese, sugar, eggs, sour cream, pure vanilla extract, ground cinnamon, milk, maple syrup]",Breakfast_Brunch
BLUEBERRY-YOGURT-PANCAKES-1687573,4,0.166666666667,0.166666666667,0.0,0.666666666667,0.166666666667,0.666666666667,600.0,7,3,300.0,900,"[greek yogurt, honey, eggs, baking soda, flour, fresh blueberries, maple syrup]",Breakfast_Brunch
BRAZILIAN-FLAIR-CARROT-PANCAKES-1705277,4,,,,,,,,12,4,,1500,"[cake, carrots, sugar, eggs, vegetable oil, flour, salt, baking powder, syrup, Nutella, heavy cream, chocolate]",Breakfast_Brunch
BRAZILIAN-FLAIR-TAPIOCA-WAFFLES-1700612,4,,,,,,,,5,4,,2100,"[unsweetened shredded dried coconut, salt, dulce de leche, milk, bananas]",Breakfast_Brunch
BREAKFAST-in-potato-boats-1701716,4,,,,,,,,10,4,,2400,"[large potatoes, butter, eggs, bacon, green onions, grating cheese, parsley, dill, basil, herbs]",Breakfast_Brunch
BROCCOLI-QUICHE-1218721,4,0.833333333333,0.833333333333,0.0,0.833333333333,0.166666666667,0.166666666667,,7,6,,3300,"[frozen chopped broccoli, cheddar cheese, onions, eggs, heavy cream, salt, pepper]",Breakfast_Brunch
Baby-Banana-Pancakes-1049163,4,,,,,,,,7,15,,2100,"[ground oats, whole wheat flour, baking powder, cinnamon, unsweetened coconut milk, mashed banana, coconut oil]",Breakfast_Brunch
Baby-Dutch-Baby-Pancakes-1549468,4,0.166666666667,0.5,0.0,0.166666666667,0.166666666667,0.166666666667,,5,4,,1800,"[milk, flour, eggs, melted butter, salt]",Breakfast_Brunch
Baby-kale_-mozzarella_-and-egg-bake-309229,5,,,,,,,,9,6,,2400,"[baby kale, kale leaves, olive oil, mozzarella cheese, green onions, eggs, Spike Seasoning, ground black pepper, salt]",Breakfast_Brunch
Bacon-Avocado-Breakfast-Toast-1700939,3,,,,,,,,4,4,,1500,"[avocado, liquid egg whites, diced tomatoes, bacon]",Breakfast_Brunch
Bacon-Banana-Pancakes-with-Buttery-Bourbon-Maple-Syrup-1701366,4,0.833333333333,0.333333333333,0.0,0.833333333333,0.166666666667,0.666666666667,,13,6,,2700,"[bacon, eggs, bananas, light brown sugar, flour, baking powder, salt, milk, vanilla, bacon grease, pure maple syrup, bourbon whiskey, salted butter]",Breakfast_Brunch
