id,rating,bitter,meaty,piquant,salty,sour,sweet,cookTimeInSeconds,ingredientCount,numberOfServings,prepTimeInSeconds,totalTimeInSeconds,ingredient_list,course
California-Breakfast-Sandwich-1698557,4,0.833333333333,0.833333333333,0.0,0.833333333333,0.166666666667,0.166666666667,,10,4,,1500,"[french bread, unsalted butter, prosciutto, monterey jack, vinegar, eggs, avocado, basil leaves, salt, pepper]",Breakfast_Brunch
California-Style-Eggs-Benedict-1078823,4,0.833333333333,0.5,0.666666666667,0.833333333333,0.5,0.166666666667,,11,4,,2400,"[white vinegar, salt, eggs, English muffins, tomatoes, avocado, large egg yolks, lemon juice, cayenne pepper, salted butter]",Breakfast_Brunch
Camper_s-Breakfast-Hash-1597103,4,0.833333333333,0.833333333333,0.0,0.833333333333,0.5,0.166666666667,1200.0,9,8,600.0,1800,"[breakfast sausage links, butter, hash brown potatoes, eggs, salt, pepper, extra sharp cheddar cheese, chives, cheese]",Breakfast_Brunch
Campfire-Bacon-with-Maple-Citrus-Glaze-1639947,3,0.666666666667,0.666666666667,0.0,0.833333333333,0.5,0.666666666667,,6,4,,1800,"[pure maple syrup, sherry vinegar, grated orange, lime zest, slab bacon, chives]",Breakfast_Brunch
Campfire-French-Toast-1049209,4,,,,,,,2400.0,6,6,300.0,2700,"[bread, eggs, sliced almonds, strawberries, confectioners sugar, syrup]",Breakfast_Brunch
Canada-Girl-991735,4,,,,,,,,8,1,,1500,"[sweet potatoes, eggs, coconut flour, cinnamon, baking soda, vanilla, coconut oil]",Breakfast_Brunch
Candied-Ginger_-Coconut-and-Quinoa-Granola-1711300,3,,,,,,,,17,5,,2700,"[rolled oats, quinoa, pumpkin seeds, sliced almonds, sweetened coconut flakes, light brown sugar, ground cinnamon, ground ginger, kosher salt, applesauce, honey, coconut oil, dried cranberries, dried cherry, crystallized ginger, mixed berries, ricotta cheese]",Breakfast_Brunch
Cantaloupe-Breakfast-Bowls-1624395,4,,,,,,,,5,2,420.0,420,"[cantaloupe, plain greek yogurt, frozen mixed berries, granola, honey]",Breakfast_Brunch
Cap_n-Crunch-French-Toast-1703531,4,0.166666666667,0.5,0.0,0.5,0.333333333333,0.5,1500.0,13,4,900.0,2400,"[Crunch Cereal, eggs, milk, vanilla extract, cinnamon, nutmeg, sugar, kosher salt, bread, unsalted butter, maple syrup, fresh berries, powdered sugar]",Breakfast_Brunch
Caprese-Frittata-1711082,4,0.666666666667,0.666666666667,0.0,0.833333333333,0.166666666667,0.166666666667,1800.0,8,6,600.0,2400,"[eggs, milk, salt, pepper, basil, unsalted butter, cherry tomatoes, fresh mozzarella]",Breakfast_Brunch
Caprese-Quiche-1456434,4,0.666666666667,0.5,0.0,0.833333333333,0.166666666667,0.166666666667,,7,7,,3900,"[large eggs, whole milk, shredded mozzarella cheese, basil, cherry tomatoes, salt, unbaked pie crusts]",Breakfast_Brunch
Caprese-baked-egg-cups-333349,5,,,,,,,,8,4,,1800,"[eggs, grape tomatoes, mozzarella cheese, fresh basil leaves, cream, salt, pepper, softened butter]",Breakfast_Brunch
Caramel-Apple-French-Toast-Casserole-1638541,4,0.5,0.333333333333,0.0,0.833333333333,0.166666666667,0.5,,6,4,,3600,"[bread, eggs, apple jam, butter, cinnamon sugar, toasted pecans]",Breakfast_Brunch
Caramelized-French-Toast-1686569,4,0.166666666667,0.166666666667,0.0,0.666666666667,0.166666666667,0.833333333333,,12,10,,3900,"[firmly packed brown sugar, butter, corn syrup, water, eggs, milk, vanilla extract, salt, french bread, sugar, cinnamon]",Breakfast_Brunch
Caramelized-French-Toast-Allrecipes,4,0.166666666667,0.166666666667,0.0,0.5,0.166666666667,0.666666666667,1200.0,7,8,600.0,1800,"[butter, eggs, milk, salt, bread, brown sugar, water]",Breakfast_Brunch
Caramelized-Peach-Quinoa-Breakfast-Bowl-1684482,4,,,,,,,,9,2,,2100,"[quinoa, water, peaches, cinnamon, pure maple syrup, fresh lemon juice, chia seeds, unsweetened vanilla almond milk, nuts]",Breakfast_Brunch
Cardamom-Almond-Coconut-Granola-Cereal-1068227,4,,,,,,,2700.0,9,3,600.0,3300,"[old-fashioned oats, chopped almonds, coconut, ground cinnamon, ground cardamom, maple syrup, coconut oil, vanilla extract, chia seeds]",Breakfast_Brunch
Carrot-Cake-Baked-Oatmeal-1704433,4,,,,,,,2100.0,11,4,600.0,2700,"[old-fashioned oats, baking powder, ground cinnamon, ground ginger, salt, shredded carrots, unsweetened almond milk, pure maple syrup, pure vanilla extract, raisins, walnuts]",Breakfast_Brunch
Carrot-Cake-Overnight-Oatmeal-1683786,4,0.166666666667,0.5,0.0,0.166666666667,0.166666666667,0.5,,7,1,300.0,300,"[oats, coconut milk, carrots, raisins, pecans, vanilla extract, raw honey]",Breakfast_Brunch
Carrot-Cake-Pancakes-1686663,4,0.833333333333,0.166666666667,0.0,0.666666666667,0.166666666667,0.5,,16,3,,2100,"[carrots, eggs, milk, vanilla, brown sugar, cinnamon, ground ginger, allspice, flour, baking powder, salt, butter, cream cheese, powdered sugar, vanilla extract]",Breakfast_Brunch
Carrot-Cake-Pancakes-with-Cashew-Cream-Frosting-1704940,4,0.833333333333,0.833333333333,0.0,0.833333333333,0.166666666667,0.666666666667,900.0,22,4,1200.0,2100,"[pancake, whole wheat white flour, baking soda, salt, ground cinnamon, ground nutmeg, ground cloves, ground ginger, almonds, large eggs, honey, coconut oil, pure vanilla extract, carrots, frosting, raw cashews, chopped pecans]",Breakfast_Brunch
Carrot-Cake-Protein-Pancakes-1700988,4,0.833333333333,0.166666666667,0.0,0.5,0.166666666667,0.5,,17,4,,2100,"[vanilla protein powder, plain low fat greek yogurt, cinnamon, ground ginger, salt, baking powder, egg whites, old-fashioned oats, water, stevia, carrots, walnuts, golden raisins, low-fat cream cheese, sugar]",Breakfast_Brunch
Carrot-Cake-Waffles-_with-Maple-Cream-Cheese-Glaze_-1684783,3,0.166666666667,0.166666666667,0.0,0.166666666667,0.166666666667,0.5,,11,4,,2100,"[mixed spice, large eggs, water, coconut sugar, currant, chopped walnuts, cream cheese, plain greek yogurt, vanilla extract, pure maple syrup, milk]",Breakfast_Brunch
Carrot-Pancakes-1679567,4,0.833333333333,0.166666666667,0.0,0.833333333333,0.166666666667,0.5,,8,4,,1500,"[flour, brown sugar, baking powder, salt, eggs, milk, carrots, vegetable oil]",Breakfast_Brunch
Cashew-and-Oat-Hotcakes-1689383,3,,,,,,,,8,7,600.0,1200,"[rolled oats, raw cashews, Himalayan salt, large eggs, coconut oil, water, vanilla extract, mixed berries]",Breakfast_Brunch
Cauliflower-Hash-Low-Carb-_-Diabetic-Friendly-983804,3,,,,,,,,6,1,600.0,1800,"[cauliflower, mushrooms, onions, bacon, bacon grease, sharp cheddar cheese]",Breakfast_Brunch
Cauliflower-Pancakes-1636636,4,0.833333333333,0.166666666667,0.0,0.833333333333,0.833333333333,0.166666666667,1200.0,7,8,600.0,1800,"[cauliflower, eggs, shallots, gluten-free flour, baking powder, salt, avocado oil]",Breakfast_Brunch
Celebrate-the-USA-Flag-Waffles-1204116,4,0.5,0.166666666667,0.0,0.5,0.5,0.5,,11,4,,2400,"[whipped cream cheese, strawberries, fresh blueberries, bananas, all-purpose flour, baking powder, salt, granulated sugar, eggs, unsalted butter, whole milk]",Breakfast_Brunch
Cereal-Crusted-French-Toast-1583904,4,,,,,,,,8,3,,1500,"[honey, eggs, half & half, vanilla extract, bread, butter, maple syrup, strawberries]",Breakfast_Brunch
Chai-Almond-Milk-Dairy-Free-Waffles-with-Berry-Compote-1711915,4,0.666666666667,0.166666666667,0.0,0.833333333333,0.166666666667,0.5,,16,4,,2100,"[white flour, whole wheat flour, baking powder, ground cinnamon, ground ginger, ground cloves, ground cardamom, kosher salt, coconut oil, large eggs, almond milk, vanilla extract, maple syrup, frozen mixed berries, corn starch]",Breakfast_Brunch
Challah-French-Toast-1577097,4,0.166666666667,0.166666666667,0.0,0.166666666667,0.166666666667,0.5,600.0,9,4,1200.0,1800,"[challa, large eggs, milk, sugar, ground cinnamon, vanilla extract, salt, butter, vegetable oil]",Breakfast_Brunch
Challah-French-Toast-Casserole-1706705,3,,,,,,,2100.0,8,8,900.0,3000,"[eggs, half & half, vanilla extract, ground cinnamon, fine sea salt, challa, unsalted butter, brown sugar]",Breakfast_Brunch
Chatelaine-1686479,3,0.166666666667,0.166666666667,0.0,0.166666666667,0.333333333333,0.5,,9,4,300.0,1200,"[eggs, milk, quick oats, maple syrup, vanilla, salt, raspberries, blueberries, chopped walnuts]",Breakfast_Brunch
Cheddar-Bacon-Omelette-1095316,4,,,,,,,,9,4,,1200,"[eggs, button mushrooms, white onion, large garlic cloves, bacon, shredded extra sharp cheddar cheese, salt, pepper, olive oil]",Breakfast_Brunch
Cheddar-Broccoli-Egg-Muffin-1043046,4,0.833333333333,0.833333333333,0.0,0.833333333333,0.833333333333,0.166666666667,,5,6,,1800,"[eggs, broccoli, cheddar cheese, sea salt, pepper]",Breakfast_Brunch
Cheddar-Sausage-Cornmeal-Waffles-1697711,4,0.666666666667,0.5,0.5,0.833333333333,0.166666666667,0.333333333333,1200.0,13,4,600.0,1800,"[all-purpose flour, cornmeal, baking soda, smoked paprika, baking powder, chipotle chile powder, buttermilk, maple syrup, olive oil, Sriracha, sausages, Mexican cheese blend, large eggs]",Breakfast_Brunch
Cheese-Grits-1613920,4,0.333333333333,0.166666666667,0.0,0.666666666667,0.166666666667,0.166666666667,1500.0,7,4,,1500,"[milk, water, sea salt, corn grits, unsalted butter, freshly ground black pepper, shredded sharp cheddar cheese]",Breakfast_Brunch
Cheese-Latkes-The-Shiksa-Blog-48891,5,0.166666666667,0.666666666667,0.0,0.833333333333,0.0,0.333333333333,1200.0,7,17,300.0,1500,"[whole milk ricotta cheese, flour, large eggs, granulated white sugar, kosher salt, baking powder, cooking oil]",Breakfast_Brunch
Cheese_-Egg-_-Potato-Breakfast-Skillet-1593452,4,0.5,0.166666666667,0.166666666667,0.333333333333,0.833333333333,0.166666666667,1800.0,12,4,300.0,2100,"[olive oil, red potato, onions, red pepper, minced garlic, smoked paprika, fresh parsley, black pepper, salt, smoked gouda, sharp cheddar cheese, large eggs]",Breakfast_Brunch
Cheesecake-Stuffed-French-Toast-Sliders-1691299,4,,,,,,,600.0,10,4,900.0,1500,"[slider buns, cream, large eggs, ground cinnamon, vanilla extract, half & half, cooking spray, maple syrup, fresh blueberries, strawberries]",Breakfast_Brunch
Cheesy-Bacon-Potato-Frittata-1629395,4,,,,,,,,14,6,,2700,"[bacon, frozen hash brown potatoes, large eggs, milk, McCormick Sea Salt Grinder, McCormick Garlic Powder, McCormick Onion Powder, McCormick Black Pepper, shredded cheddar cheese, green onions, sour cream, hot sauce, buttered toast, salad]",Breakfast_Brunch
Cheesy-Bacon-_-Chives-Omelet-Cups-1059347,4,,,,,,,,9,4,,2100,"[medium eggs, cooked bacon, yellow onion, margarine, chives, water, shredded cheddar cheese, pepper, salt]",Breakfast_Brunch
Cheesy-Bacon-_-Egg-Crescent-Ring-1322099,4,0.833333333333,0.833333333333,0.0,0.833333333333,0.166666666667,0.5,1200.0,7,8,1200.0,2400,"[bacon, eggs, milk, pepper, salt, cheddar cheese, crescent rolls]",Breakfast_Brunch
Cheesy-Baked-Crescent-Breakfast-Ring-1712731,4,,,,,,,1200.0,11,8,900.0,2100,"[milk, eggs, salt, pepper, chopped garlic, chopped ham, red bell pepper, yellow bell pepper, dinner rolls, Mexican cheese blend, basil]",Breakfast_Brunch
Cheesy-Baked-Egg-in-Toast-1242287,4,0.833333333333,0.833333333333,0.0,0.833333333333,0.666666666667,0.166666666667,,7,4,,1500,"[wheat bread, butter, eggs, shredded cheddar cheese, salt, pepper, chives]",Breakfast_Brunch
Cheesy-Breakfast-Burrito-Bowl-1708101,4,0.833333333333,0.333333333333,0.166666666667,0.833333333333,0.666666666667,0.166666666667,,11,6,,2100,"[flour tortillas, large eggs, milk, bell pepper, onions, tomatoes, cubed ham, shredded cheddar cheese, salt, pepper, olive oil]",Breakfast_Brunch
Cheesy-Breakfast-Grits-1165998,4,0.166666666667,0.166666666667,0.0,0.166666666667,0.166666666667,0.333333333333,,4,4,,600,"[grits, skim milk, shredded cheese, grated parmesan cheese]",Breakfast_Brunch
Cheesy-Broccoli-and-Bacon-Scramble-496128,4,,,,,,,,7,1,,1500,"[butter, eggs, broccoli florets, bacon, shredded cheddar cheese, kosher salt, freshly ground black pepper]",Breakfast_Brunch
Cheesy-Cauliflower-Pancakes-753705,3,0.833333333333,0.333333333333,0.833333333333,0.666666666667,0.833333333333,0.166666666667,,7,4,,1800,"[cauliflower, large eggs, cheddar cheese, panko, cayenne pepper, salt, olive oil]",Breakfast_Brunch
Cheesy-Chicken-Pepper-Broccoli-Frittata-1083390,4,0.166666666667,0.5,0.333333333333,0.666666666667,0.833333333333,0.166666666667,,10,6,,3600,"[cooked chicken breasts, extra-virgin olive oil, broccoli florets, orange bell pepper, green onions, garlic, kosher salt, black pepper, large eggs, sharp cheddar cheese]",Breakfast_Brunch
Cheesy-Chive-Scrambled-Eggs-1601874,4,0.833333333333,0.5,0.0,0.833333333333,0.166666666667,0.166666666667,,7,2,,1500,"[large eggs, milk, shredded mozzarella cheese, chives, salt, pepper, butter]",Breakfast_Brunch
Cheesy-Chorizo-Frittata-1041953,5,,,,,,,,7,6,1200.0,2700,"[mexican chorizo, baby spinach leaves, cherry tomatoes, green onions, eggs, milk, KRAFT Shredded Pepper Jack Cheese with a TOUCH OF PHILADELPHIA]",Breakfast_Brunch
Cheesy-Egg-and-Veggie-Cups-1635919,3,,,,,,,2100.0,7,6,1200.0,3300,"[oil, hash brown potatoes, fresh veget, KRAFT Shredded Sharp Cheddar Cheese, eggs, milk, Kraft Grated Parmesan Cheese]",Breakfast_Brunch
Cheesy-Egg-and-Veggie-Cups-1695278,3,,,,,,,2100.0,7,6,1200.0,3300,"[oil, hash brown potatoes, fresh veget, KRAFT Shredded Sharp Cheddar Cheese, eggs, milk, Kraft Grated Parmesan Cheese]",Breakfast_Brunch
Cheesy-Egg-and-Veggie-Cups-1696611,3,,,,,,,2100.0,7,6,1200.0,3300,"[oil, hash brown potatoes, fresh veget, KRAFT Shredded Sharp Cheddar Cheese, eggs, milk, Kraft Grated Parmesan Cheese]",Breakfast_Brunch
Cheesy-Egg_-Avocado-and-Bacon-Breakfast-Sandwich-1125963,4,,,,,,,,6,2,,1200,"[mini bagels, large eggs, cooked bacon, shredded extra sharp cheddar cheese, california avocado, lime]",Breakfast_Brunch
Cheesy-Potato-Breakfast-Casserole-1620212,3,0.833333333333,0.833333333333,0.0,0.833333333333,0.5,0.166666666667,,6,8,600.0,3600,"[frozen hash brown potatoes, shredded cheddar cheese, shredded sharp cheddar cheese, finely chopped onion, cream of chicken soup, butter]",Breakfast_Brunch
Cheesy-Roasted-Hatch-Chile-Grits-with-Fried-Egg-1711603,4,,,,,,,,9,4,,2100,"[grits, fresh mozzarella cheese, Hatch Green Chiles, milk, eggs, olive oil, fresh chives, jalapeno chilies, salt]",Breakfast_Brunch
Cheesy-Sausage-Breakfast-Bubble-Up-Bake-1049912,3,0.5,0.833333333333,0.166666666667,0.833333333333,0.666666666667,0.166666666667,,7,4,,3000,"[pork sausages, chopped onion, chopped green bell pepper, red bell pepper, eggs, shredded cheddar cheese, biscuits]",Breakfast_Brunch
Cheesy-Scrambled-Eggs-471196,5,0.833333333333,0.333333333333,0.0,0.833333333333,0.166666666667,0.166666666667,,5,6,,1500,"[eggs, water, cheddar cheese, salt, pepper]",Breakfast_Brunch
Cheesy-Spinach-Omelet-466660,4,0.833333333333,0.833333333333,0.0,0.833333333333,0.666666666667,0.166666666667,,5,4,,1500,"[eggs, spinach, cheese, herbes de provence, salt]",Breakfast_Brunch
Cheesy-avocado-omelets-297614,4,,,,,,,,8,2,,1380,"[eggs, knorr garlic minicub, olive oil, shredded Monterey Jack cheese, avocado, chopped fresh cilantro, purple onion, water]",Breakfast_Brunch
Chef-Mickey_s-Breakfast-Pizza-961293,4,,,,,,,,9,4,,1500,"[pizza shells, eggs, heavy cream, salt, pepper, mozzarella cheese, provolone cheese, cheddar cheese, cooked bacon]",Breakfast_Brunch
Cherry-Almond-Coconut-Quinoa-Porridge-1690224,4,,,,,,,600.0,8,1,,600,"[cooked quinoa, almond milk, coconut oil, dried cherry, toasted slivered almonds, coconut, shelled hemp seeds, ground cinnamon]",Breakfast_Brunch
Cherry-Vanilla-Skillet-Baked-Oatmeal-1632703,4,,,,,,,2700.0,12,7,900.0,3600,"[coconut oil, pitted cherries, rolled oats, ground cinnamon, baking powder, salt, eggs, unsweetened almond milk, pure vanilla extract, pure maple syrup, hazelnuts, walnuts]",Breakfast_Brunch
Cherry-Vanilla-Slow-Cooker-Oatmeal-1688771,4,0.166666666667,0.166666666667,0.0,0.166666666667,0.166666666667,0.5,25200.0,8,4,300.0,25500,"[water, milk, steel-cut oats, dried cherry, honey, vanilla extract, cinnamon, salt]",Breakfast_Brunch
Chia-Cereal-1027705,3,,,,,,,,4,4,,1200,"[almond milk, chia seeds, vanilla extract, chocolate]",Breakfast_Brunch
Chia-Oatmeal-with-Blueberries-1601343,4,,,,,,,,6,1,,900,"[water, almond milk, oats, frozen blueberries, chia seeds, coconut flakes]",Breakfast_Brunch
Chia-Seed-Banana-Breakfast-Pudding-682779,4,0.666666666667,0.5,0.0,0.5,0.166666666667,0.333333333333,,6,4,,10800,"[coconut milk, bananas, cinnamon, salt, vanilla extract, chia seeds]",Breakfast_Brunch
Chia-Seed-Pancakes-1709190,4,,,,,,,900.0,9,4,600.0,1500,"[almond milk, spelt flour, chia seeds, poppy seeds, baking soda, salt, brown sugar, eggs, lemon]",Breakfast_Brunch
Chicken-Broccoli-Frittata-1694600,3,0.166666666667,0.166666666667,0.0,0.5,0.833333333333,0.166666666667,,8,2,900.0,1200,"[nonstick spray, broccoli florets, cooked chicken breasts, tomatoes, finely chopped onion, italian seasoning, salt, egg beaters]",Breakfast_Brunch
Chicken-Ham-_-Swiss-Waffles-_low-carb_-1683044,4,0.833333333333,0.833333333333,0.0,0.833333333333,0.166666666667,0.166666666667,300.0,5,4,300.0,600,"[chicken, eggs, ham, mozzarella cheese, swiss cheese]",Breakfast_Brunch
Chicken-and-Waffles-1684538,4,0.333333333333,0.333333333333,0.333333333333,0.333333333333,0.166666666667,0.333333333333,,24,4,,3900,"[chicken fingers, buttermilk, pepper sauce, eggs, panko breadcrumbs, flour, seasoning salt, paprika, onion powder, garlic powder, ground white pepper, vegetable oil, sugar, baking powder, salt, milk, butter, vanilla extract, maple syrup, Tabasco Pepper Sauce]",Breakfast_Brunch
Chickpea-Cinnamon-Toast-Crunch-Cereal-1319169,4,,,,,,,2400.0,5,4,300.0,2700,"[garbanzo beans, olive oil, maple syrup, cinnamon, sea salt]",Breakfast_Brunch
Chickpea-Flour-_Toast_-1709289,3,0.333333333333,0.166666666667,0.5,0.5,0.166666666667,0.166666666667,,7,4,,2100,"[water, chickpea flour, ground cumin, salt, freshly ground pepper, eggs, fresh herbs]",Breakfast_Brunch
Chickpea-Omelet-1696801,3,0.166666666667,0.333333333333,0.0,0.833333333333,0.0,0.166666666667,,8,2,,1200,"[large eggs, water, chickpea flour, kosher salt, freshly ground black pepper, baking powder, spices, olive oil]",Breakfast_Brunch
Chickpea-Pancakes-with-Radish-Top-_-Herb-Yogurt-Sauce-1683851,4,,,,,,,,15,4,,2400,"[garlic shoots, dill, radishes, plain yogurt, olive oil, lemon juice, salt, pepper, chickpea flour, water, hard-boiled egg, bacon]",Breakfast_Brunch
Chinese-Scallion-Pancakes-683181,4,0.166666666667,0.166666666667,0.0,0.166666666667,0.166666666667,0.166666666667,,5,4,,3600,"[plain flour, warm water, canola oil, salt, scallions]",Breakfast_Brunch
Chipotle-Egg-Tacos-1697294,4,,,,,,,,14,4,,1800,"[Pam Cooking Spray, flour, salt, baking powder, oil, warm water, eggs, chipotle, green onions, roma tomatoes, cheddar cheese]",Breakfast_Brunch
Chipotle-Sweet-Potato-and-Brown-Rice-Egg-Skillet-1707659,4,0.5,0.166666666667,0.5,0.166666666667,0.833333333333,0.166666666667,1200.0,11,2,600.0,1800,"[olive oil, purple onion, poblano peppers, sweet potatoes, ground chipotle chile pepper, lime, cooked brown rice, cilantro, eggs, avocado, cotija]",Breakfast_Brunch
Chocolate-Almond-Butter-Overnight-Oatmeal-1619372,4,,,,,,,,7,2,600.0,600,"[rolled oats, bananas, chia seeds, unsweetened almond milk, vanilla extract, almond butter, dark chocolate]",Breakfast_Brunch
Chocolate-Almond-Oatmeal-1594707,4,,,,,,,,8,3,600.0,600,"[unsweetened almond milk, steel-cut oats, chia seeds, goji berries, cacao powder, honey, shelled hemp seeds, fresh berries]",Breakfast_Brunch
Chocolate-Banana-Waffles-1711149,4,0.833333333333,0.166666666667,0.0,0.833333333333,0.166666666667,0.666666666667,,18,4,,1800,"[whole wheat flour, all-purpose flour, ground flax, protein powder, cocoa powder, baking powder, salt, bananas, eggs, honey, peanut butter, canola oil, vanilla, buttermilk, mini chocolate chips, whipped cream, chocolate chips]",Breakfast_Brunch
Chocolate-Breakfast-Oatmeal-1237224,4,,,,,,,,7,1,,300,"[oats, milk, cocoa powder, cinnamon, vanilla extract, honey, mini chocolate chips]",Breakfast_Brunch
Chocolate-Breakfast-Oatmeal-Cupcakes-To-Go_-1629194,4,0.5,0.166666666667,0.0,0.166666666667,0.166666666667,0.666666666667,,10,12,,1800,"[rolled oats, bananas, pure maple syrup, water, oil, pure vanilla extract, salt, cocoa powder, chocolate chips, raisins]",Breakfast_Brunch
Chocolate-Chip-Pancakes-1051927,4,0.666666666667,0.333333333333,0.0,0.5,0.166666666667,0.5,,8,4,,1200,"[large eggs, milk, melted butter, salt, all-purpose flour, baking powder, sugar, chocolate chips]",Breakfast_Brunch
Chocolate-Chip-Pancakes-1056165,4,0.833333333333,0.166666666667,0.0,0.833333333333,0.166666666667,0.666666666667,,9,4,,1500,"[all-purpose flour, sugar, baking powder, salt, milk, butter, eggs, vanilla extract, mini chocolate chips]",Breakfast_Brunch
Chocolate-Chip-Pancakes-1308752,4,0.833333333333,0.166666666667,0.0,0.666666666667,0.166666666667,0.5,1200.0,9,4,600.0,1800,"[all-purpose flour, sugar, baking powder, salt, large eggs, milk, vegetable oil, vanilla extract, semi-sweet chocolate morsels]",Breakfast_Brunch
Chocolate-Chip-Pancakes-1525207,4,0.666666666667,0.166666666667,0.0,0.5,0.166666666667,0.666666666667,240.0,7,10,,240,"[flour, sugar, milk, salt, eggs, baking powder, chips]",Breakfast_Brunch
Chocolate-Chip-Pancakes-1600425,4,,,,,,,,8,4,,1500,"[pancake mix, melted butter, eggs, milk, butter, chocolate chips, maple syrup]",Breakfast_Brunch
Chocolate-Chip-Pancakes-511341,5,0.666666666667,0.333333333333,0.0,0.666666666667,0.0,0.5,1200.0,8,10,900.0,2100,"[large eggs, whole milk, melted butter, salt, flour, baking powder, sugar, chocolate chips]",Breakfast_Brunch
Chocolate-Chip-and-Pecan-Granola-1273180,4,0.833333333333,0.833333333333,0.0,0.166666666667,0.166666666667,0.833333333333,300.0,5,2,60.0,360,"[oatmeal, chopped pecans, dark chocolate chips, maple syrup, olive oil]",Breakfast_Brunch
Chocolate-Coconut-Granola-1285419,4,,,,,,,,6,12,,900,"[coconut oil, gluten free steel cut oats, honey, unsweetened cocoa powder, unsweetened shredded dried coconut, dark chocolate chips]",Breakfast_Brunch
Chocolate-Covered-Maple-Pecan-Bacon-1694453,3,,,,,,,,7,13,,3600,"[bacon, erythritol, maple extract, unsweetened cocoa powder, liquid stevia, roasted pecans]",Breakfast_Brunch
Chocolate-Granola-1703180,4,,,,,,,,9,4,,2400,"[rolled oats, coconut oil, almonds, sunflower seeds, hemp seeds, maple syrup, salt, chocolate chunks, dried strawberries]",Breakfast_Brunch
Chocolate-Hazelnut-Paleo-Pancakes-1699100,4,0.833333333333,0.833333333333,0.0,0.833333333333,0.166666666667,0.666666666667,1200.0,12,4,900.0,2100,"[ground hazelnuts, raw cacao powder, coconut flour, baking powder, salt, almond milk, eggs, raw honey, pure vanilla extract, coconut oil, chopped hazelnuts]",Breakfast_Brunch
Chocolate-Mudslide-Oatmeal-568036,4,,,,,,,,5,1,,600,"[oats, pure vanilla extract, water, salt, sweetener]",Breakfast_Brunch
Chocolate-Oatmeal-1006760,4,0.166666666667,0.166666666667,0.0,0.166666666667,0.166666666667,0.666666666667,600.0,8,2,300.0,900,"[rolled oats, water, unsweetened cocoa powder, honey, salt, vanilla extract, heavy cream, dark chocolate chips]",Breakfast_Brunch
Chocolate-Oatmeal-Breakfast-Bowl-1705127,4,,,,,,,180.0,16,2,120.0,300,"[oats, cocoa powder, chia seeds, brown sugar, vanilla extract, milk, brewed coffee, caramel sauce, chocolate, chopped nuts, fresh berries, honey, maple syrup, granola, spices]",Breakfast_Brunch
Chocolate-Pancakes-1613912,4,0.666666666667,0.166666666667,0.0,0.666666666667,0.166666666667,0.5,900.0,9,6,300.0,1200,"[all-purpose flour, sugar, baking soda, baking powder, salt, cocoa, milk, eggs, extra-virgin olive oil]",Breakfast_Brunch
Chocolate-Pancakes-1619537,4,0.166666666667,0.166666666667,0.0,0.333333333333,0.166666666667,0.5,1200.0,8,5,600.0,1800,"[flour, sugar, salt, unsweetened cocoa powder, buttermilk, eggs, butter, vanilla]",Breakfast_Brunch
Chocolate-Peanut-Butter-Banana-Overnight-Oats-1685896,4,0.833333333333,0.833333333333,0.0,0.333333333333,0.166666666667,0.5,,5,4,,1500,"[quick oats, milk, peanut butter, bananas, honey]",Breakfast_Brunch
Chocolate-Peanut-Butter-Waffles-1708961,4,0.833333333333,0.5,0.0,0.666666666667,0.166666666667,0.5,900.0,10,6,900.0,1800,"[all-purpose flour, unsweetened cocoa powder, sugar, baking powder, salt, milk, peanut butter, eggs, butter, vanilla]",Breakfast_Brunch
Chocolate-Pomegranate-Overnight-Oats-1696762,4,,,,,,,,8,4,,600,"[old-fashioned oats, chia seeds, unsweetened cocoa powder, whey protein powder, stevia, almonds, nonfat plain greek yogurt, pomegranate seeds]",Breakfast_Brunch
Chocolate-Protein-Overnight-Oats-1062734,4,,,,,,,,5,1,,1500,"[old-fashioned oats, nonfat plain greek yogurt, nonfat milk, unsweetened cocoa powder, Truvía® natural sweetener]",Breakfast_Brunch
Chocolate-Protein-Pancakes-1618357,4,0.833333333333,0.333333333333,0.0,0.5,0.166666666667,0.333333333333,240.0,11,12,600.0,840,"[eggs, low-fat cottage cheese, skim milk, canola oil, pure vanilla extract, maple syrup, whole wheat flour, protein powder, unsweetened cocoa powder, baking powder, salt]",Breakfast_Brunch
Chocolate-Protein-Pancakes_-1081703,4,,,,,,,,9,4,,1200,"[whey, cocoa, egg whites, greek yogurt, coconut oil, fruit, protein powder]",Breakfast_Brunch
Chocolate-Quinoa-Pancakes-1698921,4,0.833333333333,0.666666666667,0.0,0.666666666667,0.166666666667,0.333333333333,,11,4,,2100,"[greens, almond meal, Quinoa Flour, honey, gluten-free baking powder, baking soda, salt, large eggs, buttermilk, coconut oil, vanilla extract]",Breakfast_Brunch
Chocolate-Swirled-Breakfast-Rolls-1073022,4,0.833333333333,0.833333333333,0.0,0.833333333333,0.166666666667,0.5,,5,8,,2100,"[dough, butter, sugar, unsweetened cocoa powder, mini chocolate chips]",Breakfast_Brunch
Chocolate-french-silk-pancakes-333719,5,0.666666666667,0.5,0.0,0.333333333333,0.166666666667,0.333333333333,,8,4,,1800,"[whole wheat pastry flour, powdered sugar, unsweetened cocoa powder, baking powder, salt, eggs, lite coconut milk, vanilla extract]",Breakfast_Brunch
Chorizo-and-egg-white-breakfast-burrito-352464,5,,,,,,,,7,2,,1200,"[chorizo, red wine vinegar, large egg whites, large eggs, pepper, salt, wheat]",Breakfast_Brunch
