id,rating,bitter,meaty,piquant,salty,sour,sweet,cookTimeInSeconds,ingredientCount,numberOfServings,prepTimeInSeconds,totalTimeInSeconds,ingredient_list,course
Kurkku-Tilli-Salaatti-Finnish-Pickled-Cucumber-_-Dill-Salad-1689759,4,0.166666666667,0.0,0.0,0.0,0.166666666667,0.333333333333,300.0,5,2,600.0,900.0,"[cucumber, dill, cider vinegar, white sugar, water]",salad
Lambs-Lettuce-Salad-1685641,4,0.5,0.166666666667,0.0,0.166666666667,0.666666666667,0.333333333333,,7,4,,1200.0,"[salad, pomegranate seeds, cherry tomatoes, cheese, olives, hard-boiled egg, dressing]",salad
Layered-Greek-Salad-for-a-Crowd-1711916,3,,,,,,,6000.0,10,18,1500.0,7500.0,"[romaine lettuce, baby spinach leaves, wheat, large tomato, cucumber, purple onion, Kraft Reduced Fat Mayonnaise With Olive Oil, caesar salad dressing, feta cheese, pitted kalamata olives]",salad
Layered-Potato-Salad-with-Parsley-1705133,3,0.166666666667,0.166666666667,0.666666666667,0.166666666667,0.666666666667,0.166666666667,,12,8,,2700.0,"[red potato, garlic cloves, bay leaf, celery tops, sour cream, mayonnaise, horseradish, celery seed, vidalia onion, flat leaf parsley, salt, black pepper]",salad
Layered-Salad-with-Fresh-English-Peas-1694396,4,0.666666666667,0.666666666667,0.0,0.833333333333,0.833333333333,0.333333333333,1800.0,10,4,1200.0,3000.0,"[romaine lettuce, purple onion, diced celery, green onions, garden peas, hard-boiled egg, mayonnaise, sugar, cheddar cheese, cooked bacon]",salad
Layered-Tex-Mex-Taco-Salad-1696443,3,0.166666666667,0.166666666667,0.166666666667,0.333333333333,0.333333333333,0.166666666667,8100.0,10,12,900.0,9000.0,"[Kraft Miracle Whip Dressing, Knudsen Light Sour Cream, taco seasoning mix, black beans, iceberg lettuce, purple onion, KRAFT Mexican Style Shredded Four Cheese with a TOUCH OF PHILADELPHIA, grape tomatoes, avocado, chopped fresh cilantro]",salad
Lebanese-Fattoush-Salad-1575598,4,,,,,,,,11,4,,1500.0,"[pita bread, romaine lettuce, tomatoes, sliced cucumber, sweet onion, lemon juice, canola oil, garlic powder, kosher salt, freshly ground black pepper, sumac]",salad
Lebanese-Tomato-Salad-1704577,4,0.166666666667,0.166666666667,0.0,0.166666666667,0.833333333333,0.333333333333,,8,4,,1800.0,"[tomatoes, sweet onion, spearmint, lemon, extra-virgin olive oil, garlic powder, salt, pepper]",salad
Lebanese-lentil-salad-with-garlic_-cumin_-mint_-and-parsley-309440,5,,,,,,,,11,5,,2400.0,"[green lentil, extra-virgin olive oil, garlic, chopped fresh mint, finely chopped fresh parsley, herbs, lemon juice, ground cumin, ground allspice, salt, ground black pepper]",salad
Leftover-salmon-salad-recipe-with-yogurt-and-dill-309601,5,,,,,,,,9,1,,5400.0,"[salmon, celery, green onions, fresh dill, greek yogurt, mayonnaise, fresh lemon juice, celery seed, salt]",salad
Legume-Salad-1707608,4,0.166666666667,0.166666666667,0.166666666667,0.166666666667,0.833333333333,0.166666666667,,12,4,,1500.0,"[mixed beans, tomatoes, green onions, yellow bell pepper, zucchini, green beans, white wine vinegar, olive oil, dijon mustard, herbes de provence, salt, freshly ground black pepper]",salad
Lemon-Avocado-Salad-Dressing-1621653,4,0.166666666667,0.166666666667,0.0,0.0,0.833333333333,0.333333333333,,5,1,,1200.0,"[avocado, lemon juice, olive oil, honey, water]",salad
Lemon-Basil-Buttermilk-Dressing-1697565,4,0.666666666667,0.166666666667,0.833333333333,0.833333333333,0.666666666667,0.166666666667,,10,2,,1500.0,"[fresh basil leaves, fresh parsley, shallots, fresh lemon juice, pesto, buttermilk, mayonnaise, worcestershire sauce, salt, ground black pepper]",salad
Lemon-Basil-Kale-Salad-with-Avocado-1711150,4,0.666666666667,0.5,0.0,0.166666666667,0.666666666667,0.333333333333,,10,3,1200.0,1200.0,"[fresh lemon juice, olive oil, agave nectar, fresh basil leaves, garlic, lacinato kale, avocado, grapes, purple onion, pumpkin seeds]",salad
Lemon-Dijon-Vinaigrette-1564746,3,0.166666666667,0.833333333333,0.166666666667,0.666666666667,0.833333333333,0.166666666667,,9,2,,1200.0,"[fresh lemon juice, dijon mustard, olive oil, extra-virgin olive oil, shallots, fresh parsley, fresh thyme, kosher salt, freshly ground black pepper]",salad
Lemon-Dijon-Vinaigrette-1600326,4,0.333333333333,0.833333333333,0.166666666667,0.833333333333,0.666666666667,0.5,,8,1,,900.0,"[olive oil, lemon juice, dijon mustard, honey, white wine vinegar, garlic, salt, ground black pepper]",salad
Lemon-Dressing-1633701,3,0.333333333333,0.833333333333,0.0,0.833333333333,0.833333333333,0.166666666667,,5,4,,600.0,"[extra-virgin olive oil, fresh lemon juice, sea salt, black pepper, fresh herbs]",salad
Lemon-Garlic-Kale-Salad-1574187,3,0.833333333333,0.833333333333,0.0,0.833333333333,0.833333333333,0.166666666667,,7,10,,3300.0,"[sliced almonds, lemon juice, kosher salt, extra-virgin olive oil, garlic, kale leaves, freshly grated parmesan]",salad
Lemon-Mint-Dressing-1635728,4,,,,,,,,6,4,,600.0,"[lemon zest, olive oil, fresh mint, maple syrup, dijon mustard, Himalayan salt]",salad
Lemon-Orzo-Salad-with-Asparagus-and-Tomatoes-1698384,4,0.166666666667,0.166666666667,0.166666666667,0.166666666667,0.833333333333,0.166666666667,,10,4,,1800.0,"[orzo, fresh asparagus, grape tomatoes, lemon, extra-virgin olive oil, garlic, fresh parsley, kosher salt, ground pepper, parmigiano reggiano cheese]",salad
Lemon-Pepper-Yogurt-Dressing-1679466,4,0.833333333333,0.833333333333,0.0,0.833333333333,0.833333333333,0.0,,5,1,180.0,180.0,"[fat, extra-virgin olive oil, lemon, cracked black pepper, salt]",salad
Lemon-Potato-Salad-With-Mint-1678104,3,0.5,0.166666666667,0.0,0.666666666667,0.833333333333,0.0,2700.0,7,8,,2700.0,"[gold potatoes, lemon, kosher salt, extra-virgin olive oil, scallions, mint leaves, pepper]",salad
Lemon-Potato-Salad-With-Mint-1707353,3,0.5,0.166666666667,0.0,0.666666666667,0.833333333333,0.0,2700.0,7,8,,2700.0,"[gold potatoes, lemon, kosher salt, extra-virgin olive oil, scallions, mint leaves, pepper]",salad
Lemon-Soy-Edamame-Barley-Bowl-1691206,4,,,,,,,,11,4,,3600.0,"[hulled barley, water, edamame, baby arugula, savory, avocado, low sodium soy sauce, toasted sesame oil, lemon, dried oregano, grated lemon zest]",salad
Lemon-Tarragon-Vinaigrette-1706918,3,0.833333333333,0.833333333333,0.333333333333,0.666666666667,0.833333333333,0.166666666667,,7,6,600.0,600.0,"[fresh lemon juice, shallots, tarragon sprigs, dijon mustard, sea salt, ground black pepper, extra-virgin olive oil]",salad
Lemon-Vinaigrette-1164990,4,0.166666666667,0.833333333333,0.0,0.666666666667,0.833333333333,0.166666666667,,8,14,,900.0,"[lemon juice, extra-virgin olive oil, water, garlic, sea salt, thyme, basil, black pepper]",salad
Lemon-Vinaigrette-498394,3,0.166666666667,0.833333333333,0.666666666667,0.833333333333,0.833333333333,0.166666666667,0.0,5,5,300.0,300.0,"[dijon mustard, fresh lemon juice, extra-virgin olive oil, kosher salt, freshly ground pepper]",salad
Lemon-Vinaigrette-590276,4,0.166666666667,0.833333333333,0.166666666667,0.5,0.666666666667,0.166666666667,,6,4,,900.0,"[lemon juice, lemon zest, dijon mustard, salt, ground black pepper, vegetable oil]",salad
Lemon-Vinaigrette-Dressing-1337032,4,0.666666666667,0.833333333333,0.0,0.833333333333,0.833333333333,0.0,,6,4,300.0,300.0,"[lemon, salt, pepper, garlic, fresh parsley, extra-virgin olive oil]",salad
Lemon-Vinaigrette-Quinoa-Salad-1709014,4,0.166666666667,0.166666666667,0.0,0.166666666667,0.5,0.166666666667,1800.0,14,8,1800.0,3600.0,"[honey, lemon juice, salt, white wine vinegar, olive oil, quinoa, butter, chicken broth, orange, cherry tomatoes, mozzarella cheese, arugula, pinenuts]",salad
Lemony-Cashew-Dressing-1621723,3,0.666666666667,0.833333333333,0.0,0.166666666667,0.833333333333,0.166666666667,,7,1,,2100.0,"[raw cashews, lemon, nutritional yeast, garlic, ground black pepper, fine sea salt, chives]",salad
Lemony-Chickpea-Salad-1606765,4,0.166666666667,0.166666666667,0.0,0.166666666667,0.666666666667,0.333333333333,,11,4,2280.0,2280.0,"[olive oil, lemon, lemon juice, fresh parsley, sea salt, ground black pepper, chickpeas, grape tomatoes, cucumber, purple onion, garlic cloves]",salad
Lemony-Chickpea-and-Escarole-Salad-1663606,4,0.833333333333,0.166666666667,0.166666666667,0.666666666667,0.833333333333,0.333333333333,,12,5,,2700.0,"[small new potatoes, asparagus, lemon juice, fresh dill, extra-virgin olive oil, lemon zest, oregano, sea salt, escarole, chickpeas, roasted red peppers, parmesan cheese]",salad
Lemony-Coleslaw-with-Apples-1700377,3,0.166666666667,0.166666666667,0.0,0.5,0.833333333333,0.333333333333,,11,12,900.0,900.0,"[reduced calorie mayonnaise, fat, lemon zest, fresh lemon juice, sugar, table salt, black pepper, slaw mix, apples, fresh parsley, scallions]",salad
Lemony-Coleslaw-with-Apples-1700377,3,0.166666666667,0.166666666667,0.0,0.5,0.833333333333,0.333333333333,,11,12,900.0,900.0,"[reduced calorie mayonnaise, fat, lemon zest, fresh lemon juice, sugar, table salt, black pepper, slaw mix, apples, fresh parsley, scallions]",salad
Lemony-Coleslaw-with-Apples-1700377,3,0.166666666667,0.166666666667,0.0,0.5,0.833333333333,0.333333333333,,11,12,900.0,900.0,"[reduced calorie mayonnaise, fat, lemon zest, fresh lemon juice, sugar, table salt, black pepper, slaw mix, apples, fresh parsley, scallions]",salad
Lemony-Coleslaw-with-Apples-1700377,3,0.166666666667,0.166666666667,0.0,0.5,0.833333333333,0.333333333333,,11,12,900.0,900.0,"[reduced calorie mayonnaise, fat, lemon zest, fresh lemon juice, sugar, table salt, black pepper, slaw mix, apples, fresh parsley, scallions]",salad
Lemony-Green-Bean-Pasta-Salad-1707285,3,0.5,0.666666666667,0.0,0.5,0.5,0.166666666667,,13,6,,1500.0,"[fine sea salt, penne, green beans, fresh thyme leaves, grated lemon zest, salted roasted pistachios, champagne vinegar, shallots, garlic, freshly ground black pepper, extra-virgin olive oil, arugula, parmigiano reggiano cheese]",salad
Lemony-Orzo-Pasta-Salad-with-Cucumber-and-Feta-1696780,4,,,,,,,600.0,9,4,300.0,900.0,"[orzo pasta, olive oil, lemon, english cucumber, fresh mint, fresh parsley, feta cheese, kosher salt, ground black pepper]",salad
Lemony-Roasted-Asparagus-and-Cauliflower-Salad-1636743,4,0.833333333333,0.166666666667,0.0,0.666666666667,0.833333333333,0.333333333333,,9,5,,3000.0,"[cauliflower florets, asparagus spears, extra-virgin olive oil, pinenuts, grated parmesan cheese, lemon, zest, salt, pepper]",salad
Lentil-Salad-1574226,4,0.5,0.166666666667,0.166666666667,0.833333333333,0.833333333333,0.166666666667,,13,4,,2400.0,"[brown lentils, bay leaf, fresh thyme, carrots, diced celery, red bell pepper, diced red onions, parsley, garlic, lemon juice, olive oil, kosher salt, freshly ground black pepper]",salad
Lentil-Salad-with-Capers-and-Balsamic-Dijon-Dressing-1712531,4,0.833333333333,0.166666666667,0.166666666667,0.166666666667,0.666666666667,0.166666666667,,9,4,,2100.0,"[brown lentils, roma tomatoes, spinach, chives, capers, balsamic vinegar, olive oil, dijon mustard, garlic]",salad
Lentil-Salad-with-Herbed-Goat-Cheese-and-Balsamic-Vinaigrette-1703497,4,,,,,,,1500.0,15,4,480.0,1980.0,"[brown lentils, salt, water, purple onion, cherry tomatoes, fresh parsley, baby spinach, balsamic vinegar, olive oil, dijon mustard, black pepper, fresh chives, goat cheese]",salad
Lentil-and-Quinoa-Salad-with-All-the-Trimmings-1694579,4,,,,,,,,14,4,,1500.0,"[cooked quinoa, puy lentils, shelled pistachios, almonds, pinenuts, capers, goji berries, fresh parsley, lemon juice, olive oil, sea salt, plain yogurt, cumin seed, honey]",salad
Lentil_-Beetroot-_-Sundried-Tomato-Salad-1709534,4,,,,,,,,19,2,,1200.0,"[lentils, beets, sun-dried tomatoes, large carrots, salad leaves, cucumber, radishes, fennel, red capsicum, green chilies, avocado, pinenuts, feta cheese, lime, balsamic vinegar, olive oil, garlic cloves, salt, cracked black pepper]",salad
Light-and-Tangy-Coleslaw-1700838,4,0.166666666667,0.166666666667,0.166666666667,0.166666666667,0.833333333333,0.166666666667,,11,6,,1800.0,"[red cabbage, green cabbage, carrots, scallions, coconut oil, rice vinegar, dijon mustard, greek yogurt, lime, salt, freshly ground black pepper]",salad
Light-and-Tangy-Coleslaw-1705940,4,0.166666666667,0.166666666667,0.166666666667,0.166666666667,0.833333333333,0.166666666667,,11,6,,1800.0,"[red cabbage, green cabbage, carrots, scallions, coconut oil, rice vinegar, dijon mustard, greek yogurt, lime, salt, freshly ground black pepper]",salad
Light-and-healthy-pasta-salad-335500,5,0.166666666667,0.166666666667,0.166666666667,0.166666666667,0.833333333333,0.166666666667,,6,9,,1200.0,"[pasta, red bell pepper, zucchini, yellow squash, broccoli, poppy seed dressing]",salad
Light-summer-fresh-corn-salad-303970,4,0.166666666667,0.166666666667,0.0,0.833333333333,0.666666666667,0.166666666667,,6,4,,900.0,"[corn-on-the-cob, tomatoes, hellmann' or best food light mayonnais, purple onion, lime juice, fresh basil leaves]",salad
Lightened-Up-Broccoli-Salad-1593372,4,0.666666666667,0.166666666667,0.0,0.666666666667,0.833333333333,0.5,,10,4,,3000.0,"[broccoli florets, purple onion, slivered almonds, cranberries, light mayonnaise, greek yogurt, cider vinegar, honey, salt, freshly ground black pepper]",salad
Lightened-Up-Carrot-and-Raisin-Salad-1681755,4,0.166666666667,0.166666666667,0.0,0.166666666667,0.333333333333,0.666666666667,,7,8,1800.0,1800.0,"[shredded carrots, crushed pineapples in juice, raisins, plain greek yogurt, sugar, fresh lemon juice, salt]",salad
Lighter-Potato-Salad-1679676,4,0.5,0.166666666667,0.0,0.166666666667,0.833333333333,0.166666666667,,10,4,,2400.0,"[large potatoes, hard-boiled egg, scallions, celery ribs, light mayonnaise, nonfat yogurt plain, dried dill, white vinegar, salt, pepper]",salad
Lime-And-Ginger-Salad-Dressing-1567672,4,0.166666666667,0.166666666667,0.0,0.0,0.833333333333,0.5,,4,3,600.0,600.0,"[juice, sesame oil, fresh ginger root, honey]",salad
Lime-Coleslaw-1707155,4,0.166666666667,0.166666666667,0.166666666667,0.166666666667,0.833333333333,0.5,,11,6,1500.0,1500.0,"[mayonnaise, white wine vinegar, dijon mustard, granulated sugar, lime, sea salt, freshly ground black pepper, green cabbage, purple onion, carrots, flat leaf parsley]",salad
Lime-Vinaigrette-1584117,4,0.833333333333,0.833333333333,0.5,0.833333333333,0.666666666667,0.166666666667,,8,4,,600.0,"[olive oil, fresh lime juice, dijon mustard, garlic powder, ground cumin, salt, chili powder, ground black pepper]",salad
Lime-_-Coriander-Brown-Rice-Bean-Salad-_vegan_-_gluten-free_-1710136,4,0.333333333333,0.166666666667,0.166666666667,0.333333333333,0.833333333333,0.166666666667,1200.0,13,4,600.0,1800.0,"[brown rice, black beans, corn, red pepper, purple onion, garlic cloves, ground cumin, lime, olive oil, agave nectar, fresh coriander, salt, pepper]",salad
Little-Green-Flair-Bowl-1709621,4,,,,,,,,8,4,,900.0,"[baby spinach, avocado, honeydew melon, cucumber, microgreens, honey, lime, vinaigrette]",salad
Loaded-Baked-Potato-Salad-With-Yogurt-1700923,4,0.5,0.166666666667,0.0,0.5,0.666666666667,0.166666666667,,8,4,,2100.0,"[bacon, potatoes, plain greek yogurt, mayonnaise, sharp cheddar cheese, green onions, black pepper, salt]",salad
Loaded-Greek-Salad-with-Oregano-Vinaigrette-1703303,4,0.666666666667,0.166666666667,0.0,0.833333333333,0.5,0.166666666667,,12,4,1800.0,1800.0,"[mixed salad greens, tomatoes, pitted kalamata olives, sliced cucumber, purple onion, feta cheese crumbles, capers, extra-virgin olive oil, white wine vinegar, Gourmet Garden Oregano, garlic paste, salt]",salad
Loaded-Quinoa-and-Edamame-Salad-1628233,4,0.5,0.166666666667,0.166666666667,0.666666666667,0.666666666667,0.166666666667,,16,7,,3600.0,"[quinoa, vegetable broth, water, edamame, corn, chopped celery, purple onion, red bell pepper, chopped fresh cilantro, feta cheese crumbles, red wine vinegar, dijon mustard, honey, black pepper, salt, extra-virgin olive oil]",salad
Loaded-spinach-salad-333902,5,0.833333333333,0.666666666667,0.0,0.833333333333,0.666666666667,0.166666666667,,6,1,,1200.0,"[spinach, gorgonzola, bacon, sweet onion, toasted pecans, avocado]",salad
Lobster-Cobb-Salad-1700745,4,0.833333333333,0.666666666667,0.166666666667,0.833333333333,0.5,0.166666666667,,12,2,,1800.0,"[lobster meat, baby greens, avocado, hard-boiled egg, center cut bacon, grape tomatoes, corn kernels, dijon mustard, olive oil, red wine vinegar, kosher salt, purple onion]",salad
Lobster-Cobb-Salad-1706122,4,0.833333333333,0.666666666667,0.166666666667,0.833333333333,0.5,0.166666666667,,12,2,,1800.0,"[lobster meat, baby greens, avocado, hard-boiled egg, center cut bacon, grape tomatoes, corn kernels, dijon mustard, olive oil, red wine vinegar, kosher salt, purple onion]",salad
Lovely-Layered-Salad-1711918,3,,,,,,,4800.0,8,16,1200.0,6000.0,"[romaine lettuce leaves, cherry tomatoes, purple onion, eggs, Kraft Reduced Fat Mayonnaise With Olive Oil, Kraft Grated Parmesan Cheese, sugar, shredded cheddar cheese]",salad
Low-Calorie-Creamy-Balsamic-Salad-Dressing-1121413,4,0.666666666667,0.166666666667,0.333333333333,0.833333333333,0.166666666667,0.833333333333,,6,4,,600.0,"[balsamic vinegar, light soy sauce, dijon mustard, honey, nonfat greek yogurt, extra-virgin olive oil]",salad
Low-Calorie-Parmesan-Ranch-Dressing-1699107,4,0.833333333333,0.833333333333,0.0,0.833333333333,0.166666666667,0.166666666667,,6,1,600.0,3600.0,"[ranch dressing, parmesan cheese, apple cider vinegar, garlic powder, onion powder, black pepper]",salad
Low-Fat-BUT-Creamy-Coleslaw-1697329,4,0.166666666667,0.166666666667,0.0,0.166666666667,0.833333333333,0.333333333333,,14,4,600.0,600.0,"[white cabbage, large carrots, purple onion, yoghurt, pears, lime, strawberries, lemon, honey, salt, pepper, cabbage, onions, carrots]",salad
Low-Fat-Chick-Pea-and-Tomato-Salad-1639911,4,0.5,0.333333333333,0.0,0.166666666667,0.833333333333,0.5,,6,5,,900.0,"[chickpeas, grape tomatoes, sliced green onions, lemon, olive oil, chopped fresh mint]",salad
Low-Sodium-Creamy-Dill-Pickle-Dressing-1710424,4,0.166666666667,0.5,0.0,0.0,0.166666666667,0.833333333333,300.0,3,2,300.0,600.0,"[avocado, pickle juice, olive oil]",salad
Lowcountry-Pickled-Coleslaw-1707512,3,0.833333333333,0.166666666667,0.5,0.833333333333,0.833333333333,0.166666666667,,13,8,,2400.0,"[green cabbage, red cabbage, vidalia onion, carrots, sweet pepper, garlic, salt, minced ginger, rice vinegar, olive oil, lime, freshly ground pepper]",salad
Macaroni-Salad-1668471,4,0.5,0.5,0.166666666667,0.833333333333,0.333333333333,0.5,600.0,10,12,900.0,1500.0,"[elbow macaroni, mayonnaise, pickle juice, deveined shrimp, bell pepper, carrots, celery, green onions, salt, pepper]",salad
Macaroni-Salad-1691226,4,,,,,,,,14,4,,2400.0,"[elbow macaroni, mayonnaise, red wine vinegar, sugar, salt, pepper, mustard, sweet pickle juice, whole milk, celery, red bell pepper, purple onion, sliced black olives, fresh parsley]",salad
Macaroni-Salad-1708197,4,0.833333333333,0.833333333333,0.166666666667,0.833333333333,0.5,0.5,,11,4,,2100.0,"[small pasta, mayonnaise, mustard, sour cream, apple cider vinegar, sugar, kosher salt, ground black pepper, ham steak, cheddar cheese, frozen peas]",salad
Macaroni-Salad-1708593,4,0.833333333333,0.166666666667,0.333333333333,0.833333333333,0.833333333333,0.5,,11,4,,1800.0,"[noodles, red pepper, green pepper, diced celery, green onions, carrots, mayonnaise, apple cider vinegar, sugar, salt, pepper]",salad
Macaroni-Salad-1711699,4,0.333333333333,0.166666666667,0.333333333333,0.5,0.5,0.666666666667,,12,16,,2400.0,"[elbow macaroni, carrots, purple onion, green bell pepper, red bell pepper, chopped celery, mayonnaise, sweetened condensed milk, white sugar, white vinegar, salt, pepper]",salad
Macaroni-Salad-471219,5,,,,,,,,7,4,,1800.0,"[macaroni, mayonnaise, spicy brown mustard, pimentos, sweet pickle relish, salt, pepper]",salad
Make-A-Delicious-Classic_-1682221,4,,,,,,,,6,4,300.0,300.0,"[iceberg lettuce, tomatoes, crispy bacon, pepitas, croutons, ranch dressing]",salad
Make-Ahead-Creamy-Cucumber-Salad-1366177,4,0.166666666667,0.166666666667,0.0,0.166666666667,0.333333333333,0.333333333333,,7,4,,2100.0,"[english cucumber, onions, sour cream, lemon juice, sugar, dill, pepper]",salad
Make-This-Greek-Quinoa-Salad-1707471,4,0.666666666667,0.166666666667,0.166666666667,0.833333333333,0.833333333333,0.166666666667,,13,4,,1800.0,"[fresh oregano leaves, garlic cloves, lemon, olive oil, salt, cherry tomatoes, cucumber, feta cheese, bell pepper, diced red onions, pitted olives, chopped parsley, cooked quinoa]",salad
Mama_s-Classic-Coleslaw-1686149,4,0.5,0.166666666667,0.166666666667,0.666666666667,0.833333333333,0.166666666667,,6,10,300.0,300.0,"[slaw mix, mayonnaise, heavy cream, yellow mustard, garlic salt, black pepper]",salad
Mandarin-Orange-Salad-1698542,4,0.333333333333,0.166666666667,0.166666666667,0.5,0.833333333333,0.5,,14,4,,1500.0,"[mixed salad greens, celery, green onions, orange slices, slivered almonds, butter, oil, tarragon vinegar, juice, mandarin oranges, sugar, hot sauce, salt, pepper]",salad
Mandarin-Strawberry-Salad-with-Poppy-Seed-Dressing-1649343,4,0.666666666667,0.833333333333,0.166666666667,0.833333333333,0.666666666667,0.666666666667,,12,4,600.0,600.0,"[olive oil, sugar, apple cider vinegar, poppy seeds, onions, salt, dry mustard, romaine lettuce, mandarin oranges, strawberries, feta cheese, sliced almonds]",salad
Mango-Avocado-Strawberry-Salad-1063960,3,0.166666666667,0.166666666667,0.0,0.0,0.833333333333,0.5,,5,2,,1200.0,"[mango, avocado, strawberries, mint leaves, lemon juice]",salad
Mango-Lime-Dressing-1604046,4,,,,,,,,8,4,,750.0,"[mango, red chili peppers, lime juice, rice vinegar, canola oil, sesame oil, kosher salt, cracked black pepper]",salad
Mango-Lime-Quinoa-Salad-1704575,4,0.5,0.166666666667,0.0,0.166666666667,0.666666666667,0.333333333333,1200.0,12,7,600.0,1800.0,"[quinoa, grape tomatoes, cucumber, avocado, mango, chopped cilantro, olive oil, lime, feta cheese, garlic salt, salt, pepper]",salad
Mango-Lime-Vinaigrette-1708781,4,0.833333333333,0.166666666667,0.166666666667,0.833333333333,0.833333333333,0.666666666667,,7,1,,900.0,"[mango, olive oil, lime juice, rice vinegar, ginger, red pepper flakes, sea salt]",salad
Mango-Pasta-Salad-1704110,4,0.5,0.166666666667,0.666666666667,0.333333333333,0.833333333333,0.5,,20,4,2400.0,2400.0,"[dressing, mango, fresh lime juice, fresh orange juice, honey, cumin, granulated garlic, salt, extra-virgin olive oil, chopped cilantro, freshly ground black pepper, salad, rotini, red bell pepper, yellow bell pepper, green bell pepper, jack cheese, jalapeno chilies]",salad
Mango-Salad-With-Rhubarb-Ginger-Dressing-_-Chili-Almonds-1713104,4,0.833333333333,0.166666666667,0.166666666667,0.166666666667,0.833333333333,0.666666666667,,16,5,,1800.0,"[coconut oil, rhubarb, fresh ginger, lime, maple syrup, extra-virgin olive oil, salt, pepper, raw almonds, chili powder, mango, kale, chives, mint leaves, radishes]",salad
Mango-Shrimp-Salad-1708956,4,0.166666666667,0.166666666667,0.166666666667,0.5,0.833333333333,0.333333333333,,17,4,,4200.0,"[shrimp, shallots, green onions, fresh lemon juice, olive oil, fresh dill, fresh parsley, kosher salt, pepper, red bell pepper, english cucumber, mango, mayonnaise, salt, lettuce leaves]",salad
Mango-_-Avocado-Spring-Salad-with-a-Honey-Lime-Dressing-1641177,3,0.833333333333,0.5,0.0,0.666666666667,0.833333333333,0.666666666667,,10,2,,1200.0,"[honey, olive oil, lime zest, garlic, salt, avocado, mango, lettuce leaves, pumpkin seeds, cashew nuts]",salad
Mango_-Avocado-And-Arugula-Salad-1642493,4,0.5,0.166666666667,0.833333333333,0.166666666667,0.833333333333,0.5,,14,4,,1500.0,"[rocket leaves, mango, avocado, purple onion, lime juice, champagne vinegar, orange juice, olive oil, cumin, chopped cilantro, red chili peppers, salt, pepper]",salad
Mango_-Avocado-_-Broccoli-Salad-631697,3,,,,,,,,7,4,,600.0,"[mango, avocado, broccoli, dates, sea salt, balsamic vinegar, ground pepper]",salad
Mango_-Chickpeas-_-Feta-Roasted-Yams-Salad-1679123,4,0.666666666667,0.166666666667,0.0,0.166666666667,0.833333333333,0.5,,10,4,,1800.0,"[yams, garlic cloves, chickpeas, cucumber, mango, avocado, feta cheese, lime, freshly ground black pepper, coconut]",salad
Maple-Balsamic-Vinaigrette-_Paleo_-1628043,4,0.166666666667,0.833333333333,0.333333333333,0.5,0.166666666667,0.833333333333,,5,4,,300.0,"[extra-virgin olive oil, balsamic vinegar, pure maple syrup, honey mustard, sea salt]",salad
Marinated-Asparagus-Salad-1687883,4,,,,,,,,6,6,,1800.0,"[garlic salt, italian salad dressing mix, dried tarragon leaves, asparagus, tarragon vinegar, black pepper]",salad
Marinated-Cucumber-Salad-1035140,4,0.166666666667,0.166666666667,0.166666666667,0.166666666667,0.166666666667,0.5,,8,4,,1200.0,"[cucumber, purple onion, tomatoes, red wine vinegar, water, sugar, salt, ground pepper]",salad
Marinated-Three-Bean-Salad-with-Artichoke-Hearts-1705485,4,,,,,,,,14,4,,2100.0,"[green beans, wax beans, red kidnei beans, rins and drain, artichoke hearts, green bell pepper, purple onion, granulated sugar, vegetable oil, apple cider vinegar, celery seed, mustard seeds, kosher salt, black pepper, fresh thyme]",salad
Marinated-Tomato-Salad-1204233,4,0.166666666667,0.166666666667,0.166666666667,0.166666666667,0.833333333333,0.333333333333,,6,4,,2100.0,"[medium tomatoes, scallions, green bell pepper, chopped onion, honey, vinegar]",salad
Marinated-Watermelon-and-Tomato-Salad-1694484,3,0.166666666667,0.166666666667,0.0,0.166666666667,0.833333333333,0.5,,8,8,1200.0,2100.0,"[seedless watermelon, fresh lime juice, tomatoes, purple onion, fresh basil leaves, olive oil, black pepper, kosher salt]",salad
Marinated-Zucchini-Feta-Salad-with-Fresh-Corn-and-Toasted-Pistachio-Breadcrumbs-1698691,4,,,,,,,,17,3,0.0,7200.0,"[red wine vinegar, lemon juice, honey, garlic cloves, dried basil, dried oregano, salt, pepper, extra-virgin olive oil, zucchini, feta cheese, corn-on-the-cob, fresh mint, unsalted butter, crusty bread, pistachios]",salad
Maryland-Shrimp-Salad-1712614,4,,,,,,,,6,4,,2100.0,"[shrimp, chopped celery, finely chopped onion, mayonnaise, lemon juice, old bay seasoning]",salad
