id,rating,bitter,meaty,piquant,salty,sour,sweet,cookTimeInSeconds,ingredientCount,numberOfServings,prepTimeInSeconds,totalTimeInSeconds,ingredient_list,course
Roasted-Potato_-Endive_-and-Arugula-Salad-1709712,4,0.333333333333,0.166666666667,0.166666666667,0.166666666667,0.5,0.166666666667,,18,5,,3300.0,"[potatoes, small red potatoes, olive oil, smoked paprika, garlic powder, sea salt, salad, endive, arugula, cooked quinoa, sliced almonds, gorgonzola, dressing, balsamic vinegar, honey, salt, black pepper]",salad
Roasted-Red-Pepper-Pasta-Salad-1706451,4,0.166666666667,0.166666666667,0.5,0.166666666667,0.833333333333,0.5,1500.0,11,6,300.0,1800.0,"[red bell pepper, olive oil, shallots, red wine vinegar, dijon mustard, honey, salt, pepper, bow-tie pasta, corn, chopped fresh cilantro]",salad
Roasted-Red-Pepper-Vinaigrette-1705780,4,0.166666666667,0.833333333333,0.666666666667,0.166666666667,0.833333333333,0.5,1500.0,8,7,300.0,1800.0,"[red bell pepper, shallots, Balsamico Bianco, honey, dijon mustard, extra-virgin olive oil, salt, pepper]",salad
Roasted-Red-Pepper-and-Cucumber-Salad-1708883,4,0.833333333333,0.166666666667,0.166666666667,0.833333333333,0.833333333333,0.333333333333,,15,4,,4500.0,"[apple cider vinegar, sugar, salt, purple onion, nuts, mixed spice, red bell pepper, english cucumber, grape tomatoes, kalamata, olive oil, brine, fresh basil leaves, parmigiano reggiano cheese]",salad
Roasted-Summer-Vegetable-Panzanella-1709393,4,0.333333333333,0.166666666667,0.166666666667,0.166666666667,0.666666666667,0.333333333333,2100.0,12,5,900.0,3000.0,"[whole grain baguette, olive oil, purple onion, grape tomatoes, medium zucchini, salt, black pepper, balsamic vinegar, whole grain mustard, arugula, basil leaves, fresh mozzarella]",salad
Roasted-Tomato-Caprese-Salad-1439971,4,,,,,,,,4,4,,1500.0,"[tomatoes, pesto, parmesan cheese, fresh mozzarella]",salad
Roasted-Tomato-Vinaigrette-1276252,3,,,,,,,900.0,8,1,1200.0,2100.0,"[Sun Gold tomatoes, olive oil, shallots, garlic, red wine vinegar, kosher salt, ground black pepper, grated lemon zest]",salad
Roasted-Tomato-Vinaigrette-1706688,3,0.166666666667,0.166666666667,0.5,0.833333333333,0.666666666667,0.166666666667,,7,4,600.0,7200.0,"[plum tomatoes, chopped garlic, extra-virgin olive oil, italian seasoning mix, kosher salt, freshly ground pepper, sherry vinegar]",salad
Roasted-Vegetable-Chickpea-Salad-1702351,4,0.833333333333,0.666666666667,0.166666666667,0.333333333333,0.833333333333,0.5,,15,6,,3600.0,"[beefsteak tomatoes, poblano peppers, red bell pepper, corn kernels, white onion, garlic, extra-virgin olive oil, sea salt, black pepper, chickpeas, feta cheese crumbles, white wine vinegar, honey, fresh basil, fresh chives]",salad
Roasted-Vegetable-Couscous-Salad-_SundaySupper-1680911,4,0.166666666667,0.333333333333,0.166666666667,0.166666666667,0.666666666667,0.166666666667,3000.0,16,6,1800.0,4800.0,"[vegetables, bell pepper, zucchini, eggplant, olive oil, salt, dried thyme, black pepper, crushed garlic, lemon juice, lemon zest, pearl couscous, pinenuts, parsley, feta cheese]",salad
Roasted-beet-and-red-onion-salad-314481,5,0.666666666667,0.166666666667,0.0,0.833333333333,0.333333333333,0.5,,7,8,,3600.0,"[red beets, purple onion, extra-virgin olive oil, vinegar, salt, cumin, pepper]",salad
Roasted-beet-salad-with-ricotta-salata-and-pistachios-310163,5,0.666666666667,0.166666666667,0.0,0.166666666667,0.833333333333,0.166666666667,,6,2,,1800.0,"[beets, greens, ricotta salata, shelled pistachios, olive oil, lemon juice]",salad
Roasted-mushroom-and-green-bean-farro-salad-351022,5,0.166666666667,0.166666666667,0.0,0.166666666667,0.166666666667,0.166666666667,1200.0,12,4,600.0,1800.0,"[water, farro, mushrooms, green beans, oil, thyme, salt, pepper, feta cheese, walnuts, balsamic vinaigrette]",salad
Roasted-potato-_-avocado-salad-303590,4,,,,,,,,6,6,,3300.0,"[all purpose potatoes, red bell pepper, sliced, hellmann' or best food real mayonnais, avocado, chopped fresh cilantro, purple onion]",salad
Romaine-Wedge-Salad-with-Chive-Dressing-1704738,4,,,,,,,60.0,17,6,300.0,360.0,"[romaine lettuce, raw cashews, cashew nuts, lemon, fresh chives, fresh parsley, garlic, sea salt, black pepper, tomatoes, purple onion, bacon bits, sunflower seeds, smoked paprika, olive oil, lemon juice]",salad
Romaine-_-green-apple-salad-with-pecans-297847,4,0.166666666667,0.166666666667,0.0,0.166666666667,0.833333333333,0.333333333333,,5,4,,900.0,"[romaine lettuce, apples, wish bone red wine vinaigrett dress, chopped pecans, blue cheese]",salad
Russian-Dressing-541621,4,0.833333333333,0.666666666667,0.833333333333,0.833333333333,0.333333333333,0.5,,9,4,,1200.0,"[mayonnaise, ketchup, onions, horseradish, dill pickles, worcestershire sauce, parsley, smoked paprika, ground black pepper]",salad
SALAD-WITH-CHICKEN-AND-BEANS-1696359,4,0.166666666667,0.333333333333,0.166666666667,0.333333333333,0.833333333333,0.166666666667,,7,4,,1500.0,"[chicken legs, sweet pepper, cucumber, fresh parsley, beans, mayonnaise, salt]",salad
SALAD-WITH-CHICKEN-AND-MUSHROOMS-1703518,4,,,,,,,,7,4,,1200.0,"[chicken breasts, mushrooms, cucumber, cheese, peas, corn, mayonnaise]",salad
SHRIMP-RICE-SALAD-with-lime-and-cumin-dressing-1702426,3,0.166666666667,0.166666666667,0.0,0.166666666667,0.333333333333,0.166666666667,600.0,9,4,7200.0,7800.0,"[shrimp, basmati rice, lime, fresh cilantro, extra-virgin olive oil, shrimp stock, cumin seed, black pepper, table salt]",salad
SONOMA-CHICKEN-SALAD-1698601,4,0.166666666667,0.833333333333,0.166666666667,0.5,0.166666666667,0.333333333333,,10,4,,3000.0,"[mayonnaise, apple cider vinegar, honey, poppy seeds, salt, freshly ground pepper, boneless skinless chicken breasts, pecans, seedless red grapes, celery]",salad
SPRING-SALAD-WITH-WHITE-BEANS_-AVOCADO_-AND-RADISH-1705498,4,0.833333333333,0.833333333333,0.166666666667,0.666666666667,0.833333333333,0.166666666667,,10,2,,1800.0,"[white beans, garlic, olive oil, salt, cracked black pepper, chili flakes, radishes, avocado, basil leaves, lime wedges]",salad
SWEET-AND-SOUR-BROCCOLI-SALAD-546065,4,,,,,,,,6,3,,1200.0,"[sweet and sour sauce, broccoli, sesame oil, black sesame seeds, roasted cashews, scallions]",salad
SWEET-and-SOUR-COLESLAW-1693650,4,0.166666666667,0.166666666667,0.0,0.833333333333,0.833333333333,0.333333333333,,11,4,,1800.0,"[cabbage, white onion, roma tomatoes, broccoli, dried basil, sugar, apple cider vinegar, extra-virgin olive oil, kosher salt, mayonnaise, black pepper]",salad
Salad-Chanterelle-1697061,4,,,,,,,,7,4,,2100.0,"[chicken breast fillets, pickles, carrots, cheese, garlic, mayonnaise, herbs]",salad
Salad-Metropolitan-1700609,4,0.166666666667,0.333333333333,0.0,0.333333333333,0.333333333333,0.166666666667,,7,4,,2100.0,"[meat, boiling potatoes, cucumber, salad, eggs, olives, mayonnaise]",salad
Salad-Of-Calendula-Flowers_-Radish-And-Grapefruit-1705573,4,0.166666666667,0.166666666667,0.0,0.166666666667,0.833333333333,0.333333333333,,11,4,,900.0,"[orange, grapefruit, avocado, rocket leaves, calendula flowers, salad, radishes]",salad
Salad-Of-Farro-With-Baby-Beetroots_-Gorgonzola-And-Candied-Walnuts-1699992,4,,,,,,,,8,4,,3000.0,"[beets, red wine vinegar, brown sugar, bay leaves, farro, gorgonzola dolce, dill tips, freekeh]",salad
Salad-Shirazi-1686464,4,0.166666666667,0.166666666667,0.0,0.166666666667,0.5,0.166666666667,,7,4,600.0,600.0,"[persian cucumber, medium tomatoes, purple onion, lime, olive oil, salt, pepper]",salad
Salad-With-Asparagus-And-Tomatoes-1689016,4,0.666666666667,0.166666666667,0.0,0.666666666667,0.666666666667,0.166666666667,,10,4,,1500.0,"[asparagus, eggs, olive oil, ground coriander, shallots, clove, green onions, wine vinegar, cherry tomatoes, salt]",salad
Salad-With-Cherry-Tomatoes-And-Prawns-1704872,4,,,,,,,,8,4,,1200.0,"[peeled shrimp, cherry tomatoes, salad, cucumber, crab sticks, dill, garlic, cream]",salad
Salad-With-Chicken-And-Prunes-1697131,4,,,,,,,,7,4,,1800.0,"[chicken fillets, eggs, prunes, walnuts, cheese, mayonnaise, salt]",salad
Salad-With-Cilantro-Dressing-1708666,3,0.5,0.166666666667,0.5,0.333333333333,0.166666666667,0.166666666667,,14,6,900.0,900.0,"[dressing, vegan mayonnaise, cilantro, jalapeno chilies, scallions, white wine vinegar, water, salt, salad, mixed salad greens, brown rice, black beans, pumpkin seeds, chips]",salad
Salad-With-Ham-And-Peppers-1701718,4,,,,,,,,9,4,,1800.0,"[ham, green beans, canned corn, onions, herbs, salad, salt, balsamic vinegar, mayonnaise]",salad
Salad-with-Asparagus_-Cherry-Tomatoes_-Kalamata-Olives_-and-Feta-1020171,5,0.666666666667,0.166666666667,0.0,0.5,0.666666666667,0.166666666667,,7,3,,1500.0,"[asparagus, cherry tomatoes, kalamata, feta cheese, lemon juice, greek seasoning, extra-virgin olive oil]",salad
Salad-with-Nuts_-Feta-and-Cranberries-_Two-Ways__-1171620,4,0.833333333333,0.666666666667,0.0,0.833333333333,0.833333333333,0.5,,10,5,,900.0,"[baby spinach, roasted cashews, dried cranberries, feta cheese, balsamic vinaigrette salad dressing, spring mix, walnut pieces]",salad
Salmon-Rice-Salad-1708600,4,0.166666666667,0.166666666667,0.0,0.333333333333,0.166666666667,0.166666666667,,9,4,,2700.0,"[brown rice, water, hard-boiled egg, salmon, dill pickles, green onions, mayonnaise, salt, pepper]",salad
Salmon-salad-with-cucumber-_-cherry-tomatoes-299594,4,,,,,,,,5,4,,600.0,"[lettuce, cucumber, tomatoes, Wish-Bone Italian Dressing, salmon]",salad
Salt-and-Vinegar-Potato-Salad-1710129,4,,,,,,,1800.0,9,7,900.0,2700.0,"[russet potatoes, white vinegar, vegan mayonnaise, fresh dill, dijon mustard, salt, black pepper, radishes, purple onion]",salad
Savory-Citrus-Salad-Dressing-1623747,3,0.166666666667,0.166666666667,0.0,0.333333333333,0.833333333333,0.333333333333,,9,4,,900.0,"[orange, green onions, balsamic vinegar, garlic, raw honey, lime, olive oil, sea salt, pepper]",salad
Savory-Watermelon-Salad-1687382,4,0.166666666667,0.166666666667,0.0,0.166666666667,0.833333333333,0.5,,5,4,1500.0,1500.0,"[watermelon, feta cheese, purple onion, mint leaves, pepper]",salad
Seafood-Citrus-Salad-1240281,3,,,,,,,,7,4,,900.0,"[butter lettuce, watercress, green apples, cooked shrimp, avocado, grapefruit, Soy Vay® Citrus ‘N Ginger Dressing & Sauce]",salad
Seafood-Salad-1480273,4,,,,,,,,6,4,,1200.0,"[imitation crab meat, mayonnaise, celery, old bay seasoning, dill, salt]",salad
Seared-Feta-Cheese-Garden-Salad-1700891,4,0.166666666667,0.166666666667,0.0,0.166666666667,0.666666666667,0.333333333333,120.0,7,5,180.0,300.0,"[feta cheese, extra-virgin olive oil, mixed salad greens, cherry tomatoes, cucumber, salad dressing, balsamic vinaigrette]",salad
Seaweed-Salad-518398,4,,,,,,,,4,4,,1800.0,"[seaweed, sesame seeds, tomatoes, rice vinegar]",salad
Sesame-Carrot-and-Cucumber-Slaw-1703292,4,0.166666666667,0.166666666667,0.166666666667,0.666666666667,0.166666666667,0.166666666667,,10,4,900.0,900.0,"[cucumber, medium carrot, sesame oil, light soy sauce, ginger root, toasted sesame seeds, garlic cloves, sugar, red pepper flakes, kosher salt]",salad
Sesame-Cucumber-Salad-1703970,4,0.166666666667,0.166666666667,0.0,0.166666666667,0.166666666667,0.166666666667,,7,1,,600.0,"[cucumber, rice vinegar, agave nectar, salt, wakame, sesame oil, sesame seeds]",salad
Sesame-Ginger-Pickled-Cucumbers-1640332,4,,,,,,,,6,4,,1800.0,"[rice vinegar, sugar, sesame oil, garlic cloves, fresh ginger, kirby cucumbers]",salad
Sesame-Noodle-Salad-1700052,4,,,,,,,,18,4,,2100.0,"[lime, low sodium soy sauce, extra-virgin olive oil, brown sugar, ginger, toasted sesame oil, garlic, napa cabbage, red cabbage, red bell pepper, yellow bell pepper, large carrots, green onions, persian cucumber, pea pods, fresh basil, fresh cilantro, linguini]",salad
Sesame-Noodle-Salad-1705290,4,0.666666666667,0.833333333333,0.166666666667,0.833333333333,0.833333333333,0.5,1500.0,12,5,600.0,2100.0,"[olive oil, dark sesame oil, red pepper, honey, soy sauce, vermicelli, salt, chopped cilantro, salted roast peanuts, sliced green onions, red bell pepper, toasted sesame seeds]",salad
Sesame-Peanut-Soba-Noodle-Salad-with-Avocado-1698859,4,0.833333333333,0.166666666667,0.5,0.833333333333,0.666666666667,0.166666666667,,16,4,,2100.0,"[soba noodles, canola oil, onions, garlic cloves, ginger, shredded carrots, sugar pea, toasted sesame oil, soy sauce, brown sugar, creamy peanut butter, chile sauce, scallions, toasted sesame seeds, avocado, lime wedges]",salad
Sesame-Roasted-Asparagus-Salad-1636188,4,0.5,0.166666666667,0.0,0.166666666667,0.666666666667,0.333333333333,,4,4,900.0,1500.0,"[asparagus, olive oil, coarse kosher salt, dressing]",salad
Sesame-Sriracha-Buddha-Bowls-1687157,4,,,,,,,2400.0,16,4,,3600.0,"[forbidden rice, water, curly kale, toasted sesame oil, sea salt, toasted sesame seeds, rice vinegar, low sodium soy sauce, seasoning, mild olive oil, frozen shelled edamame, tofu, seedless cucumber, avocado]",salad
Seven-Layer-Dip-Macaroni-Salad-1679507,4,0.833333333333,0.166666666667,0.166666666667,0.833333333333,0.333333333333,0.166666666667,600.0,11,7,4500.0,5100.0,"[elbow macaroni, mayonnaise, sour cream, taco seasoning, black beans, diced tomatoes, green onions, cheddar cheese, sliced black olives, avocado, salt]",salad
Seven-Layer-Salad-1242735,3,,,,,,,8100.0,8,12,900.0,9000.0,"[salad greens, celery, red pepper, green onions, frozen peas, Kraft Mayonnaise, KRAFT Shredded Sharp Cheddar Cheese, Oscar Mayer Fully Cooked Bacon]",salad
Seven-Layer-Salad-Made-Over-1707060,3,,,,,,,4800.0,7,12,1200.0,6000.0,"[baby spinach leaves, red pepper, green onions, frozen peas, Kraft Reduced Fat Mayonnaise With Olive Oil, shredded cheddar cheese, Oscar Mayer Turkey Bacon]",salad
Seven-Layer-Salad-Made-Over-1707177,3,,,,,,,4800.0,7,12,1200.0,6000.0,"[baby spinach leaves, red pepper, green onions, frozen peas, Kraft Reduced Fat Mayonnaise With Olive Oil, shredded cheddar cheese, Oscar Mayer Turkey Bacon]",salad
Shabu-Shabu-Salad-1688842,4,0.833333333333,0.666666666667,0.0,0.833333333333,0.5,0.166666666667,,7,2,,900.0,"[pork loin, lettuce, onions, sake, salt, dressing]",salad
Shaved-Asparagus-Dressing-1637548,4,0.833333333333,0.5,0.0,0.833333333333,0.666666666667,0.333333333333,,8,4,600.0,600.0,"[asparagus, green onions, shaved parmesan cheese, dressing, balsamic vinegar, olive oil, salt, pepper]",salad
Shaved-Asparagus-and-Orange-Salad-1642842,4,0.333333333333,0.166666666667,0.166666666667,0.833333333333,0.833333333333,0.5,120.0,11,4,600.0,720.0,"[asparagus, navel oranges, radishes, feta cheese, orange juice, lemon juice, olive oil, kosher salt, shallots, mustard, honey]",salad
Shaved-_-Curried-Cauliflower-Salad-1705466,4,0.5,0.166666666667,0.5,0.166666666667,0.833333333333,0.333333333333,,12,4,,2400.0,"[cauliflower, garbanzo beans, dried apricot, celery leaves, Italian parsley leaves, mint leaves, orange, shallots, curry powder, red pepper flakes, olive oil, salt]",salad
Shockingly-simple-coleslaw-369922,4,0.333333333333,0.166666666667,0.166666666667,0.166666666667,0.833333333333,0.5,,5,4,,2700.0,"[slaw mix, mayonnaise, sugar, dijon mustard, honey]",salad
Shredded-Carrot-and-Beet-Salad-1712327,4,0.666666666667,0.166666666667,0.0,0.666666666667,0.833333333333,0.5,,8,4,600.0,600.0,"[orange juice, lemon juice, extra-virgin olive oil, fresh ginger, sea salt, shredded carrots, red beets, chopped fresh mint]",salad
Shrimp-And-Edamame-Power-Salad-In-A-Jar-1683587,4,0.166666666667,0.333333333333,0.0,0.166666666667,0.833333333333,0.166666666667,,9,1,600.0,600.0,"[dressing, arame, chives, edamame, peeled shrimp, shredded carrots, sugar pea, cabbage, romaine lettuce]",salad
Shrimp-Caesar-Salad-1703242,4,0.5,0.166666666667,0.833333333333,0.5,0.833333333333,0.166666666667,,18,4,,1800.0,"[light mayonnaise, lemon juice, shredded parmesan cheese, minced garlic, worcestershire sauce, water, salt, black pepper, medium shrimp, extra-virgin olive oil, romaine lettuce, parmesan cheese, cherry tomatoes, pinenuts, seasoned croutons]",salad
Shrimp-Corn-and-Barley-Salad-1708304,4,,,,,,,1080.0,10,4,600.0,1680.0,"[walnuts, feta cheese crumbles, cilantro leaves, barley, kosher salt, corn husks, olive oil, freshly ground black pepper, jumbo shrimp, fresh lime juice]",salad
Shrimp-Scampi-Salad-1690117,4,0.333333333333,0.5,0.166666666667,0.5,0.666666666667,0.166666666667,,15,4,,1500.0,"[salad, shrimp scampi, arugula, baby spinach, pasta, fresh asparagus, parmesan cheese, dressing, extra-virgin olive oil, fresh lemon juice, white vinegar, shallots, kosher salt, red pepper flakes, pepper]",salad
Shrimp-_-Quinoa-Salad-1698616,4,,,,,,,,9,4,,900.0,"[quinoa, black beans, shrimp tails, red bell pepper, cilantro, extra-virgin olive oil, lime juice, ground cumin, sea salt]",salad
Shrimp-_-avocado-salad-296924,4,,,,,,,,6,6,,3600.0,"[olive oil, onions, jalapeno chilies, uncook medium shrimp, peel and devein, avocado, Best Food's Mayonnaise with Lime Juice]",salad
Shrimp-and-macaroni-salad-309787,5,0.166666666667,0.166666666667,0.0,0.5,0.666666666667,0.166666666667,,10,5,,5400.0,"[macaroni, shrimp, celery, sliced green onions, pepper, salt, mayonnaise, juice, fresh lemon juice, celery seed]",salad
Simone_s-Shallot-Vinaigrette-1171233,3,,,,,,,,6,1,,1800.0,"[shallots, fresh lemon juice, rice vinegar, kosher salt, ground black pepper, olive oil]",salad
Simple-Caesar-Salad-1681793,4,,,,,,,,16,4,,2400.0,"[red wine vinegar, lemon juice, garlic, salt, pepper, extra-virgin olive oil, parmesan cheese, egg yolks, romaine lettuce, country bread, olive oil, dried mixed herbs, garlic powder]",salad
Simple-Caprese-Salad-512034,5,0.833333333333,0.666666666667,0.5,0.833333333333,0.5,0.166666666667,,6,4,600.0,600.0,"[tomatoes, fresh mozzarella, basil, extra-virgin olive oil, coarse salt, freshly ground pepper]",salad
Simple-Carrot-Cherry-Salad-1700690,4,0.333333333333,0.166666666667,0.0,0.333333333333,0.666666666667,0.5,,5,4,,900.0,"[shredded carrots, cherries, tahini, lemon, salt]",salad
Simple-Coleslaw-1320244,4,,,,,,,,5,4,600.0,600.0,"[broccoli slaw, red cabbage, mayonnaise, maple syrup, apple cider vinegar]",salad
Simple-Corn-Salad-1617900,4,,,,,,,,9,4,,2100.0,"[ear of corn, bacon, green onions, fresh mushrooms, olive oil, lemon juice, honey, salt, pepper]",salad
Simple-Creamy-Southern-Coleslaw-with-Mayonnaise-1679151,4,0.5,0.166666666667,0.0,0.5,0.833333333333,0.333333333333,,9,8,,3000.0,"[green cabbage, large carrots, white onion, distilled vinegar, mayonnaise, white sugar, salt, ground black pepper, celery seed]",salad
Simple-Cucumber-and-Onion-Salad-1704329,4,0.166666666667,0.166666666667,0.0,0.333333333333,0.166666666667,0.166666666667,,8,4,600.0,600.0,"[pickling cucumbers, vidalia onion, white vinegar, water, sugar, salt, garlic cloves, black pepper]",salad
Simple-German-_Swabian_-Potato-Salad-_-Schwabischer-Kartoffelsalat-1694314,4,,,,,,,,8,5,,3600.0,"[yukon gold, salt, beef broth, yellow onion, white wine vinegar, freshly ground black pepper, vegetable oil, finely chopped fresh parsley]",salad
Simple-Herb-Vinaigrette-1566273,4,0.166666666667,0.833333333333,0.0,0.666666666667,0.166666666667,0.166666666667,,8,1,,2700.0,"[olive oil, rice vinegar, fresh herbs, garlic, honey, grated parmesan cheese, salt, pepper]",salad
Simple-Honey-Lime-Dressing-609111,3,,,,,,,,6,6,300.0,1200.0,"[fresh lime juice, extra-virgin olive oil, honey, garlic powder, sea salt, ground pepper]",salad
Simple-Kale-Salad-with-Lemon-Vinaigrette-1704387,4,,,,,,,,9,5,900.0,900.0,"[kale, grated parmesan cheese, slivered almonds, lemon juice, extra-virgin olive oil, garlic, dijon mustard, salt, pepper]",salad
Simple-Lemon-Honey-Salad-Dressing-638917,3,,,,,,,,5,4,,900.0,"[extra-virgin olive oil, lemon juice, honey, ground black pepper, sea salt]",salad
Simple-Lemon-Tahini-Dressing-1707277,4,,,,,,,,7,4,300.0,300.0,"[tahini, lemon, garlic, warm water, extra-virgin olive oil, sea salt, chili flakes]",salad
Simple-Lemon-Vinaigrette-783172,3,,,,,,,,7,1,600.0,600.0,"[grated lemon zest, lemon juice, sugar, dijon mustard, fine sea salt, extra-virgin olive oil, ground black pepper]",salad
Simple-Low-Carb-Mediterranean-Summer-Salad-1706633,4,,,,,,,,6,4,,900.0,"[sliced tomatoes, bell pepper, onions, extra-virgin olive oil, apple cider vinegar, Himalayan salt]",salad
Simple-Macaroni-Salad-1686036,4,0.166666666667,0.166666666667,0.166666666667,0.833333333333,0.166666666667,0.166666666667,300.0,13,6,300.0,600.0,"[ditalini, olive oil, purple onion, celery, cherry tomatoes, mayonnaise, dry mustard, sugar, apple cider vinegar, sour cream, salt, fresh parsley, black pepper]",salad
Simple-Seven-Layer-Potato-Salad-1690875,4,0.333333333333,0.166666666667,0.0,0.166666666667,0.5,0.166666666667,900.0,12,11,,4500.0,"[small red potatoes, mayonnaise, sour cream, celery salt, salt, freshly ground black pepper, hard-boiled egg, diced celery, shredded cheddar cheese, green onions, bacon, chopped parsley]",salad
Simple-Skinny-Cucumber-Salad-1565029,4,0.166666666667,0.166666666667,0.0,0.333333333333,0.166666666667,0.166666666667,,5,6,600.0,600.0,"[rice vinegar, sugar, salt, chives, sliced cucumber]",salad
Simple-Spinach-and-Strawberry-Salad-1576262,4,0.166666666667,0.833333333333,0.0,0.166666666667,0.833333333333,0.666666666667,,8,2,,1200.0,"[canola oil, strawberries, honey, white wine vinegar, baby spinach, pinenuts, poppy seeds]",salad
Simple-Strawberry-Spinach-Salad-1624867,4,0.166666666667,0.166666666667,0.166666666667,0.833333333333,0.833333333333,0.666666666667,1200.0,12,2,600.0,1800.0,"[chicken breasts, kosher salt, cracked black pepper, balsamic vinaigrette, dijon mustard, olive oil, fresh spinach, strawberries, avocado, honey, queso fresco, cilantro]",salad
Simple-Summer-Escarole-Salad-1697180,4,0.5,0.166666666667,0.0,0.166666666667,0.666666666667,0.166666666667,,7,4,,1200.0,"[escarole, tomatoes, avocado, olives, nuts, olive oil, Balsamico Bianco]",salad
Simple-Summer-Pasta-Salad-1709950,4,,,,,,,480.0,11,7,300.0,780.0,"[pasta, shredded carrots, ranch salad dressing mix, mayonnaise, milk, spicy brown mustard, frozen peas, bacon bits, sliced black olives, sun-dried tomatoes, shredded parmesan cheese]",salad
Simple-Summer-Salad-1709119,4,,,,,,,,7,1,900.0,900.0,"[spring mix, parsley, hard-boiled egg, bacon, tomatoes, onions, cheese]",salad
Simple-Summer-Tomato-Salad-1696403,4,0.5,0.166666666667,0.0,0.333333333333,0.833333333333,0.166666666667,,4,1,,600.0,"[tomatoes, extra-virgin olive oil, sea salt, fresh parsley]",salad
Simple-Tabbouleh-1237669,4,0.333333333333,0.166666666667,0.0,0.333333333333,0.833333333333,0.166666666667,,9,8,900.0,4800.0,"[boiling water, bulgur wheat, extra-virgin olive oil, lemon juice, salt, medium tomatoes, curly parsley, chopped fresh mint, purple onion]",salad
Simple-Wintry-Salad-1696275,4,,,,,,,,17,4,,1500.0,"[salad, radicchio, shredded carrots, persimmon, pomegranate seeds, hemp seeds, toasted pine nuts, toasted shredded coconut, fresh thyme, dressing, satsumas, water, apple cider vinegar, olive oil, garlic cloves, maple syrup, sea salt]",salad
Simply-The-Best-Carrot-Salad-Ever_-1611977,4,,,,,,,,13,1,,1500.0,"[carrots, raisins, dried cranberries, pumpkin seeds, chopped pecans, chopped walnuts, fresh parsley, grated coconut, white wine vinegar, honey, salt, black pepper, dijon mustard]",salad
Simply-The-Best-Potato-Salad-1679809,4,0.833333333333,0.166666666667,0.0,0.833333333333,0.833333333333,0.166666666667,,10,4,,3000.0,"[eggs, white vinegar, large potatoes, salt, green onions, sweet onion, mayonnaise, milk, pepper]",salad
Skinny-Broccoli-Salad-1006916,4,0.5,0.166666666667,0.0,0.166666666667,0.833333333333,0.5,,8,4,,1200.0,"[broccoli, purple onion, sunflower kernels, raisins, plain greek yogurt, sugar, white vinegar, bacon]",salad
Skinny-Caesar-Dressing-1688332,4,,,,,,,,7,3,,1200.0,"[parmigiano reggiano cheese, fresh lemon juice, garlic cloves, dijon mustard, anchovy fillets, extra-virgin olive oil, fat free greek yogurt]",salad
Skinny-Cauliflower-Salad-1693255,4,0.166666666667,0.166666666667,0.333333333333,0.166666666667,0.833333333333,0.166666666667,,10,4,,3300.0,"[cauliflower, chopped celery, scallions, chopped green bell pepper, hard-boiled egg, fresh parsley, olive oil, red wine vinegar, mustard, salt]",salad
Skinny-Chicken-Waldorf-Salad-1693787,4,0.166666666667,0.166666666667,0.0,0.5,0.666666666667,0.166666666667,,11,4,,3000.0,"[chicken breasts, fat-free chicken broth, apples, seedless red grapes, celery, Hellmann's® Real Mayonnaise, fat free greek yogurt, salt, pepper, pecans, baby greens]",salad
Skinny-Classic-Coleslaw-1629030,4,0.333333333333,0.166666666667,0.166666666667,0.333333333333,0.833333333333,0.333333333333,,13,10,900.0,900.0,"[sweet onion, plain greek yogurt, mayonnaise, white vinegar, sugar, dijon mustard, salt, celery seed, black pepper, red cabbage, shredded carrots, celery heart, parsley]",salad
Skinny-Cucumber-Ranch-Dressing-1693393,4,0.166666666667,0.166666666667,0.166666666667,0.333333333333,0.833333333333,0.166666666667,,11,2,,600.0,"[low-fat buttermilk, light mayonnaise, fat free greek yogurt, cucumber, fresh parsley, garlic, chives, lemon, garlic powder, ground pepper, salt]",salad
Skinny-Ranch-Dressing-1699731,4,0.333333333333,0.166666666667,0.0,0.5,0.166666666667,0.333333333333,,3,2,300.0,1800.0,"[buttermilk, light mayonnaise, Hidden Valley® Original Ranch® Dressing]",salad
Skinny-Vegan-Broccoli-Salad-1697591,4,,,,,,,,12,3,600.0,600.0,"[broccoli, walnuts, goji berries, berries, hemp seeds, nutritional yeast, salt, black pepper, coconut sugar, full fat coconut milk, lemon juice, apple cider vinegar]",salad
Skinny-caesar-dressing-352253,5,,,,,,,,7,3,,1200.0,"[parmigiano reggiano cheese, fresh lemon juice, garlic cloves, dijon mustard, anchovy fillets, extra-virgin olive oil, fat free greek yogurt]",salad
Skinnylightful-Asian-Chicken-Broccoli-Slaw-Salad-1694497,4,,,,,,,,7,4,,1200.0,"[broccoli slaw, red cabbage, boneless skinless chicken breasts, pea pods, scallions, salad dressing, La Choy Chow Mein Noodles]",salad
