id,rating,bitter,meaty,piquant,salty,sour,sweet,cookTimeInSeconds,ingredientCount,numberOfServings,prepTimeInSeconds,totalTimeInSeconds,ingredient_list,course
Roasted-asparagus-soup-333986,5,0.166666666667,0.166666666667,0.0,0.166666666667,0.333333333333,0.166666666667,,8,2,,2400.0,"[asparagus, garlic, onions, olive oil, chicken stock, heavy cream, pepper, salt]",soup
Roasted-carrot_-chickpea-and-garlic-soup_-26p-_VEGAN_-1510286,4,0.166666666667,0.166666666667,0.166666666667,0.5,0.166666666667,0.333333333333,,8,4,,3300.0,"[carrots, chickpeas, clove, oil, onions, cumin, chili flakes, vegetable stock]",soup
Roasted-cauliflower-and-aged-white-cheddar-soup-351048,5,0.666666666667,0.166666666667,0.0,0.833333333333,0.833333333333,0.166666666667,3000.0,13,4,600.0,3600.0,"[cauliflower, oil, salt, pepper, onions, garlic, thyme, vegetable broth, white cheddar cheese, milk]",soup
Roasted-cauliflower-soup-345404,5,0.166666666667,0.166666666667,0.0,0.166666666667,0.833333333333,0.166666666667,,5,4,,4800.0,"[cauliflower, olive oil, sea salt, onions, water]",soup
Roasted-mushroom-soup-323850,4,0.166666666667,0.166666666667,0.0,0.333333333333,0.166666666667,0.166666666667,,12,2,,3900.0,"[baby portobello mushrooms, extra-virgin olive oil, ground black pepper, low sodium beef stock, unsalted butter, shallots, salt, garlic, thyme, white wine, flour, heavy cream]",soup
Roasted-red-pepper-soup-352407,5,0.166666666667,0.166666666667,0.333333333333,0.5,0.833333333333,0.166666666667,,14,4,,4800.0,"[red bell pepper, olive oil, onions, carrots, garlic cloves, herbes de provence, fresh parsley, fat-free chicken broth, russet potatoes, dry white wine, ground black pepper, salt, non-fat sour cream, parmigiano reggiano cheese]",soup
Roasted-tomato-soup-308822,5,0.166666666667,0.166666666667,0.166666666667,0.333333333333,0.833333333333,0.166666666667,,8,4,,4200.0,"[tomatoes, red bell pepper, yellow onion, extra-virgin olive oil, garlic, fine sea salt, vegetable stock, smoked paprika]",soup
Roasted-tomato-soup-with-broiled-cheddar-305657,5,0.333333333333,0.166666666667,0.166666666667,0.166666666667,0.5,0.166666666667,,9,4,,5400.0,"[plum tomatoes, olive oil, garlic, fresh thyme leaves, crushed red pepper, chicken stock, rye bread, onions, shredded cheddar cheese]",soup
Rosemary-Potato-Soup-1699657,4,0.166666666667,0.166666666667,0.0,0.166666666667,0.666666666667,0.166666666667,,17,4,,3600.0,"[butter, onions, salt, pepper, medium potatoes, water, rosemary, olive oil, medium carrot, bisquik, shredded cheese, milk, flour]",soup
Rosemary-Potato-Soup-with-Crispy-Carrots-1698873,3,0.166666666667,0.166666666667,0.0,0.166666666667,0.166666666667,0.166666666667,,11,7,600.0,600.0,"[butter, yellow onion, salt, pepper, russet, water, dried rosemary, vegetable oil, medium carrot, kosher salt, cracked black pepper]",soup
Rosemary-and-Ravioli-Chicken-Soup-1051143,3,0.166666666667,0.166666666667,0.0,0.333333333333,0.5,0.166666666667,,8,4,,3000.0,"[vegetable broth, water, red potato, fresh rosemary, spinach, chicken meat, fresh green beans, butter]",soup
Royal-Cheddar-Cheese-Soup-974737,4,0.166666666667,0.166666666667,0.166666666667,0.166666666667,0.166666666667,0.166666666667,2100.0,9,5,600.0,2700.0,"[butter, yellow onion, russet potatoes, garlic, chicken broth, dry mustard, heavy cream, sharp cheddar cheese, chives]",soup
Rustic-Italian-Tortellini-Soup-1261999,4,0.333333333333,0.166666666667,0.0,0.5,0.333333333333,0.166666666667,,12,5,,2100.0,"[italian sausage, garlic cloves, reduced sodium chicken broth, water, diced tomatoes, cheese tortellini, baby spinach, fresh basil, pepper, crushed red pepper flakes, italian seasoning, grated parmesan cheese]",soup
Rustic-Potato-Soup-1101371,4,,,,,,,,8,4,,3000.0,"[potatoes, onions, leeks, vegan butter, vegetable broth, pepper, marjoram, fresh sage]",soup
Rustic-Vegetable-Soup-with-White-Beans-and-Spicy-Herbed-Meatballs-1705085,4,0.666666666667,0.833333333333,0.166666666667,0.5,0.333333333333,0.166666666667,,30,8,,3900.0,"[lean ground beef, salt, pepper, garlic, red pepper flakes, italian seasoning, grated parmesan cheese, eggs, milk, bread crumbs, butter, olive oil, onions, carrots, celery, parsnips, fennel bulb, beef, small white beans, basil, flat leaf parsley, kale, fresh lemon juice, lemon zest, shaved parmesan cheese, rustic bread]",soup
Rustic-cabbage-soup-308880,5,0.333333333333,0.166666666667,0.0,0.166666666667,0.833333333333,0.166666666667,,10,4,,1800.0,"[extra-virgin olive oil, salt, potatoes, garlic, yellow onion, stock, white beans, cabbage, parmesan cheese]",soup
Salmon-Chowder-1708288,4,0.166666666667,0.166666666667,0.166666666667,0.5,0.333333333333,0.166666666667,1800.0,17,7,900.0,2700.0,"[bacon, small new potatoes, sweet onion, fennel bulb, carrots, celery, minced garlic, clam juice, white wine, water, fresh dill, flour, milk, heavy cream, salt, white pepper, salmon]",soup
Salmon-and-Garbanzo-Bean-Soup-1710140,4,0.166666666667,0.166666666667,0.0,0.166666666667,0.333333333333,0.166666666667,1800.0,8,8,1200.0,3000.0,"[bacon, onions, salmon fillets, chicken broth, fresh spinach, garbanzo beans, salt, pepper]",soup
Satisfying-Scotch-Broth-1702588,3,0.166666666667,0.166666666667,0.0,0.666666666667,0.166666666667,0.166666666667,,8,4,,4500.0,"[vegetable oil, lamb shanks, leeks, vegetable stock, pearl barley, celery ribs, large carrots, fresh parsley leaves]",soup
Sausage-Cheese-Soup-Allrecipes,4,0.666666666667,0.333333333333,0.0,0.666666666667,0.166666666667,0.333333333333,900.0,8,4,600.0,1500.0,"[rolls, carrots, onions, flour, reduced sodium chicken broth, whole milk, shredded sharp cheddar cheese, shredded swiss cheese]",soup
Sausage-Potato-Soup-for-the-Slow-Cooker-_AND-A-CROCKPOT-GIVEAWAY_-1314175,4,,,,,,,,5,4,,2100.0,"[sausages, potatoes, chicken stock, sweet corn kernels, milk]",soup
Sausage-Tortellini-Soup-1313840,4,0.166666666667,0.166666666667,0.0,0.166666666667,0.333333333333,0.166666666667,,9,5,,3000.0,"[sausage casings, onions, carrots, celery ribs, garlic cloves, zucchini, chicken broth, diced tomatoes, cheese tortellini]",soup
Sausage-and-Kale-Soup-1603192,4,0.166666666667,0.166666666667,0.0,0.166666666667,0.666666666667,0.166666666667,,13,9,,3300.0,"[bacon pieces, italian sausage, butter, onions, garlic salt, garlic powder, ground black pepper, flour, chicken broth, small red potatoes, kale, half & half, fresh parmesan cheese]",soup
Sausage-and-Split-Pea-Soup-1612170,3,,,,,,,,9,8,,6300.0,"[kielbasa, onions, garlic cloves, kosher salt, freshly ground black pepper, medium carrot, celery ribs, chicken stock, dried split peas]",soup
Sausage-and-Vegetable-Soup-1384854,4,,,,,,,,13,4,,3600.0,"[sausages, onions, bell pepper, carrots, celery, zucchini, garlic, diced tomatoes, vegetable broth, kale, olive oil, pepper, salt]",soup
Sausage_-Potato-and-Spinach-Soup-781010,4,0.166666666667,0.166666666667,0.166666666667,0.166666666667,0.166666666667,0.166666666667,1200.0,14,6,600.0,1800.0,"[olive oil, sausage casings, garlic, onions, dried oregano, dried basil, crushed red pepper flakes, kosher salt, ground black pepper, chicken broth, bay leaf, red potato, baby spinach, heavy cream]",soup
Sauteed-Corn-_-Potato-Chowder-1534708,4,0.166666666667,0.166666666667,0.0,0.166666666667,0.5,0.166666666667,,8,2,,1800.0,"[promise buttery spread, potatoes, corn-on-the-cob, sweet onion, fat free less sodium chicken broth, chopped fresh cilantro, ground black pepper, lime juice]",soup
Savory-Butternut-Squash-Soup-1514729,3,,,,,,,,5,4,600.0,600.0,"[butternut squash soup, olive oil, hot Italian sausage links, parmesan cheese, chives]",soup
Savory-Spinach-_-Potato-Soup-1534848,4,,,,,,,,6,2,,1800.0,"[promise buttery spread, all purpose potatoes, sweet onion, garlic, baby spinach leaves, low sodium chicken broth]",soup
Seafood-Bisque-1008662,4,,,,,,,1200.0,9,4,300.0,1500.0,"[butter, flour, chicken broth, garlic, onion powder, tomato paste, dry sherry, heavy cream, seafood]",soup
Seafood-Chowder-977401,3,0.166666666667,0.166666666667,0.166666666667,0.166666666667,0.333333333333,0.166666666667,,20,4,,4500.0,"[medium shrimp, crabmeat, whitefish, bay scallops, olive oil, white onion, chopped celery, garlic, cream of celery soup, potatoes, fresh thyme, fresh rosemary, cracked black pepper, celery salt, red pepper flakes, seafood seasoning, horseradish, water, heavy whipping cream, all-purpose flour]",soup
Secret-Ingredient-Tomato-Basil-Soup-1287801,4,0.333333333333,0.166666666667,0.166666666667,0.333333333333,0.666666666667,0.166666666667,600.0,12,7,3600.0,4200.0,"[cherry tomatoes, roma tomatoes, onions, garlic cloves, carrots, olive oil, salt, pepper, broth, balsamic vinegar, red pepper flakes, basil pesto]",soup
Senate-Bean-Soup-1298481,3,,,,,,,10800.0,7,4,4500.0,15300.0,"[navy beans, hot water, smoked ham hocks, onions, butter, salt, pepper]",soup
Senate-Bean-Soup-441160,5,,,,,,,,6,4,,4500.0,"[dried navy beans, smoked ham hocks, unsalted butter, yellow onion, kosher salt, ground black pepper]",soup
Sesame-Ginger-Daikon-Noodle-Soup-with-Bok-Choy_-Snow-Peas-and-Shiitake-Mushrooms-1709658,4,,,,,,,1200.0,15,3,900.0,2100.0,"[eggs, baby bok choy, daikon, sesame oil, minced ginger, scallions, shiitake, snow peas, salt, pepper, chicken broth, low sodium soy sauce, mirin, lime juice, cilantro leaves]",soup
Shellfish-Stock-1689859,4,,,,,,,,3,4,,4200.0,"[shrimp, mirepoix, water]",soup
Shrimp-Bisque-1286453,4,0.166666666667,0.666666666667,0.166666666667,0.333333333333,0.166666666667,0.166666666667,,12,4,,4200.0,"[shrimp, carrots, celery, green onions, garlic, salt, water, butter, tomato paste, flour, heavy cream, smoked paprika]",soup
Shrimp-Soup-1576751,4,0.166666666667,0.166666666667,0.666666666667,0.333333333333,0.833333333333,0.166666666667,,13,4,,2700.0,"[large shrimp, garlic cloves, bell pepper, onions, tomatoes, beef broth, milk, whipping cream, chopped fresh cilantro, vegetable oil, chili powder, salt, hot sauce]",soup
Shrimp-and-roasted-corn-chowder-351037,5,0.166666666667,0.166666666667,0.833333333333,0.166666666667,0.5,0.166666666667,3300.0,16,4,900.0,4200.0,"[corn kernels, shrimp, chicken broth, smoked bacon, onions, celery, red pepper, garlic, thyme, smoked paprika, flour, potatoes, cream, cayenne, salt, pepper]",soup
Shrimp-stock-recipe-Italian-way-1702425,3,0.166666666667,0.166666666667,0.0,0.166666666667,0.166666666667,0.166666666667,6000.0,13,4,600.0,6600.0,"[shells, white onion, cherry tomatoes, garlic, rib, carrots, fresh parsley, bay leaves, extra-virgin olive oil, lemon juice, water, pepper, table salt]",soup
Simple-6-Ingredient-6-Minute-Tomato-Soup-1055620,4,,,,,,,,7,2,,1500.0,"[onions, celery ribs, carrots, garlic cloves, diced tomatoes in juice, diced tomatoes, milk]",soup
Simple-Butternut-Squash-Soup-1533184,4,,,,,,,,9,4,,4800.0,"[butternut squash, onions, celery, carrots, salt, bone broth, water, coconut oil, butter]",soup
Simple-Cabbage-Soup-1642447,4,0.166666666667,0.166666666667,0.0,0.166666666667,0.833333333333,0.166666666667,1200.0,12,4,600.0,1800.0,"[cabbage, carrots, onions, garlic, celery, stock, tomato sauce, bouillon, oregano, salt, pepper, olive oil]",soup
Simple-Cauliflower-Soup-Simply-Recipes-42723,5,0.166666666667,0.166666666667,0.0,0.166666666667,0.833333333333,0.166666666667,,6,4,,1500.0,"[cauliflower, water, salt, unsalted butter, chives, olive oil]",soup
Simple-Chicken-Noodle-Soup-Martha-Stewart,4,0.833333333333,0.166666666667,0.0,0.833333333333,0.333333333333,0.166666666667,,6,8,600.0,3300.0,"[chicken, carrots, parsnips, onions, coarse salt, egg noodles]",soup
Simple-Chicken-Stock-490192,3,0.166666666667,0.166666666667,0.166666666667,0.166666666667,0.5,0.333333333333,,7,4,,600.0,"[chicken bones, yellow onion, carrots, celery, black peppercorns, fresh thyme, bay leaves]",soup
Simple-Fat-Free-Spinach-Soup-1113980,4,0.333333333333,0.166666666667,0.166666666667,0.166666666667,0.833333333333,0.166666666667,1200.0,8,4,300.0,1500.0,"[onions, potatoes, spinach, garlic cloves, vegetables, salt, freshly ground pepper, grated nutmeg]",soup
Simple-Homemade-Tomato-Soup-1026222,4,0.166666666667,0.166666666667,0.0,0.166666666667,0.333333333333,0.166666666667,,11,4,,4200.0,"[bacon, carrots, yellow onion, garlic, tomato paste, flour, chicken broth, dried thyme, bay leaf, San Marzano tomatoes, cream]",soup
Simple-Posole-1169150,4,0.166666666667,0.166666666667,0.666666666667,0.166666666667,0.166666666667,0.166666666667,,13,6,,3600.0,"[tomatillos, chicken broth, chicken meat, oil, onions, cumin, oregano, garlic, jalapeno chilies, hominy, chopped fresh cilantro, tortilla chips, lime wedges]",soup
Simple-Potato-Soup-1037433,3,0.166666666667,0.166666666667,0.0,0.166666666667,0.333333333333,0.166666666667,,7,5,,2700.0,"[unsalted butter, onions, kosher salt, yukon gold potatoes, low sodium chicken broth, lemon juice, chopped fresh chives]",soup
Simple-Spicy-Bean-Soup-1409711,3,0.5,0.166666666667,0.0,0.166666666667,0.333333333333,0.166666666667,,8,4,,1800.0,"[olive oil, onions, garlic cloves, long-grain rice, kidney beans, chopped tomatoes, vegetable stock, tortilla chips]",soup
Simple-Strawberry-Soup-_Cinderellas-Favorite__-471481,5,0.166666666667,0.333333333333,0.0,0.166666666667,0.833333333333,0.166666666667,,3,4,,1200.0,"[sour cream, heavy whipping cream, strawberries]",soup
Simple-Summer-Gazpacho-1538114,4,,,,,,,300.0,13,6,1200.0,1500.0,"[tomatoes, kirby cucumbers, bell pepper, baguette, yellow onion, tomato juice, garlic, sherry vinegar, olive oil, Piment d'Espelette, ground cumin, salt, pepper]",soup
Simple-Summer-Squash-Soup-1693188,4,0.166666666667,0.166666666667,0.0,0.166666666667,0.833333333333,0.166666666667,2400.0,13,5,900.0,3300.0,"[ghee, sweet onion, garlic cloves, zucchini, yellow squash, bone broth, dried thyme, dried oregano, dried rosemary, salt, lemon, parsley, olive oil]",soup
Simple-Sweet-Potato-Soup-1064307,4,0.833333333333,0.166666666667,0.166666666667,0.833333333333,0.166666666667,0.166666666667,,7,2,,2100.0,"[sweet potatoes, chicken broth, almond milk, salt, ground chipotle chile pepper, avocado, tortilla chips]",soup
Simple-Tom-Yum-Soup-1583167,4,,,,,,,,16,4,,1800.0,"[shrimp, lemongrass, galangal, kaffir lime leaves, red chili peppers, onions, small tomatoes, mushrooms, coconut milk, whole milk, green onions, cilantro leaves, coconut sugar, fish sauce, lime wedges]",soup
Simple-Tomato-Soup-624726,3,0.166666666667,0.166666666667,0.0,0.166666666667,0.666666666667,0.333333333333,,12,4,,1800.0,"[butter, onions, garlic, tomatoes, baking soda, dried parsley, bay leaf, black pepper, sea salt, fresh basil, honey, whole milk]",soup
Simple-Tomato-Soup-968534,4,,,,,,,,12,5,,2400.0,"[extra-virgin olive oil, yellow onion, garlic, crushed red pepper flakes, crushed tomatoes, fresh basil leaves, coarse salt, water, ground black pepper, sweetener, fresh basil]",soup
Simple-_-Creamy-Squash-Soup-499435,4,0.166666666667,0.166666666667,0.5,0.166666666667,0.5,0.333333333333,,9,4,,1200.0,"[kabocha squash, yellow onion, garlic, olive oil, milk, cayenne pepper, toasted walnuts, salt, cream]",soup
Simple-_-Delicious-Potato-Soup-1454455,4,0.166666666667,0.166666666667,0.166666666667,0.166666666667,0.166666666667,0.166666666667,,13,4,,3600.0,"[bacon, onions, medium carrot, celery, russet potatoes, chicken broth, half & half, seasoning salt, table salt, pepper, hot sauce, fresh chives, fresh parsley]",soup
Simple-and-Delicious-Tomato-Soup-471513,5,0.166666666667,0.166666666667,0.0,0.166666666667,0.666666666667,0.333333333333,,4,4,,1200.0,"[tomato soup, diced tomatoes, pesto sauce, milk]",soup
Simple-creamy-carrot-soup-334968,5,,,,,,,,11,6,,2700.0,"[extra-virgin olive oil, carrots, onions, minced garlic, fresh thyme, fresh rosemary, chicken broth, bacon, kosher salt, ground black pepper, hot sauce]",soup
Simple_-Hearty_-Chicken-and-Rice-Soup-1333722,4,,,,,,,,11,6,,3600.0,"[white rice, chicken breasts, chicken stock cubes, water, onions, green bell pepper, pimentos, celery, butter, flour, yellow food coloring]",soup
Simply-Gazpacho-version-1-1628286,4,0.166666666667,0.166666666667,0.333333333333,0.166666666667,0.833333333333,0.333333333333,,10,4,,900.0,"[tomatoes, red bell pepper, purple onion, cucumber, lemon, basil, Equal Sweetener, sugar, salt, olive oil]",soup
Simply-Perfect-Roasted-Butternut-Squash-Soup-1349638,4,0.166666666667,0.166666666667,0.0,0.166666666667,0.5,0.333333333333,3600.0,7,4,600.0,4200.0,"[butternut squash, butter, diced onions, chicken stock, cinnamon, maple syrup, cream]",soup
Six-Can-Chicken-Tortilla-Soup-Allrecipes,5,0.166666666667,0.166666666667,0.0,0.166666666667,0.166666666667,0.166666666667,900.0,5,6,300.0,1200.0,"[whole kernel corn, drained, chicken broth, chicken, black beans, diced tomatoes]",soup
Skinny-Broccoli-Cheese-Soup-1327931,4,,,,,,,10800.0,11,4,900.0,11700.0,"[cauliflower, broccoli, chicken broth, water, garlic cloves, onions, salt, ground pepper, ground mustard, reduced fat cream cheese, shredded sharp cheddar cheese]",soup
Skinny-Crock-Pot-Loaded-Potato-Soup-1638577,4,0.166666666667,0.166666666667,0.0,0.666666666667,0.333333333333,0.166666666667,28800.0,7,6,300.0,29100.0,"[cheddar cheese soup, chicken broth, ground black pepper, cream cheese, hash brown potatoes, green onions, bacon bits]",soup
Skinny-Thai-Chicken-Soup-1704857,3,,,,,,,,16,4,1800.0,1800.0,"[canola oil, onions, fresh mushrooms, red bell pepper, garlic, red curry paste, chicken broth, cooked chicken breasts, brown sugar, salt, corn starch, cold water, fat, baby spinach leaves, chopped fresh cilantro, lime wedges]",soup
Skinny-Tomato-Basil-Soup-1580006,4,0.166666666667,0.166666666667,0.0,0.166666666667,0.833333333333,0.166666666667,,10,4,,3300.0,"[celery, onions, garlic, butter, basil, chicken broth, chicken bouillon, cream cheese, sugar]",soup
Skinny-Tomato-Soup-with-Cheesy-Orzo-497693,4,0.166666666667,0.166666666667,0.0,0.5,0.333333333333,0.166666666667,,9,3,,1500.0,"[roasted tomatoes, plain greek yogurt, kosher salt, ground black pepper, garlic salt, orzo, shredded cheddar cheese]",soup
Slow-Cooked-French-Onion-Soup-1631272,4,0.166666666667,0.166666666667,0.0,0.666666666667,0.166666666667,0.166666666667,36000.0,9,4,,36000.0,"[bacon fat, onions, organic chicken broth, beef broth, fresh thyme, fresh rosemary, bay leaves, sea salt, black pepper]",soup
Slow-Cooker-Beef-Barley-Soup-1365379,4,0.166666666667,0.166666666667,0.0,0.166666666667,0.166666666667,0.166666666667,15600.0,14,7,1200.0,16800.0,"[boneless beef chuck, olive oil, onions, carrots, celery, sliced mushrooms, garlic, fresh thyme, beef broth, chicken broth, water, pearl barley, salt, freshly ground black pepper]",soup
Slow-Cooker-Beef-Barley-Soup-1628158,3,0.333333333333,0.166666666667,0.0,0.333333333333,0.333333333333,0.166666666667,,13,9,900.0,15300.0,"[olive oil, beef stew meat, yukon gold potatoes, medium carrot, onions, celery, garlic, beef broth, dried thyme, diced tomatoes, barley, salt, pepper]",soup
Slow-Cooker-Black-Bean-Soup-1691121,4,0.166666666667,0.166666666667,0.833333333333,0.833333333333,0.666666666667,0.166666666667,36000.0,23,8,1200.0,37200.0,"[onions, red bell pepper, green bell pepper, diced tomatoes, celery ribs, jalapeno chilies, garlic cloves, black beans, salt, black pepper, hot sauce, paprika, chili powder, cumin, bay leaves, vegetable stock, lime juice, cilantro, green onions, avocado, tortilla chips, cheese, sour cream]",soup
Slow-Cooker-Blissful-Butternut-Squash-Soup-1347214,4,,,,,,,,9,5,,2400.0,"[butternut squash, buttercup squash, shallots, chicken broth, light coconut milk, nutmeg, pepitas, chives, coconut milk]",soup
Slow-Cooker-Bone-Broth-1707371,3,,,,,,,,9,8,,86400.0,"[beef bones, apple cider vinegar, onions, carrots, celery ribs, bay leaves, peppercorns, parsley, salt]",soup
Slow-Cooker-Buffalo-Chicken-15-BEAN-SOUP-1298469,3,,,,,,,0.0,8,4,,21600.0,"[bean soup, diced onions, carrots, diced celery, boneless skinless chicken breasts, chicken stock, buffalo sauce, crumbled cheese]",soup
Slow-Cooker-Butternut-Squash-Soup-1390450,4,0.166666666667,0.166666666667,0.833333333333,0.5,0.666666666667,0.166666666667,14400.0,14,7,900.0,15300.0,"[vegetable stock, garlic, carrots, granny smith apples, butternut squash, fresh sage, white onion, salt, freshly ground black pepper, cayenne, ground cinnamon, coconut milk]",soup
Slow-Cooker-Cajun-Corn-and-Shrimp-Chowder-1710762,4,0.166666666667,0.166666666667,0.166666666667,0.166666666667,0.166666666667,0.166666666667,,9,4,,3300.0,"[frozen sweet corn, baby potatoes, flour, cajun seasoning, chicken broth, heavy cream, shrimp, salt, pepper]",soup
Slow-Cooker-Cauliflower-Chowder-1595831,4,0.166666666667,0.166666666667,0.0,0.166666666667,0.833333333333,0.166666666667,,14,8,,2700.0,"[bacon, cauliflower, leeks, onions, celery, garlic, chicken broth, dried thyme, bay leaf, kosher salt, freshly ground black pepper, shredded cheddar cheese, half & half, chopped fresh chives]",soup
Slow-Cooker-Cheesy-Potato-Soup-1713034,4,,,,,,,,9,4,,3300.0,"[potatoes, onions, milk, low sodium chicken broth, salt, pepper, corn starch, shredded low-fat cheese, fresh chives]",soup
Slow-Cooker-Cheesy-Potato-Soup-_Recipe-1620655,4,0.833333333333,0.166666666667,0.0,0.833333333333,0.833333333333,0.166666666667,,8,4,,3900.0,"[medium potatoes, water, chopped onion, instant chicken bouillon granules, freshly ground black pepper, shredded American cheese, evaporated milk, cooked bacon]",soup
Slow-Cooker-Chicken-Broth-1696017,4,0.166666666667,0.333333333333,0.0,0.166666666667,0.166666666667,0.166666666667,43200.0,8,4,,43200.0,"[chicken carcass, carrots, celery, onions, garlic, spices, salt, water]",soup
Slow-Cooker-Chicken-Corn-Chowder-1702742,4,0.166666666667,0.166666666667,0.0,0.166666666667,0.166666666667,0.166666666667,25200.0,12,4,900.0,26100.0,"[garlic, celery, small carrots, onions, russet potatoes, chicken broth, frozen corn, sea salt, black pepper, arrowroot powder, heavy cream, chicken thighs]",soup
Slow-Cooker-Chicken-Noodle-Soup-1687091,4,0.166666666667,0.166666666667,0.0,0.5,0.333333333333,0.166666666667,18000.0,12,10,1800.0,19800.0,"[homemade chicken stock, water, chopped onion, garlic, sliced carrots, celery, bay leaves, dried thyme, salt, black pepper, roasting chickens, pasta]",soup
Slow-Cooker-Chicken-Noodle-Soup-994242,4,0.166666666667,0.166666666667,0.0,0.166666666667,0.166666666667,0.166666666667,30600.0,11,9,600.0,31200.0,"[boneless skinless chicken breasts, poultry seasoning, onions, carrots, celery ribs, garlic, chicken stock, kosher salt, cracked black pepper, egg noodles, fresh parsley leaves]",soup
Slow-Cooker-Chicken-Rice-Soup-1706659,4,0.166666666667,0.166666666667,0.0,0.166666666667,0.166666666667,0.166666666667,10800.0,9,4,900.0,11700.0,"[boneless skinless chicken breasts, cooked brown rice, carrots, celery ribs, onions, garlic, chicken broth, sea salt, black pepper]",soup
Slow-Cooker-Chicken-Tortilla-Soup-1394512,4,0.166666666667,0.166666666667,0.833333333333,0.5,0.166666666667,0.166666666667,14400.0,6,9,300.0,14700.0,"[chicken breasts, chunky salsa, chicken broth, taco seasoning, frozen corn kernels, black beans]",soup
Slow-Cooker-Chicken-and-Spinach-Soup-1028339,3,0.166666666667,0.166666666667,0.166666666667,0.166666666667,0.5,0.166666666667,,7,4,,2400.0,"[chicken, fresh spinach, yellow onion, red pepper flakes, salt, pepper, organic chicken broth]",soup
Slow-Cooker-Chicken-and-Wild-Rice-Soup-469842,5,0.166666666667,0.166666666667,0.0,0.166666666667,0.166666666667,0.166666666667,0.0,12,8,600.0,15000.0,"[onions, carrots, celery, garlic, wild rice, bay leaves, dried thyme, black pepper, salt, boneless skinless chicken breasts, low sodium chicken broth, fresh parsley]",soup
Slow-Cooker-Chicken-and-Winter-Vegetable-Soup-1677654,3,0.166666666667,0.166666666667,0.166666666667,0.5,0.333333333333,0.166666666667,,17,6,,4800.0,"[turnips, parsnips, onions, carrots, celery ribs, spinach, red capsicum, chicken breast fillets, fresh thyme, chicken stock cubes, water, bay leaf, parsley, nutmeg, onion soup mix, crushed garlic, olive oil]",soup
Slow-Cooker-Creamy-Potato-Corn-Chowder-1664003,4,0.166666666667,0.166666666667,0.5,0.833333333333,0.166666666667,0.166666666667,,12,7,,3600.0,"[russet potatoes, sweet potatoes, onions, sweet corn kernels, garlic cloves, kosher salt, vegetable broth, full fat coconut milk, white wine vinegar, basil, scallions, hot sauce]",soup
Slow-Cooker-Creamy-Potato-Soup-1710689,4,0.333333333333,0.166666666667,0.0,0.166666666667,0.333333333333,0.166666666667,,10,4,,3300.0,"[baking potatoes, onions, shredded carrots, chicken broth, water, salt, black pepper, whole wheat white flour, evaporated milk, shredded cheese]",soup
Slow-Cooker-Enchilada-Soup-1699896,4,0.333333333333,0.166666666667,0.833333333333,0.666666666667,0.833333333333,0.166666666667,,19,7,240.0,240.0,"[small yellow onion, garlic, black beans, chicken broth, enchilada sauce, diced tomatoes, corn, green chile, lime juice, ground cumin, chili powder, salt, black pepper, chopped cilantro, avocado, shredded cheese, green onions, tortilla chips, sour cream]",soup
Slow-Cooker-French-Onion-Soup-1055491,4,0.166666666667,0.166666666667,0.0,0.166666666667,0.166666666667,0.166666666667,64800.0,8,4,300.0,65100.0,"[sweet onion, butter oil, white wine, beef broth, thyme, fresh bay leaves, salt, pepper]",soup
Slow-Cooker-French-Onion-Soup-992072,4,,,,,,,14400.0,7,5,1800.0,16200.0,"[yellow onion, butter, minced garlic, beef broth, bay leaf, french bread, gruyere cheese]",soup
Slow-Cooker-Grown-Up-Chicken-Soup-1638777,4,0.166666666667,0.166666666667,0.0,0.333333333333,0.166666666667,0.166666666667,,17,4,,3000.0,"[boneless skinless chicken breasts, diced onions, diced celery, carrots, poultry seasoning, sea salt, dried basil, italian seasoning, chicken broth, corn starch, evaporated milk, potato gnocchi, garlic, olive oil, baby spinach, garlic powder, salt]",soup
