id,rating,bitter,meaty,piquant,salty,sour,sweet,cookTimeInSeconds,ingredientCount,numberOfServings,prepTimeInSeconds,totalTimeInSeconds,ingredient_list,course
Hungarian-Cherry-Soup-_Cold-Sour-Cherry-Soup_-1703812,4,,,,,,,,8,4,,1500.0,"[bing cherries, cherry juice, water, kosher salt, cinnamon, clove, lemon, sour cream]",soup
Hungarian-Chilled-Cherry-Soup-_Meggyleves_-441607,5,,,,,,,,6,4,,1500.0,"[sour cherries, juice, kosher salt, cinnamon sticks, lemon slices, sour cream]",soup
Hungarian-Cream-of-Green-Bean-Soup-1688155,3,0.166666666667,0.166666666667,0.166666666667,0.166666666667,0.166666666667,0.166666666667,1800.0,8,5,900.0,2700.0,"[green beans, water, salt, butter, flour, pepper, hungarian paprika, sour cream]",soup
Hungarian-Mushroom-Soup-679504,4,0.166666666667,0.166666666667,0.166666666667,0.666666666667,0.166666666667,0.166666666667,1800.0,13,4,600.0,2400.0,"[butter, onions, mushrooms, flour, paprika, vegetable broth, dried dill, soy sauce, salt, pepper, sour cream, lemon juice, fresh dill]",soup
IRISH-POTATO-SOUP-562967,4,0.166666666667,0.166666666667,0.0,0.166666666667,0.833333333333,0.166666666667,,6,4,,3000.0,"[potatoes, onions, flour, butter, salt, pepper]",soup
IRRESISTIBLE-GREEN-POZOLE-989346,4,,,,,,,,19,6,,6300.0,"[hominy, white onion, garlic, bay leaf, salt, boneless skinless chicken thighs, pepitas, tomatillos, fresh cilantro, epazote, canola oil, avocado, lime juice, radishes, chopped cilantro, lime, oregano]",soup
Immune-Boosting-Potato-and-Beet-Soup-1597870,4,0.666666666667,0.166666666667,0.0,0.666666666667,0.5,0.333333333333,1800.0,6,15,1200.0,3000.0,"[beets, red potato, yellow onion, chicken bouillon, salt, water]",soup
Immune-Soup-_Paleo_-1539533,3,,,,,,,,11,4,,2700.0,"[bone broth, minced garlic, carrots, yellow onion, shiitake, fresh ginger root, spinach, lemon, curry, turmeric, black pepper]",soup
Incredibly-Easy-Taco-Soup-1068790,4,,,,,,,,8,4,,2400.0,"[ground beef, taco seasoning, diced tomatoes, black beans, whole kernel corn, green chile, cheddar cheese, fritos]",soup
Indian-Lentil-Cauliflower-Soup-1558806,3,0.333333333333,0.166666666667,0.166666666667,0.666666666667,0.666666666667,0.166666666667,,15,4,,3300.0,"[coconut oil, yellow onion, garlic, peeled fresh ginger, curry powder, ground coriander, ground cumin, vegetable broth, red lentils, cauliflower, sweet potatoes, baby spinach, fine sea salt, freshly ground black pepper, fresh coriander]",soup
Indian-Mulligatawny-Soup-I-Adore-Food_-200817,4,0.166666666667,0.166666666667,0.666666666667,0.166666666667,0.666666666667,0.166666666667,1800.0,18,6,900.0,2700.0,"[butter, onions, garlic, fresh ginger, green chilies, ground cinnamon, ground cloves, ground coriander, ground cumin, ground turmeric, cardamom pods, curry powder, carrots, potatoes, red lentils, chicken broth, coconut milk, fresh cilantro]",soup
Indian-Tomato-Soup-1685860,4,,,,,,,,13,4,,2400.0,"[tomatoes, onions, tomato purée, water, olive oil, chillies, curry powder, salt, garlic cloves, fresh cilantro, chili pepper, tomato soup]",soup
Ingredients-of-Vietnamese-chicken-noodle-soup-recipe-_Pho-ga_-1037522,4,,,,,,,,14,4,,4800.0,"[chicken, scallions, ginger, kosher salt, chicken stock, fish sauce, rice vermicelli, cilantro, bawang goreng, thai basil, mung bean sprouts, lime, jalapeno chilies]",soup
Instant-Pot-Barley-Mushroom-Soup-1705973,4,0.166666666667,0.166666666667,0.166666666667,0.5,0.166666666667,0.166666666667,1200.0,12,8,600.0,1800.0,"[beef stock, pearl barley, crimini mushrooms, onions, celery ribs, carrots, garlic cloves, thyme sprigs, sage, salt, ground pepper, garlic powder]",soup
Instant-Pot-Spring-Vegetable-Soup-1687749,4,0.5,0.166666666667,0.0,0.166666666667,0.666666666667,0.333333333333,,11,4,,2100.0,"[bone broth, onions, garlic, spring greens, medium carrot, radishes, asparagus, leeks, sea salt, cream, chives]",soup
Iowa-Corn-Chowder-779896,3,0.333333333333,0.166666666667,0.0,0.5,0.166666666667,0.166666666667,,6,5,1200.0,1200.0,"[bacon, onions, milk, frozen corn, condensed cream of mushroom soup, potatoes]",soup
Irish-Beer-Cheese-Soup-1533309,4,0.333333333333,0.5,0.166666666667,0.5,0.166666666667,0.166666666667,900.0,9,9,300.0,1200.0,"[onions, garlic cloves, butter, harp, chicken broth, cheese, low-fat cream cheese, corn starch, dijon mustard]",soup
Irish-Cabbage-Soup-1032596,4,0.166666666667,0.166666666667,0.166666666667,0.166666666667,0.666666666667,0.166666666667,,10,5,,3600.0,"[onions, potatoes, carrots, turnips, cabbage, vegetable broth, water, black pepper, bay leaves, yellow mustard seeds]",soup
Irish-Leek-and-Potato-Soup-1550090,4,0.833333333333,0.166666666667,0.0,0.833333333333,0.833333333333,0.166666666667,1800.0,14,5,1800.0,3600.0,"[vegetable oil, leeks, celery, onions, garlic, medium potatoes, vegetable broth, salt, black pepper, dried thyme, half & half, basil, dill weed, tarragon]",soup
Irish-Oatmeal-Leek-Soup-1700079,4,,,,,,,,7,4,,3300.0,"[whipped butter, leeks, steel-cut oats, fat free reduced sodium chicken broth, fat, cracked black pepper, fresh chives]",soup
Irish-Potato-Soup-1072388,4,0.166666666667,0.166666666667,0.0,0.166666666667,0.333333333333,0.166666666667,,9,6,,5100.0,"[garlic, olive oil, salt, yellow onion, ground black pepper, yukon gold potatoes, low sodium vegetable broth, milk, parmesan cheese]",soup
Irish-Potato-Soup-974627,4,,,,,,,,13,6,,5100.0,"[unsalted butter, onions, shallots, baking potatoes, shredded carrots, low sodium chicken broth, bacon salt, garlic powder, ground black pepper, cooked bacon, sour cream, chopped fresh chives, shredded sharp cheddar cheese]",soup
Irish-oatmeal-leek-soup-352003,5,,,,,,,,7,4,,3300.0,"[whipped butter, leeks, steel-cut oats, fat-free reduced-sodium chicken broth, fat free milk, cracked black pepper, fresh chives]",soup
It_s-Soup_-1096711,4,,,,,,,,8,4,,1500.0,"[diced tomatoes, dried basil, chicken stock, carrots, potatoes, noodles, celery, onions]",soup
Italian-Orzo-Spinach-Soup-682577,4,0.166666666667,0.166666666667,0.0,0.166666666667,0.333333333333,0.166666666667,,14,5,,3000.0,"[olive oil, white onion, carrots, diced celery, garlic, chicken stock, diced tomatoes, pasta shapes, dried thyme, dried oregano, dried rosemary, spinach, black pepper, salt]",soup
Italian-Orzo-Spinach-Soup-682577,4,0.166666666667,0.166666666667,0.0,0.166666666667,0.333333333333,0.166666666667,,14,5,,3000.0,"[olive oil, white onion, carrots, diced celery, garlic, chicken stock, diced tomatoes, pasta shapes, dried thyme, dried oregano, dried rosemary, spinach, black pepper, salt]",soup
Italian-Orzo-Spinach-Soup-682577,4,0.166666666667,0.166666666667,0.0,0.166666666667,0.333333333333,0.166666666667,,14,5,,3000.0,"[olive oil, white onion, carrots, diced celery, garlic, chicken stock, diced tomatoes, pasta shapes, dried thyme, dried oregano, dried rosemary, spinach, black pepper, salt]",soup
Italian-Orzo-Spinach-Soup-682577,4,0.166666666667,0.166666666667,0.0,0.166666666667,0.333333333333,0.166666666667,,14,5,,3000.0,"[olive oil, white onion, carrots, diced celery, garlic, chicken stock, diced tomatoes, pasta shapes, dried thyme, dried oregano, dried rosemary, spinach, black pepper, salt]",soup
Italian-Sausage-Pasta-Soup-1559302,4,,,,,,,1500.0,4,4,300.0,1800.0,"[roasted red peppers, italian sausage, small pasta, baby spinach]",soup
Italian-Sausage-Soup-1275705,4,0.666666666667,0.166666666667,0.666666666667,0.5,0.166666666667,0.166666666667,,6,4,,2400.0,"[hot Italian sausage, italian seasoning, butter beans, black beans, diced tomatoes, beef stock]",soup
Italian-Sausage-and-Kale-Soup-1274259,4,0.333333333333,0.166666666667,0.166666666667,0.333333333333,0.833333333333,0.166666666667,3600.0,9,6,1200.0,4800.0,"[italian sausage, crushed red pepper, onions, bacon, garlic, chicken stock, heavy cream, large potatoes, kale]",soup
Italian-Wedding-Soup-Jo-Cooks-46036,5,0.166666666667,0.166666666667,0.0,0.333333333333,0.166666666667,0.166666666667,,16,6,,2700.0,"[onions, fresh parsley, large eggs, minced garlic, salt, bread crumbs, grated parmesan cheese, ground beef, ground pork, freshly ground black pepper, chicken broth, spinach, pecorino romano cheese, orzo, pepper]",soup
Italian-minestrone-soup-in-the-slow-cooker-310330,5,0.166666666667,0.166666666667,0.0,0.5,0.166666666667,0.166666666667,,12,7,,3300.0,"[lean ground meat, beef, sliced mushrooms, yellow onion, garlic, celery, carrots, stewed tomatoes, dried oregano, beef broth, elbow macaroni, kosher salt]",soup
Italian-sausage_-tomato_-and-macaroni-soup-with-basil-309363,5,0.166666666667,0.166666666667,0.0,0.166666666667,0.166666666667,0.166666666667,,11,7,,3600.0,"[homemade chicken stock, dried basil, fennel, tomatoes with juice, olive oil, italian sausage, onions, minced garlic, macaroni, fresh basil, grated parmesan cheese]",soup
Jack-o_lantern-soup-299953,4,0.166666666667,0.166666666667,0.0,0.166666666667,0.166666666667,0.166666666667,,5,4,,1800.0,"[I Can't Believe It's Not Butter!® Spread, onions, pumpkin, reduced sodium chicken broth, seasoning salt]",soup
Jalapeno-Lime-Chicken-Soup-1455912,4,0.5,0.166666666667,0.833333333333,0.333333333333,0.333333333333,0.166666666667,,12,12,,4200.0,"[chicken broth, water, chicken breasts, jalapeno chilies, purple onion, white beans, salsa verde, lime, salt, fresh cilantro, sour cream, shredded cheese]",soup
Jalapeno-Popper-Soup-_Low-Carb-_-Gluten-Free_-483114,4,0.166666666667,0.5,0.833333333333,0.333333333333,0.166666666667,0.166666666667,,10,4,,2700.0,"[bacon, cream cheese, heavy cream, water, salsa verde, garlic powder, shredded sharp cheddar cheese, shredded Monterey Jack cheese, jalapeno chilies, xanthan gum]",soup
Jalapeno-Potato-Soup-1607936,4,0.5,0.166666666667,0.666666666667,0.666666666667,0.5,0.166666666667,2400.0,10,8,900.0,3300.0,"[margarine, chopped onion, potatoes, ground cumin, chicken broth, pickled jalapeno peppers, baking soda, evaporated milk, salt, ground black pepper]",soup
Jalapeno-corn-soup-303533,4,,,,,,,,6,4,,600.0,"[Country Crock® Spread, garlic, cream style corn, water, jalapeno chilies, Knorr Chicken Flavor Bouillon]",soup
Jamaican-Spiced-Corn-Soup-1022212,3,0.166666666667,0.166666666667,0.666666666667,0.333333333333,0.833333333333,0.166666666667,,14,6,,4200.0,"[olive oil, onions, garlic cloves, cayenne pepper, yellow split peas, vegetable stock, coconut milk, scotch bonnet chile, thyme sprigs, fresh corn, waxy potatoes, butternut squash, sweet corn, red pepper]",soup
James-and-Kimberly-Van-Der-Beek_s-Carrot_-Ginger_-Turmeric-Soup-1573372,4,,,,,,,,7,4,,2700.0,"[sweet onion, carrots, sweet potatoes, vegetable broth, fresh ginger, ground turmeric, greek yogurt]",soup
Janeva_s-Unstuffed-Beef-Cabbage-Roll-Soup-1682862,3,0.166666666667,0.166666666667,0.0,0.166666666667,0.5,0.166666666667,,9,4,,3000.0,"[lean ground beef, cabbage, onions, fire roasted diced tomatoes, onion powder, garlic, beef stock, sea salt, pepper]",soup
Japanese-Mushroom-Soup-1533178,3,0.333333333333,0.166666666667,0.0,0.166666666667,0.5,0.166666666667,,7,4,,2100.0,"[vegetables, garlic, pepper, white mushrooms, fresh ginger, dark soy sauce, lemon juice]",soup
Japanese-Ramen-1579555,4,0.333333333333,0.166666666667,0.0,0.833333333333,0.333333333333,0.166666666667,,10,2,,2400.0,"[vegetable broth, miso paste, large carrots, onions, ramen, crimini mushrooms, snow peas, salt, eggs, green onions]",soup
Jerusalem-Artichoke-Soup-Simply-Recipes-200325,5,0.333333333333,0.166666666667,0.0,0.333333333333,0.5,0.166666666667,3000.0,8,4,900.0,3900.0,"[unsalted butter, chopped onion, celery ribs, large garlic cloves, jerusalem artichokes, chicken stock, salt, black pepper]",soup
Kabocha_-Kale-_-Roasted-Garlic-Soup-1682710,3,0.5,0.166666666667,0.166666666667,0.5,0.833333333333,0.166666666667,,8,5,,5400.0,"[kabocha squash, garlic, extra-virgin olive oil, yellow onion, kale, vegetable broth, turmeric, cayenne]",soup
Kale-Cream-Soup-986566,4,,,,,,,,6,3,,2700.0,"[potatoes, kale, garlic, onions, olive oil, vegetable broth]",soup
Kale-Soup-with-Acorn-Squash-596683,4,0.333333333333,0.166666666667,0.333333333333,0.666666666667,0.833333333333,0.166666666667,,11,4,,4800.0,"[squash, lacinato kale, olive oil, onions, minced garlic, minced ginger, nutmeg, cayenne pepper, vegetable broth, salt, pepper]",soup
Kale-_-Sausage-Soup-_Clean-Eating_-1240893,4,,,,,,,,7,4,,2400.0,"[sausages, kale, potatoes, onions, garlic, low sodium chicken broth, 2% reduced-fat milk]",soup
Kale-and-Roasted-Vegetable-Soup-Simply-Recipes-42872,5,0.5,0.166666666667,0.0,0.5,0.666666666667,0.166666666667,,11,6,,5100.0,"[carrots, tomatoes, onions, butternut squash, garlic cloves, olive oil, vegetable broth, kale, thyme sprigs, bay leaf, great northern beans]",soup
Kansas-City-Steak-Soup-625391,3,0.166666666667,0.166666666667,0.833333333333,0.166666666667,0.333333333333,0.166666666667,,11,6,900.0,3300.0,"[beef sirloin, onions, celery, lower sodium beef broth, diced tomatoes, frozen mixed vegetables, steak sauce, worcestershire sauce, salt, ground black pepper, all-purpose flour]",soup
Keto-Beef-Stroganoff-Soup-1690714,4,,,,,,,1200.0,13,6,,3600.0,"[beef rump, white mushrooms, ghee, garlic, yellow onion, bone broth, paprika, dijon mustard, lemon, sour cream, chopped parsley, salt, freshly ground black pepper]",soup
Kevins-Lettuce-Soup-1713209,4,,,,,,,2160.0,12,8,600.0,2760.0,"[butter oil, white onion, garlic, kosher salt, russet potatoes, unsalted chicken stock, dried thyme leaves, romaine lettuce, chive stems, lemon, sour cream, freshly ground black pepper]",soup
Kielbasa-and-Spinach-Soup-1209777,3,,,,,,,,7,4,,2700.0,"[great northern beans, diced tomatoes, vegetable broth, garlic, dried oregano, turkey kielbasa, spinach]",soup
Kimchi-Gazpacho-1679293,4,0.166666666667,0.166666666667,0.666666666667,0.166666666667,0.833333333333,0.166666666667,,9,2,,1200.0,"[chopped tomatoes, kimchi, kirby cucumbers, large garlic cloves, rice wine, salt, pepper, chive blossoms, scallions]",soup
Kimchi-Udon-Noodle-Soup-1619884,4,0.666666666667,0.166666666667,0.666666666667,0.833333333333,0.5,0.166666666667,,8,4,,1500.0,"[udon, base, fish sauce, kimchi, spinach, eggs, juice, soy sauce]",soup
Korean_style-Seaweed-Soup-Allrecipes,5,0.166666666667,0.166666666667,0.0,0.333333333333,0.0,0.0,1800.0,7,4,900.0,2700.0,"[seaweed, top sirloin, sesame oil, soy sauce, salt, water, minced garlic]",soup
Lady-Gaga_s-Tomato-Fennel-Soup-379567,4,0.166666666667,0.166666666667,0.0,0.166666666667,0.666666666667,0.166666666667,,10,4,,1800.0,"[olive oil, onions, celery, garlic, fennel bulb, tomatoes, low sodium chicken broth, fresh basil, parsley]",soup
Lasagna-soup-350887,5,0.166666666667,0.166666666667,0.166666666667,0.166666666667,0.333333333333,0.166666666667,3300.0,18,4,300.0,3600.0,"[oil, sausage casings, onions, garlic, red pepper flakes, fennel seeds, chicken broth, diced tomatoes, tomato paste, oregano, bay leaf, salt, pepper, pasta, ricotta, parmesan cheese, mozzarella cheese, basil]",soup
Last-Minute-Black-Bean-Soup-1059724,3,0.166666666667,0.166666666667,0.833333333333,0.5,0.833333333333,0.166666666667,,11,4,,1500.0,"[reduced sodium black beans, frozen corn kernels, salsa, water, red bell pepper, fresh lime juice, chili powder, ground cumin, shredded reduced fat cheddar cheese, reduced-fat sour cream, chopped cilantro]",soup
Lazy-Soup-Maker-Red-Pepper-_-Red-Tomato-Soup-1521416,4,0.166666666667,0.166666666667,0.666666666667,0.333333333333,0.833333333333,0.166666666667,1500.0,10,8,180.0,1680.0,"[cherry tomatoes, red pepper, onions, water, soft cheese, oregano, herbs, paprika, salt, pepper]",soup
Le-virtu-_Abruzzese-Minestrone_-1705162,4,,,,,,,,23,8,,10800.0,"[pig, onions, carrots, celery, salt, dried beans, garlic, parsley, pancetta, pepper, nutmeg, olive oil, tomatoes, legumes, fresh veget, basil, grated pecorino]",soup
Leak-and-Blue-Cheese-Soup-1012549,4,0.166666666667,0.166666666667,0.166666666667,0.166666666667,0.166666666667,0.166666666667,,9,4,,2700.0,"[leeks, unsalted butter, extra-virgin olive oil, crumbled blue cheese, flour, dijon mustard, black pepper, chicken broth, scallions]",soup
Leek-Potato-and-Fennel-Soup-1688681,4,0.5,0.166666666667,0.0,0.333333333333,0.5,0.166666666667,2400.0,11,4,,3900.0,"[extra-virgin olive oil, leeks, fennel bulb, garlic, kosher salt, pepper, yukon gold potatoes, vegetable broth, soup, radishes, green onions]",soup
Leek-_-Cauliflower-Soup-With-Broccoli-Pesto-_vegan-_-Grain_-Gluten-_-Sugar-free_-1698491,4,0.166666666667,0.166666666667,0.0,0.166666666667,0.833333333333,0.166666666667,2100.0,18,15,900.0,3000.0,"[olive oil, leeks, garlic cloves, dried thyme, broccoli, chicken stock, cauliflower florets, green beans, medium zucchini, snow peas, brussels sprouts, lemon juice, black pepper, basil leaves, broccoli florets, peanut oil]",soup
Leek-_-Potato-Soup-1712503,4,0.166666666667,0.166666666667,0.166666666667,0.166666666667,0.333333333333,0.166666666667,,9,4,,3000.0,"[unsalted butter, potatoes, leeks, water, thyme, bay leaf, crème fraîche, sea salt, white pepper]",soup
Leek-and-Courgette-Soup-1581128,4,0.166666666667,0.166666666667,0.0,0.166666666667,0.5,0.166666666667,1620.0,7,5,480.0,2100.0,"[leeks, zucchini, celery sticks, potatoes, chicken stock, rapeseed oil, pepper]",soup
Leek-and-Potato-Soup-1060761,4,0.166666666667,0.166666666667,0.0,0.166666666667,0.5,0.166666666667,,5,4,,2700.0,"[leeks, potatoes, chicken broth, kosher salt, pepper]",soup
Lemon-Chicken-Orzo-Soup-1287460,4,,,,,,,,12,4,,3300.0,"[sausage casings, orzo, lemon juice, carrots, celery, onions, garlic cloves, shallots, low sodium chicken broth, vegetable broth, salt]",soup
Lemon-Chicken-Quinoa-Soup-with-Spinach-1064461,4,0.166666666667,0.166666666667,0.0,0.166666666667,0.5,0.166666666667,1500.0,13,6,600.0,2100.0,"[olive oil, onions, carrots, minced garlic, quinoa, reduced sodium chicken broth, water, salt, pepper, dried basil, baby spinach leaves, chicken, lemon]",soup
Lemon-Chicken-Soup-997766,4,0.166666666667,0.166666666667,0.0,0.166666666667,0.5,0.166666666667,1500.0,11,6,300.0,1800.0,"[olive oil, onions, garlic, chicken stock, water, rice, lemon, corn starch, salt, black pepper, cooked chicken]",soup
Lemon-Chicken-Soup-Ii-Allrecipes,5,0.166666666667,0.166666666667,0.0,0.166666666667,0.666666666667,0.166666666667,1800.0,7,8,600.0,2400.0,"[chicken broth, cooked chicken breasts, white rice, lemon, spinach, carrots, black pepper]",soup
Lemon-Chicken-Soup-TasteOfHome,5,0.166666666667,0.166666666667,0.0,0.666666666667,0.166666666667,0.166666666667,,7,4,600.0,600.0,"[condensed chicken with rice soup, condensed cream of chicken soup, water, cooked chicken, lemon juice, pepper, fresh parsley]",soup
Lemon-Chicken-and-Orzo-Soup-1699176,4,0.166666666667,0.166666666667,0.0,0.166666666667,0.333333333333,0.166666666667,,22,5,,4800.0,"[chicken, celery, lemon, fresh parsley, salt, bay leaves, thyme, water, chicken broth, onions, garlic, white wine, carrots, orzo pasta, egg yolks, fresh lemon juice, pepper, fresh thyme, baby spinach]",soup
Lemon-Grass-Ginger-Soup-With-Mushrooms-1707704,3,,,,,,,,9,4,,3000.0,"[chicken stock, lemon grass, ginger, hot chili, nam pla, oyster mushrooms, lime leaves, lime, cilantro leaves]",soup
Lemon-Lentil-Vegetable-Soup-1709643,4,0.166666666667,0.166666666667,0.0,0.333333333333,0.666666666667,0.166666666667,1800.0,12,6,600.0,2400.0,"[olive oil, onions, carrots, celery ribs, broccoli, red lentils, green lentil, fresh lemon juice, water, sea salt, kale, flat leaf parsley]",soup
Lemon-Rice-Soup-985390,4,0.166666666667,0.5,0.0,0.166666666667,0.5,0.166666666667,,8,4,,3000.0,"[onions, garlic, olive oil, chicken, white rice, lemon, salt, pepper]",soup
Lemon-Scented-Fish-Broth-1693653,4,,,,,,,1800.0,12,8,600.0,2400.0,"[salmon, olive oil, onions, carrots, leeks, celery ribs, parsley, bay leaf, thyme, lemon zest, apple cider vinegar, coarse sea salt]",soup
Lemon-Soup-Allrecipes,4,0.166666666667,0.166666666667,0.0,0.166666666667,0.333333333333,0.0,600.0,7,8,300.0,900.0,"[chicken broth, egg yolks, egg whites, lemon, pepper, salt, orzo pasta]",soup
Lemon-and-Rosemary-Chicken-Soup-1598338,4,0.166666666667,0.166666666667,0.166666666667,0.166666666667,0.5,0.166666666667,,11,4,,3300.0,"[olive oil, carrots, white onion, diced celery, garlic, boneless skinless chicken breasts, lemon, chicken broth, crushed red pepper, rosemary, bay leaf]",soup
Lemony-Kale-and-White-Bean-Soup-1611488,4,0.166666666667,0.166666666667,0.0,0.166666666667,0.666666666667,0.166666666667,1800.0,13,4,900.0,2700.0,"[olive oil, sweet onion, garlic, unsalted butter, dried rosemary, dried thyme, dried oregano, lemon, chicken stock, kosher salt, freshly ground black pepper, beans, kale]",soup
Lentil-And-Chickpea-Soup-629622,3,,,,,,,,13,4,,2100.0,"[olive oil, curry powder, onions, red chili peppers, carrots, garlic cloves, lentils, chopped tomatoes, Knorr Vegetable Stock Pots, boiling water, chickpeas, seasoning, coriander]",soup
Lentil-Brown-Rice-Soup-1684009,4,0.166666666667,0.166666666667,0.833333333333,0.166666666667,0.666666666667,0.166666666667,3000.0,26,2,900.0,3900.0,"[brown lentils, brown rice, oil, cumin seed, mustard seeds, bay leaf, onions, garlic, ginger, green chile, turmeric, paprika, garam masala, coriander powder, chipotle peppers, black pepper, diced tomatoes, ketchup, lemon juice, veggies, water, salt, baby spinach, cayenne]",soup
Lentil-Soup-1292696,4,0.166666666667,0.166666666667,0.0,0.333333333333,0.166666666667,0.166666666667,,11,6,,4200.0,"[olive oil, onions, carrots, celery, kosher salt, lentils, chopped tomatoes, low sodium chicken broth, ground coriander, cumin, ground cardamom]",soup
Lentil-Soup-1602186,3,,,,,,,,7,8,,2400.0,"[lentils, low sodium vegetable stock, onions, olive oil, tomatoes, salt, pepper]",soup
Lentil-Soup-1624058,4,0.166666666667,0.166666666667,0.0,0.5,0.333333333333,0.166666666667,,13,6,,4500.0,"[olive oil, finely chopped onion, carrots, chopped celery, minced garlic, kosher salt, lentils, diced tomatoes in juice, chicken stock, ground coriander, ground cumin, black pepper, lemon juice]",soup
Lentil-Soup-1627014,3,,,,,,,,7,12,600.0,2760.0,"[olive oil, onions, garlic, medium carrot, dried lentils, organic vegetable broth, salt and ground black pepper]",soup
Lentil-Soup-1643505,4,0.833333333333,0.5,0.666666666667,0.666666666667,0.833333333333,0.166666666667,,9,4,,3900.0,"[lentils, chorizo, chopped onion, carrots, bell pepper, salt, freshly ground pepper, olive oil, bay leaves]",soup
Lentil-Soup-1710491,4,0.166666666667,0.166666666667,0.0,0.166666666667,0.166666666667,0.166666666667,,12,7,600.0,111600.0,"[chicken broth, green lentil, fennel bulb, carrots, celery ribs, sweet onion, garlic, salt, black pepper, cooked chicken, snip fresh dill, spices]",soup
Lentil-Soup-Iii-Allrecipes,4,0.166666666667,0.166666666667,0.0,0.166666666667,0.166666666667,0.166666666667,1800.0,6,8,300.0,2100.0,"[lentils, chicken broth, onions, tomato paste, garlic, ground cumin]",soup
Lentil-Spinach-Soup-1705837,4,0.166666666667,0.166666666667,0.166666666667,0.166666666667,0.333333333333,0.166666666667,,11,7,,3600.0,"[onions, carrots, garlic, dried lentils, diced tomatoes, vegetable broth, water, spinach, cumin, smoked paprika, salt]",soup
Lentil-Vegetable-Soup-1207202,3,0.166666666667,0.166666666667,0.0,0.333333333333,0.5,0.166666666667,0.0,9,6,,8100.0,"[onions, carrots, potatoes, brown lentils, roasted tomatoes, vegetable broth, spinach, salt, pepper]",soup
Lentil-and-Kale-Soup-1696625,4,0.166666666667,0.166666666667,0.166666666667,0.5,0.5,0.166666666667,2700.0,15,5,900.0,3600.0,"[celery, yellow onion, carrots, garlic, olive oil, kale, ground cumin, curry powder, red pepper flakes, black pepper, diced tomatoes, dried lentils, vegetable stock, water, vegetable bouillon cube]",soup
Lentil-soup-with-sausage_-chard-and-garlic-307854,5,,,,,,,,15,6,,4500.0,"[olive oil, sausage casings, onions, celery ribs, carrots, garlic, kosher salt, crushed red pepper flakes, brown lentils, bay leaves, crushed tomatoes, water, ground black pepper, swiss chard, pecorino romano cheese]",soup
Lentils-With-Yogurt-Soup-1358718,4,,,,,,,2700.0,12,2,300.0,3000.0,"[lentils, yoghurt, eggs, ground cinnamon, ground cumin, turmeric, dried oregano, dried thyme, salt, black pepper, cayenne pepper, dried chives]",soup
Lettuce-soup-347799,5,,,,,,,,7,1,,1800.0,"[leeks, butter, romaine lettuce, chicken broth, frozen peas, chopped fresh mint, salt]",soup
Light-Potato-Cheese-Soup-1297125,4,,,,,,,7200.0,9,6,300.0,7500.0,"[yellow onion, Simply Potatoes Diced Potatoes with Onion, reduced sodium chicken broth, reduced-fat sour cream, shredded extra sharp cheddar cheese, freshly ground pepper, bacon, green onions]",soup
Light-Zucchini-Soup-1618835,4,,,,,,,1200.0,6,4,600.0,1800.0,"[zucchini, vegetable stock, parmesan cheese, water, salt, pepper]",soup
Light-_-Easy-French-Onion-Soup-485455,4,0.166666666667,0.166666666667,0.0,0.166666666667,0.166666666667,0.166666666667,,13,3,,2400.0,"[butter, sweet onion, low sodium beef broth, dry white wine, water, garlic cloves, bay leaf, dried thyme, fresh thyme, sugar, french baguette, reduced fat swiss cheese]",soup
Loaded-Baked-Cauliflower-Soup-1711775,4,0.333333333333,0.5,0.0,0.333333333333,0.833333333333,0.166666666667,,10,4,,5100.0,"[cauliflower, olive oil, salt, freshly ground black pepper, bacon, onions, garlic, chicken, green onions, sharp cheddar cheese]",soup
Loaded-Baked-Potato-Soup-1543028,3,0.333333333333,0.166666666667,0.0,0.333333333333,0.333333333333,0.166666666667,1200.0,14,9,480.0,1680.0,"[baked potato, thick-cut bacon, onions, celery, butter, dried thyme, celery seed, flour, chicken broth, milk, salt, pepper, shredded cheddar cheese, green onions]",soup
Loaded-Baked-Potato-Soup-1631738,4,0.166666666667,0.166666666667,0.0,0.166666666667,0.333333333333,0.333333333333,900.0,10,5,300.0,1200.0,"[baked potato, bacon slices, all-purpose flour, milk, chicken broth, salt, cheddar cheese, spring onions, onions, sour cream]",soup
Loaded-Cream-of-Celery-Soup-1601458,4,,,,,,,,8,4,,1500.0,"[cream of celery soup, diced ham, cheddar cheese, croutons, sea salt, black pepper, coconut oil, olive oil]",soup
