id,rating,bitter,meaty,piquant,salty,sour,sweet,cookTimeInSeconds,ingredientCount,numberOfServings,prepTimeInSeconds,totalTimeInSeconds,ingredient_list,course
Cream-Of-Tomato-Soup-Allrecipes,4,0.166666666667,0.166666666667,0.0,0.166666666667,0.666666666667,0.333333333333,1200.0,6,4,300.0,1500.0,"[butter, onions, all-purpose flour, tomato juice, salt, milk]",soup
Cream-Of-Tomato-Soup-With-Pesto-Allrecipes,4,,,,,,,1200.0,7,6,600.0,1800.0,"[chicken broth, tomatoes with juice, diced tomatoes with garlic and onion, cream, pepper, salt, basil pesto]",soup
Cream-Soup-Substitute-1318806,4,0.166666666667,0.166666666667,0.0,0.666666666667,0.166666666667,0.166666666667,300.0,6,4,120.0,420.0,"[butter, flour, chicken broth, milk, salt, black pepper]",soup
Cream-Soup-Substitute-for-Recipes-1687291,4,0.833333333333,0.166666666667,0.0,0.833333333333,0.166666666667,0.166666666667,600.0,6,1,300.0,900.0,"[butter, flour, broth, salt, pepper, whole milk]",soup
Cream-Soup-With-Mushrooms_-Potatoes-And-Cream-1531713,4,,,,,,,,7,4,,600.0,"[mushrooms, potatoes, onions, olive oil, water, cream, salt and ground black pepper]",soup
Cream-of-Artichoke-Soup-1567179,4,0.166666666667,0.166666666667,0.0,0.166666666667,0.666666666667,0.166666666667,2700.0,10,6,600.0,3300.0,"[frozen artichoke hearts, water, unsalted butter, garlic, chicken broth, salt, black pepper, heavy cream, chopped parsley, lemon wedges]",soup
Cream-of-Asparagus-Soup-1166382,4,0.166666666667,0.166666666667,0.0,0.5,0.166666666667,0.166666666667,,7,4,,2100.0,"[white asparagus, vegetable broth, shallots, butter, heavy cream, salt, pepper]",soup
Cream-of-Asparagus-Soup-1411944,3,0.166666666667,0.166666666667,0.0,0.333333333333,0.166666666667,0.166666666667,,7,4,,2400.0,"[butter, onions, asparagus, vegetable stock, 2% reduced-fat milk, sour cream, lemon juice]",soup
Cream-of-Asparagus-Soup-1524988,4,0.166666666667,0.166666666667,0.0,0.333333333333,0.166666666667,0.166666666667,,7,4,,2400.0,"[asparagus, unsalted butter, onions, reduced sodium chicken broth, low-fat sour cream, kosher salt, pepper]",soup
Cream-of-Asparagus-Soup-1569698,4,0.166666666667,0.166666666667,0.0,0.333333333333,0.166666666667,0.166666666667,,7,4,,2400.0,"[asparagus, unsalted butter, onions, reduced sodium chicken broth, low-fat sour cream, kosher salt, pepper]",soup
Cream-of-Asparagus-Soup-1592892,4,0.166666666667,0.166666666667,0.0,0.166666666667,0.166666666667,0.333333333333,2100.0,5,4,1200.0,3300.0,"[asparagus, onions, milk, salt, roux]",soup
Cream-of-Broccoli-I-Adore-Food_-200803,4,0.166666666667,0.166666666667,0.0,0.166666666667,0.833333333333,0.166666666667,1800.0,10,6,600.0,2400.0,"[butter, onions, celery ribs, chicken broth, broccoli florets, all-purpose flour, milk, pepper, salt]",soup
Cream-of-Broccoli-Soup-1336397,3,,,,,,,600.0,7,8,,1800.0,"[broccoli florets, yellow onion, reduced sodium vegetable broth, cannellini beans, kosher salt, ground black pepper, reduced fat sharp cheddar cheese]",soup
Cream-of-Broccoli-Soup-1408219,3,0.166666666667,0.166666666667,0.0,0.333333333333,0.833333333333,0.166666666667,,7,4,,1800.0,"[butter, onions, broccoli, vegetable stock, heavy cream, sugar, sliced almonds]",soup
Cream-of-Broccoli-Soup-_Dairy-free_-1654092,4,0.666666666667,0.166666666667,0.0,0.5,0.833333333333,0.333333333333,1200.0,10,5,600.0,1800.0,"[broccoli, cauliflower, onions, vegetable broth, vegan cheese, non dairy milk, garlic powder, salt, pepper, corn starch]",soup
Cream-of-Broccoli-Soup-with-Coconut-MilkRecipe-by-Deanna-Dorman-1689132,3,0.166666666667,0.166666666667,0.0,0.166666666667,0.833333333333,0.166666666667,,9,5,,2700.0,"[ghee, white onion, garlic, chicken broth, broccoli florets, leeks, full fat coconut milk, salt, pepper]",soup
Cream-of-Chicken-Soup-Substitute-1704036,4,0.166666666667,0.166666666667,0.166666666667,0.5,0.166666666667,0.166666666667,,8,1,,900.0,"[milk, all-purpose flour, chicken broth, onion powder, garlic powder, salt, pepper, paprika]",soup
Cream-of-Crab-Soup-1005895,3,,,,,,,1800.0,8,6,300.0,2100.0,"[butter, onions, flour, old bay seasoning, McCormick Parsley Flakes, milk, lump crab meat, dry sherry]",soup
Cream-of-Mushroom-Soup-1410544,3,0.166666666667,0.166666666667,0.166666666667,0.333333333333,0.166666666667,0.166666666667,,7,2,,1800.0,"[butter, shiitake, plain flour, vegetable stock, cream, chives, peppercorns]",soup
Cream-of-Mushroom-Soup-1529370,4,0.166666666667,0.166666666667,0.0,0.166666666667,0.166666666667,0.166666666667,,12,4,,2100.0,"[olive oil, butter, onions, garlic cloves, sliced mushrooms, fresh thyme, all-purpose flour, sherry wine, chicken stock, salt, pepper, cream]",soup
Cream-of-Mushroom-Soup-Simply-Recipes-42907,5,0.166666666667,0.166666666667,0.0,0.333333333333,0.166666666667,0.166666666667,2400.0,11,6,900.0,3300.0,"[olive oil, butter, cremini, shiitake, shallots, garlic, kosher salt, dried tarragon leaves, chicken stock, heavy cream, ground black pepper]",soup
Cream-of-Parsnip-Soup-1704196,4,0.166666666667,0.166666666667,0.0,0.666666666667,0.5,0.166666666667,1200.0,7,4,600.0,1800.0,"[parsnips, potatoes, onions, bay leaves, salt, pepper, vegetable stock]",soup
Cream-of-Potato-Soup-1162327,4,0.166666666667,0.166666666667,0.166666666667,0.166666666667,0.5,0.166666666667,,10,4,,3300.0,"[potatoes, water, chopped onion, butter, all-purpose flour, whole milk, salt, pepper, paprika, parsley]",soup
Cream-of-Potato-Soup-1627513,3,,,,,,,,9,4,,1500.0,"[medium potatoes, chopped onion, chicken broth, butter, all-purpose flour, snip fresh dill, salt, ground black pepper, milk]",soup
Cream-of-Tomato-Soup-1603364,4,,,,,,,1260.0,5,4,300.0,1560.0,"[tomato passata, plum tomatoes, chicken, double cream, low-fat milk]",soup
Cream-of-Tomato-Soup-530362,4,0.166666666667,0.166666666667,0.0,0.166666666667,0.5,0.166666666667,,7,4,,2100.0,"[olive oil, onions, garlic cloves, tomatoes, herbs, water, evaporated milk]",soup
Cream-of-Zucchini-Soup-1259589,4,0.166666666667,0.166666666667,0.0,0.166666666667,0.5,0.166666666667,,11,4,,3000.0,"[olive oil, onions, zucchini, water, dried parsley, seasoning salt, base, butter, flour, milk, cream]",soup
Cream-of-Zucchini-Soup-1574421,4,0.166666666667,0.166666666667,0.0,0.166666666667,0.833333333333,0.166666666667,,8,4,,2400.0,"[onions, garlic, medium zucchini, swanson chicken broth, reduced-fat sour cream, kosher salt, black pepper, grated parmesan cheese]",soup
Cream-of-asparagus-soup-352170,5,0.333333333333,0.166666666667,0.0,0.666666666667,0.166666666667,0.166666666667,,7,6,,2100.0,"[asparagus, butter, onions, fat-free chicken broth, low-fat sour cream, salt, pepper]",soup
Cream-of-broccoli-soup-352460,5,0.166666666667,0.166666666667,0.0,0.666666666667,0.833333333333,0.166666666667,,10,4,,2700.0,"[fat-free chicken broth, milk, low-fat sour cream, sharp cheddar cheese, onions, carrots, celery, garlic, broccoli florets, ground black pepper]",soup
Creamless-Cream-of-Asparagus-Soup-1570005,4,0.166666666667,0.166666666667,0.0,0.166666666667,0.166666666667,0.166666666667,900.0,10,6,600.0,1500.0,"[butter, onions, celery, garlic, russet potatoes, asparagus, chicken stock, black pepper, lemon juice, asparagus tips]",soup
Creamless-Tomato-Soup-1020780,4,0.166666666667,0.166666666667,0.0,0.166666666667,0.5,0.166666666667,,8,8,,2100.0,"[extra-virgin olive oil, onions, garlic, carrots, crushed tomatoes, chicken broth, basil, grated parmesan cheese]",soup
Creamy-Asparagus-Potato-Soup-1030512,4,0.166666666667,0.166666666667,0.5,0.166666666667,0.333333333333,0.166666666667,,9,4,,1800.0,"[extra-virgin olive oil, shallots, low sodium vegetable broth, asparagus, potatoes, prepared horseradish, salt, cubed bread, scallion greens]",soup
Creamy-Asparagus-Sunchoke-Soup-1481705,4,,,,,,,,9,4,,3300.0,"[fresh asparagus, potatoes, sunchokes, shallots, olive oil, low sodium vegetable broth, kosher salt, white pepper, microgreens]",soup
Creamy-Bacon-Corn-Chowder-1251241,4,,,,,,,,11,4,,1200.0,"[corn, cream style corn, evaporated milk, bacon, carrots, onions, large potatoes, butter, water, salt, pepper]",soup
Creamy-Bacon-Potato-Soup-793921,4,0.166666666667,0.166666666667,0.0,0.333333333333,0.5,0.166666666667,,11,7,,3300.0,"[bacon, onions, garlic cloves, flour, chicken broth, potatoes, shredded cheese, half & half, green onions, salt, pepper]",soup
Creamy-Broccoli-Soup-1114118,4,0.333333333333,0.166666666667,0.0,0.166666666667,0.833333333333,0.166666666667,,7,7,,3300.0,"[broccoli, onions, carrots, mushrooms, vegetable broth, almond milk, nutritional yeast]",soup
Creamy-Broccoli-Soup-1703066,4,0.333333333333,0.166666666667,0.5,0.5,0.833333333333,0.166666666667,780.0,12,4,600.0,1380.0,"[leeks, extra-virgin olive oil, garlic cloves, broccoli, white wine vinegar, vegetable broth, light coconut milk, greens, sea salt, freshly ground black pepper, lemon, red pepper flakes]",soup
Creamy-Broccoli-Soup-THM-S-1305577,4,0.166666666667,0.333333333333,0.0,0.833333333333,0.166666666667,0.166666666667,,10,4,,2400.0,"[frozen broccoli, chicken broth, onions, chopped bacon, butter, cream cheese, shredded cheese, garlic salt, pepper, salt]",soup
Creamy-Broccoli-Soup-without-the-Cream-1684224,4,0.166666666667,0.166666666667,0.0,0.666666666667,0.833333333333,0.166666666667,,14,4,,2400.0,"[canola oil, celery, onions, garlic cloves, kosher salt, broccoli, vegetable stock, water, quick-cooking oatmeal, fresh lemon juice, dried dill, black pepper, fresh chives, lemon]",soup
Creamy-Broccoli-_-Leek-Soup-With-Cheese-1553465,4,,,,,,,,6,4,,1500.0,"[knorr leek recip mix, water, milk, potatoes, frozen broccoli, shredded cheddar cheese]",soup
Creamy-Butternut-Squash-Soup-with-Smoked-Paprika-1190032,4,0.166666666667,0.166666666667,0.333333333333,0.166666666667,0.5,0.166666666667,,10,5,,3900.0,"[butternut squash, olive oil, smoked paprika, cayenne, salt, pepper, low sodium chicken broth, lemon juice, cilantro, plain yogurt]",soup
Creamy-Carrot-Pumpkin-Soup-1688692,4,,,,,,,600.0,14,4,,1500.0,"[carrots, pumpkin purée, broth, non dairy milk, ginger root, garlic, ground turmeric, cinnamon, maple syrup, spices, paprika, cayenne, black pepper, salt]",soup
Creamy-Cauliflower-Soup-1625274,4,0.166666666667,0.166666666667,0.0,0.166666666667,0.833333333333,0.166666666667,,9,4,,3000.0,"[unsalted butter, onions, cauliflower, all-purpose flour, chicken broth, heavy cream, grated nutmeg, salt, pepper]",soup
Creamy-Cauliflower-Soup-593450,4,0.333333333333,0.166666666667,0.0,0.833333333333,0.833333333333,0.166666666667,,8,5,,3300.0,"[olive oil, chopped garlic, leeks, salt, cauliflower, vegetable broth, unsalted cashews, chives]",soup
Creamy-Cauliflower-Soup-Recipe-to-Die-For_-1698275,3,0.166666666667,0.166666666667,0.166666666667,0.666666666667,0.833333333333,0.166666666667,,16,4,,2700.0,"[olive oil, yellow onion, bay leaf, ground cumin, kosher salt, ground turmeric, ground coriander, ground cardamom, ground black pepper, crushed red pepper flakes, garlic cloves, vegetable broth, cauliflower, coconut milk, apple cider vinegar, fresh dill]",soup
Creamy-Cauliflower-Soup-with-Bacon-and-Gorgonzola-514157,5,0.833333333333,0.166666666667,0.0,0.833333333333,0.833333333333,0.166666666667,,5,4,,1200.0,"[cauliflower, broth, salt, bacon, crumbled gorgonzola]",soup
Creamy-Cauliflower-Soup-with-Greens-_-Avocado-adapted-from-Martha-Stewart-Living-1036611,4,0.166666666667,0.166666666667,0.0,0.166666666667,0.833333333333,0.166666666667,,12,4,,3600.0,"[extra-virgin olive oil, onions, garlic, kosher salt, cauliflower, water, fresh thyme, greens, avocado, ground black pepper, maldon sea salt, chopped parsley]",soup
Creamy-Cauliflower-Soup-with-Sriracha-Swirls-1046253,4,,,,,,,,8,2,,2100.0,"[cauliflower, olive oil, broth, salt, coconut milk, mild curry powder, Sriracha, toasted pumpkinseeds]",soup
Creamy-Cauliflower-and-Parsnip-Miso-Soup-With-Roasted-Shiitake-_Vegan_-1683204,3,0.166666666667,0.166666666667,0.0,0.166666666667,0.666666666667,0.166666666667,,14,4,,5400.0,"[garlic, cauliflower, parsnips, yellow onion, extra-virgin olive oil, sea salt, miso paste, water, apple cider vinegar, shiitake, gluten, toasted sesame oil, green onions, sprouts]",soup
Creamy-Cauliflower-soup-1243224,4,0.5,0.166666666667,0.166666666667,0.166666666667,0.833333333333,0.333333333333,900.0,7,4,900.0,1800.0,"[cauliflower, white pepper, nutmeg, cream, milk, salt, butter]",soup
Creamy-Celery-Soup-1393620,4,0.333333333333,0.166666666667,0.0,0.5,0.5,0.166666666667,,9,4,,2400.0,"[celery sticks, onions, clove, ginger, potatoes, salt, black pepper, water, butter]",soup
Creamy-Celery-Soup-Martha-Stewart-194587,4,0.333333333333,0.166666666667,0.0,0.166666666667,0.5,0.166666666667,,6,4,1800.0,3300.0,"[butter, celery, onions, baking potatoes, coarse salt, fresh lemon juice]",soup
Creamy-Cheddar-Cheese-Soup-Allrecipes,5,0.166666666667,0.333333333333,0.0,0.166666666667,0.166666666667,0.166666666667,,6,6,,1800.0,"[butter, onions, all-purpose flour, chicken broth, milk, shredded cheddar cheese]",soup
Creamy-Chicken-Mushroom-Soup-1697772,4,0.166666666667,0.166666666667,0.0,0.166666666667,0.166666666667,0.166666666667,1200.0,12,6,600.0,1800.0,"[olive oil, skinless chicken breasts, unsalted butter, garlic, crimini mushrooms, small yellow onion, carrots, celery, dried thyme, flour, chicken stock, heavy cream]",soup
Creamy-Chicken-Tortilla-Soup-1712451,4,,,,,,,,8,4,,2400.0,"[picante sauce, condensed cream of chicken soup, rotisserie chicken, corn, black beans, soup, ground cumin, shredded cheddar cheese]",soup
Creamy-Chicken-_-Mushroom-Soup-1710288,4,0.166666666667,0.166666666667,0.166666666667,0.166666666667,0.166666666667,0.166666666667,,11,6,1200.0,2400.0,"[chicken breasts, butter, onions, chopped garlic, mixed mushrooms, chili flakes, salt, chicken stock, corn flour, cream, coriander]",soup
Creamy-Chicken-_-Rice-Soup-Recipe_-1596524,4,0.166666666667,0.166666666667,0.166666666667,0.5,0.166666666667,0.166666666667,,15,4,,3000.0,"[boneless skinless chicken breasts, spices, olive oil, carrots, onions, frozen corn, paprika, salt, pepper, chicken stock, jasmine rice, cream cheese, corn starch, lemon juice]",soup
Creamy-Chicken-_-Wild-Rice-Soup-1529413,3,,,,,,,,9,4,,2700.0,"[butter, onions, celery, dried thyme, all-purpose flour, swanson chicken broth, milk, cooked chicken, wild rice]",soup
Creamy-Chicken-and-Corn-Chowder-Soup-1637039,4,0.166666666667,0.166666666667,0.0,0.5,0.5,0.166666666667,,12,4,,3000.0,"[potatoes, onions, butter, seasoning, cream of chicken soup, cream style corn, whole kernel corn, milk, rotisserie chicken, salt]",soup
Creamy-Chicken-and-Mushroom-Soup-1710045,4,0.166666666667,0.166666666667,0.0,0.166666666667,0.166666666667,0.166666666667,,9,6,,3000.0,"[water, flour, celery ribs, shiitake, crimini mushrooms, chicken, unsalted butter, skinless chicken breasts, fresh parsley]",soup
Creamy-Coconut-Carrot-Soup-1601226,3,,,,,,,,9,4,,2400.0,"[homemade chicken broth, carrots, yellow onion, garlic, coconut milk, ground cinnamon, ground cumin, sea salt, freshly ground black pepper]",soup
Creamy-Coconut-Corn-Chowder-634429,3,,,,,,,900.0,10,2,300.0,1200.0,"[oil, onions, garlic, celery, red chili peppers, chili powder, corn kernels, vegetable stock, coconut milk, fresh parsley]",soup
Creamy-Corn-Soup-Martha-Stewart,5,,,,,,,,6,8,1200.0,1500.0,"[yellow corn, butter, coarse salt, tortilla chips, lime wedges, scallions]",soup
Creamy-Corn-Soup-with-Crispy-Bacon-634687,3,,,,,,,,7,4,,3000.0,"[fresh corn, russet potatoes, almonds, salt, pepper, bacon, basil leaves]",soup
Creamy-Corn-and-Leek-Soup-1292110,4,,,,,,,900.0,8,4,900.0,1800.0,"[leeks, jalapeno chilies, fresh sage, olive oil, fresh corn, white beans, vegetable broth, salt]",soup
Creamy-Crock-Pot-Chicken-Wild-Rice-Soup-1381282,4,0.166666666667,0.166666666667,0.0,0.166666666667,0.166666666667,0.166666666667,21600.0,15,8,600.0,22200.0,"[butter, flour, chicken broth, water, chicken breasts, matchstick carrots, celery, onions, wild rice, garlic powder, thyme, salt, pepper, heavy whipping cream, crackers]",soup
Creamy-Cucumber-Soup-1628933,4,0.166666666667,0.166666666667,0.166666666667,0.5,0.333333333333,0.166666666667,,12,4,2100.0,2100.0,"[extra-virgin olive oil, garlic, onions, lemon juice, sliced cucumber, vegetable broth, salt, freshly ground pepper, cayenne pepper, avocado, fresh parsley, low-fat plain yogurt]",soup
Creamy-Cucumber-Soup-1658514,4,0.166666666667,0.166666666667,0.166666666667,0.166666666667,0.333333333333,0.166666666667,,11,4,,2100.0,"[extra-virgin olive oil, garlic, onions, lemon juice, sliced cucumber, chicken broth, salt, freshly ground pepper, avocado, fresh parsley, plain yogurt]",soup
Creamy-Cucumber-Soup-1710844,4,0.166666666667,0.166666666667,0.166666666667,0.166666666667,0.333333333333,0.166666666667,,11,4,,2100.0,"[virgin olive oil, garlic, onions, lemon juice, sliced cucumber, chicken broth, salt, freshly ground pepper, avocado, fresh parsley, plain yogurt]",soup
Creamy-Curried-Cauliflower-Soup-628946,3,0.166666666667,0.166666666667,0.166666666667,0.166666666667,0.5,0.166666666667,,11,4,,3900.0,"[garlic, almond milk, sunflower kernels, yellow onion, mild curry powder, cauliflower florets]",soup
Creamy-Dreamy-Broccoli-Soup-960392,3,,,,,,,,7,4,,900.0,"[silken tofu, basil leaves, cashew butter, broccoli, salt, lemon, freshly ground pepper]",soup
Creamy-Garlic-Soup-461527,5,,,,,,,,7,6,,3300.0,"[olive oil, garlic, shallots, chicken stock, heavy cream, kosher salt, ground black pepper]",soup
Creamy-Gluten-Free-Tomato-Soup-1685910,4,0.833333333333,0.166666666667,0.0,0.833333333333,0.5,0.166666666667,1500.0,9,4,120.0,1620.0,"[white onion, garlic, coconut oil, diced tomatoes, cumin, ginger, marsala wine, coconut milk, salt]",soup
Creamy-Ham-Potato-and-Corn-Chowder-1682142,4,0.5,0.166666666667,0.0,0.666666666667,0.166666666667,0.166666666667,2400.0,18,6,900.0,3300.0,"[cooked ham, bacon, butter, yellow onion, carrots, celery ribs, low sodium chicken broth, red potato, dried oregano, dried thyme, bay leaf, salt, freshly ground black pepper, corn kernels, all-purpose flour, milk, sour cream, chives]",soup
Creamy-Leek-Potato-Soup-1101918,4,0.166666666667,0.166666666667,0.0,0.166666666667,0.333333333333,0.166666666667,,10,4,,3900.0,"[leeks, onions, garlic cloves, olive oil, chicken stock, water, gold potatoes, salt, black pepper, milk]",soup
Creamy-Lemon-Chicken-Soup-1689254,4,0.666666666667,0.166666666667,0.0,0.833333333333,0.333333333333,0.166666666667,,17,6,,5400.0,"[chicken thighs, olive oil, butter, shallots, yellow onion, garlic, salt, pepper, marjoram, dried oregano, chicken stock, honey, lemon zest, heavy cream, wheat, kale, fresh parsley]",soup
Creamy-Loaded-Potato-Soup-1336707,4,0.166666666667,0.5,0.0,0.166666666667,0.833333333333,0.166666666667,2400.0,13,8,900.0,3300.0,"[medium potatoes, bacon slices, onions, garlic, all-purpose flour, heavy cream, chicken broth, basil, oregano, salt, pepper, cheddar cheese, green onions]",soup
Creamy-Mini-Meatball-Tortellini-Soup-1611950,3,,,,,,,,7,6,,3000.0,"[beef meatballs, tortellini, chicken broth, diced tomatoes, cream cheese, baby spinach, parmesan cheese]",soup
Creamy-Multiple-Mushroom-Soup-1090569,4,0.166666666667,0.166666666667,0.0,0.166666666667,0.166666666667,0.166666666667,2400.0,14,9,1200.0,3600.0,"[fresh mushrooms, dried mushrooms, white wine, chicken stock, chopped onion, dried thyme, butter, flour, olive oil, salt, pepper, cream, cream cheese]",soup
Creamy-Mushroom-Black-Bean-Soup-1680489,4,0.166666666667,0.166666666667,0.0,0.166666666667,0.166666666667,0.166666666667,1500.0,14,6,900.0,2400.0,"[black beans, diced onions, celery, carrots, minced ginger, minced garlic, mushrooms, sea salt, pepper, ground coriander, ground cumin, water, lemon juice, fresh parsley]",soup
Creamy-Mushroom-Brie-White-Bean-Soup-1001420,4,,,,,,,1800.0,16,3,600.0,2400.0,"[button mushrooms, portabello mushroom, cannellini beans, brie cheese, vegetable stock, onions, garlic, heavy cream, milk, oil, cream cheese, bay leaf, basil, black pepper, salt, parsley flakes]",soup
Creamy-Mushroom-Soup-1561080,4,0.166666666667,0.5,0.0,0.166666666667,0.166666666667,0.166666666667,,10,4,,2100.0,"[butter, mushrooms, garlic salt, flour, half & half, heavy cream, minced onion, garlic powder, salt, pepper]",soup
Creamy-Mushroom-Soup-1588883,4,,,,,,,,9,3,1200.0,1200.0,"[crimini mushrooms, white onion, garlic cloves, flour, heavy cream, water, parsley leaves, pepper, salt]",soup
Creamy-Mushroom-Soup-Allrecipes,5,0.166666666667,0.166666666667,0.0,0.166666666667,0.166666666667,0.166666666667,900.0,10,4,600.0,1500.0,"[butter, shiitake, portabello mushroom, shallots, all-purpose flour, chicken broth, half & half, salt, pepper, ground cinnamon]",soup
Creamy-Onion-Soup-1411565,3,,,,,,,,9,8,,2700.0,"[oil, onions, all-purpose flour, dry white wine, vegetable stock, heavy cream, fresh marjoram, dijon mustard, cheddar cheese]",soup
Creamy-Onion-Soup-976168,3,,,,,,,,8,4,,3000.0,"[onions, balsamic vinegar, maple syrup, chicken stock, coconut milk, ghee, ground black pepper, sea salt]",soup
Creamy-Parmesan-Tomato-and-Spinach-Tortellini-Soup-748763,4,0.5,0.166666666667,0.333333333333,0.5,0.666666666667,0.166666666667,1200.0,15,4,600.0,1800.0,"[butter, onions, garlic, red pepper flakes, flour, vegetable broth, diced tomatoes, tomato paste, cheese tortellini, parmigiano reggiano cheese, spinach, heavy whipping cream, salt, pepper, basil]",soup
Creamy-Parsnip-Soup-In-The-Soup-Maker-1521250,4,0.166666666667,0.166666666667,0.0,0.166666666667,0.666666666667,0.333333333333,1500.0,9,4,300.0,1800.0,"[sweet potatoes, onions, parsnips, large carrots, garlic puree, water, thyme, salt, pepper]",soup
Creamy-Potato-Cheese-Soup-982398,4,,,,,,,,9,4,,2400.0,"[butter, flour, milk, baking potatoes, bacon, cheddar cheese, sour cream, salt, pepper]",soup
Creamy-Potato-Leek-Soup-1544987,4,0.333333333333,0.166666666667,0.0,0.5,0.333333333333,0.166666666667,1500.0,10,5,600.0,2100.0,"[grapeseed oil, onions, leeks, garlic, yukon gold potatoes, soft tofu, vegetable broth, salt, pepper, chives]",soup
Creamy-Potato-Soup-1498882,4,,,,,,,,14,5,,3600.0,"[russet potatoes, yellow onion, carrots, diced celery, low sodium chicken broth, salt, freshly ground black pepper, butter, all-purpose flour, milk, sour cream, crumbled bacon, shredded cheddar cheese, green onions]",soup
Creamy-Pulled-Pork-Soup-_AIP_-1103011,4,0.166666666667,0.166666666667,0.0,0.166666666667,0.833333333333,0.166666666667,,8,4,,3000.0,"[coconut oil, onions, garlic, cauliflower, fine sea salt, chicken broth, dried oregano, pork]",soup
Creamy-Pumpkin-Soup-1430618,4,0.5,0.166666666667,0.833333333333,0.166666666667,0.5,0.166666666667,,12,6,,2400.0,"[pumpkin, cashew nuts, water, stock, smoked paprika, cayenne, ground cumin, tomato purée, garlic puree, cinnamon, salt, pepper]",soup
Creamy-Pumpkin-Soup-1668134,4,,,,,,,1800.0,12,4,600.0,2400.0,"[olive oil, shallots, garlic cloves, reduced sodium chicken broth, milk, pumpkin purée, water, salt, fresh thyme, sage leaves, cinnamon, ground ginger]",soup
Creamy-Red-Gazpacho-1677891,4,0.166666666667,0.333333333333,0.166666666667,0.166666666667,0.833333333333,0.166666666667,,15,6,,3000.0,"[green pepper, red pepper, purple onion, avocado, medium tomatoes, garlic, fresh lemon juice, apple cider vinegar, basil, cucumber, spring onions, salt, freshly ground black pepper, extra-virgin olive oil, soft goat cheese]",soup
Creamy-Red-Gazpacho-1687060,4,0.166666666667,0.333333333333,0.166666666667,0.166666666667,0.833333333333,0.166666666667,,15,6,,3000.0,"[green pepper, red pepper, purple onion, avocado, medium tomatoes, garlic, fresh lemon juice, apple cider vinegar, basil, cucumber, spring onions, salt, freshly ground black pepper, extra-virgin olive oil, soft goat cheese]",soup
Creamy-Red-Lentil-and-Kale-Soup-_Vegan_-Gluten-Free_-Dairy-Free_-770798,4,0.333333333333,0.166666666667,0.333333333333,0.166666666667,0.333333333333,0.166666666667,,10,4,,3300.0,"[red lentils, organic vegetable broth, full fat coconut milk, roma tomatoes, onions, kale, tomato sauce, ground cumin, Himalayan salt, cayenne pepper]",soup
Creamy-Roasted-Asparagus-Soup-1603319,4,0.333333333333,0.166666666667,0.0,0.166666666667,0.333333333333,0.333333333333,1200.0,8,4,300.0,1500.0,"[fresh asparagus, olive oil, white onion, garlic, vegetable broth, milk, salt, pepper]",soup
Creamy-Roasted-Asparagus-and-Brie-Cauliflower-Soup-1686447,4,0.333333333333,0.166666666667,0.0,0.666666666667,0.833333333333,0.166666666667,1800.0,15,4,600.0,2400.0,"[asparagus, cauliflower, oil, salt, pepper, onions, garlic, vegetable broth, brie cheese, fresh basil, lemon zest, lemon juice]",soup
Creamy-Roasted-Corn-Soup-Naturally-Ella-46347,5,0.166666666667,0.166666666667,0.0,0.666666666667,0.166666666667,0.166666666667,,11,2,,3000.0,"[sweet corn, pepper, yellow squash, salt, olive oil, garlic, vegetable broth, water, rosemary, rice]",soup
Creamy-Roasted-Garlic-White-Bean-Soup-1679560,4,0.666666666667,0.666666666667,0.0,0.5,0.166666666667,0.333333333333,3600.0,11,4,900.0,4500.0,"[garlic, olive oil, leeks, carrots, celery ribs, sage leaves, dried navy beans, vegetable broth, cashew nuts, freshly ground black pepper, sea salt]",soup
Creamy-Roasted-Red-Pepper-and-Cauliflower-Soup-with-Goat-Cheese-1581965,4,,,,,,,3600.0,13,4,600.0,4200.0,"[red bell pepper, cauliflower, olive oil, onions, garlic, thyme, red pepper flakes, chicken broth, smoked paprika, goat cheese, salt, pepper]",soup
Creamy-Roasted-Tomato-Gazpacho-1698564,4,0.166666666667,0.166666666667,0.833333333333,0.166666666667,0.666666666667,0.166666666667,,15,2,,3600.0,"[roma tomatoes, yellow onion, piquillo peppers, garlic, olive oil, sherry vinegar, toasted pine nuts, sourdough bread, salt, pepper, water, tomatoes, cucumber, scallions, chili flakes]",soup
Creamy-Root-Vegetable-Miso-Soup-_Vegan_-1701225,3,0.333333333333,0.166666666667,0.166666666667,0.666666666667,0.5,0.166666666667,,10,4,,2400.0,"[coconut oil, onions, carrots, turnips, vegetable broth, coconut cream, miso, agave nectar, wasabi powder, lime]",soup
