,id,rating,recipeName,sourceDisplayName
0,Easy-Chicken-Teriyaki-1683493,4,Easy Chicken Teriyaki,Melanie Cooks
1,Crispy-Sesame-Chicken-with-a-Sticky-Asian-Sauce-1690758,4,Crispy Sesame Chicken with a Sticky Asian Sauce,Kitchen Sanctuary
2,Thai-Basil-Chicken-_Gai-Pad-Krapow_-1703889,4,Thai Basil Chicken (Gai Pad Krapow),The Woks of Life
3,Korean-Beef-Bowl-1704817,4,Korean Beef Bowl,Damn Delicious
4,Asian-Honey-Chicken-1634071,4,Asian Honey Chicken,Get In My Belly
5,Korean-Bulgogi-BBQ-Steak-Buddha-Bowls_-1707985,4,Korean Bulgogi BBQ Steak Buddha Bowls.,Half Baked Harvest
6,Spicy-Asian-Noodles-with-Peanut-Sauce-1706207,4,Spicy Asian Noodles with Peanut Sauce,Savory Style
7,Thai-Spiced-Sticky-Basil-Meatballs-1697628,3,Thai Spiced Sticky Basil Meatballs,My Food Story
8,Mario-Batalis-Spicy-Shrimp-Saute-1698216,3,Mario Batali’s Spicy Shrimp Sauté,New York Times Cooking
9,General-Tso_s-Chicken-1587090,3,General Tso's Chicken,Dinner Then Dessert
10,Mongolian-Beef-1677986,4,Mongolian Beef,Handle the Heat
11,Thai-Fried-Chicken-1707574,4,Thai Fried Chicken,Rasa Malaysia
12,Sesame-Noodles-1639359,4,Sesame Noodles,Gimme Some Oven
13,Smoky-Grilled-Tofu-With-Hoisin-Sauce-1683291,3,Smoky Grilled Tofu With Hoisin Sauce,Vegetarian About.com
14,Korean-BBQ-Yum-Yum-Rice-Bowls-1700793,4,Korean BBQ Yum Yum Rice Bowls,Pinch of Yum
15,Korean-Style-Pork-Chops-1058158,4,Korean Style Pork Chops,Jo Cooks
16,Baby-Bok-Choy-With-Oyster-Sauce-1683568,3,Baby Bok Choy With Oyster Sauce,New York Times Cooking
17,Quick-Teriyaki-Chicken-Rice-Bowls-1690302,4,Quick Teriyaki Chicken Rice Bowls,Crunchy Creamy Sweet
18,Garlic-Beef-And-Asparagus-Stir-fry-636737,4,Garlic Beef And Asparagus Stir-fry,
19,Asian-Flank-Steak-1711504,4,Asian Flank Steak,food-fire.com
20,30-Minute-Chicken-Rice-Noodle-Stir-Fry-1705476,4,30-Minute Chicken Rice Noodle Stir-Fry,Munchkin Time
21,Thai-Basil-Chicken-_Gai-Pad-Krapow_-1702504,4,Thai Basil Chicken (Gai Pad Krapow),Gimme Some Oven
22,Korean-BBQ-Chicken-1636141,4,Korean BBQ Chicken,Jessy and Melissa
23,Coconut-Curry-Pork-Noodle-Bowl-1697560,4,Coconut Curry Pork Noodle Bowl,Lemons for Lulu
24,Spicy-Chicken-and-Zucchini-Stir-Fry-1710948,4,Spicy Chicken and Zucchini Stir Fry,Carlotta Lund's Culinary Concerto
25,Grilled-Tahini-Pork-Skewers-1712590,4,Grilled Tahini Pork Skewers,Sidewalk Shoes
26,Spicy-Orange-Shrimp-_Recipe-1684244,4,Spicy Orange Shrimp #Recipe,My Favorite Recipes
27,Congee-_Rice-Porridge_-1697954,4,Congee (Rice Porridge),Vegan Heaven
28,Asian-Steak-Stir-Fry-with-Zucchini-Noodles-1701793,4,Asian Steak Stir Fry with Zucchini Noodles,Chocolate Slopes
29,Orange-Sesame-Ginger-Glazed-Salmon-1712271,4,Orange Sesame Ginger Glazed Salmon,Valerie's Kitchen
30,Stir-Fried-Sesame-Shrimp-and-Spinach-1709489,3,Stir-Fried Sesame Shrimp and Spinach,New York Times Cooking
31,Asian-Pork-Noodles-with-Spinach-1696098,3,Asian Pork Noodles with Spinach,Food & Wine
32,Glazed-Tofu-1694250,4,Glazed Tofu,Leite's Culinaria
33,Grilled-Ginger-Cauliflower-Steaks-with-Tahini-Sauce-1694094,4,Grilled Ginger Cauliflower Steaks with Tahini Sauce,Strength And Sunshine
34,Bun-Thit-Nuong-_Vietnamese-Grilled-Pork-with-Rice-Noodles_-1707373,4,Bún Thịt Nướng (Vietnamese Grilled Pork with Rice Noodles),Tara's Multicultural Table
35,Saucy-Asian-Meatballs-636765,4,Saucy Asian Meatballs,
36,Slow-Cooker-Thai-Peanut-Chicken-1695231,4,Slow Cooker Thai Peanut Chicken,Averie Cooks
37,Easy-Thai-Chicken-Curry-1693436,3,Easy Thai Chicken Curry,DrChristianson.com
38,Bulgogi-_Korean-BBQ-Beef_-1554302,3,Bulgogi (Korean BBQ Beef),Tasting Table
39,Paleo-Pad-Thai-1705965,4,Paleo Pad Thai,Paleo Cupboard
40,Mongolian-Beef-Ramen-1700376,4,Mongolian Beef Ramen,Chef Savvy
41,Asian-Pork-Fillet_Tenderloin-1642474,4,Asian Pork Fillet/Tenderloin,Close Encounters of the Cooking Kind
42,Mongolian-Beef-1603306,4,Mongolian Beef,"Dinners, Dishes and Desserts"
43,Orange-Teriyaki-Salmon-1685634,4,Orange Teriyaki Salmon,Chef Savvy
44,Dakkochi-_Korean-Skewered-Chicken_-596981,4,Dakkochi (Korean Skewered Chicken),Closet Cooking
45,Sake-Lime-Shrimp-and-Edamame-Foil-Packs-1708512,3,Sake Lime Shrimp and Edamame Foil Packs,Tablespoon
46,Thai-Coconut-Curry-Chicken-1635276,4,Thai Coconut Curry Chicken,Damn Delicious
47,Vegan-Sesame-Broccoli-Noodle-Bowl-1703551,4,Vegan Sesame Broccoli Noodle Bowl,Veggie Souls
48,Shrimp-Noodle-Bowl-1711686,3,Shrimp Noodle Bowl,Team Beachbody
49,Soy-and-sesame-beef-with-Asian-greens-1699193,3,Soy and sesame beef with Asian greens,Delicious.
50,Healthy-Beef-and-Broccoli-1237260,4,Healthy Beef and Broccoli,A Sweet Pea Chef
51,Khao-Pad-Sapparot-_Thai-Pineapple-Fried-Rice_-1707374,4,Khao Pad Sapparot (Thai Pineapple Fried Rice),Tara's Multicultural Table
52,Easy-Teriyaki-Chicken-1588441,4,Easy Teriyaki Chicken,Malibu Kitchen
53,Spicy-Stir-fried-Squid-With-Snake-Beans-And-Baby-Corn-1710149,3,Spicy Stir-fried Squid With Snake Beans And Baby Corn,Delicious.
54,Asian-Fusion-Glazed-Tofu-1682161,4,Asian Fusion Glazed Tofu,Fit and Fab Living
55,Spicy-Braised-Tofu-1702910,4,Spicy Braised Tofu,AlloverUnique
56,Tofu_-Basil-and-Caramelized-Shallot-Stir-Fry-1707928,4,"Tofu, Basil and Caramelized Shallot Stir-Fry",Connoisseurus Veg
57,Crispy-honey-lemon-chicken-333534,5,Crispy Honey Lemon Chicken,How Sweet It Is
58,Asian-Bison-Burgers-1705532,4,Asian Bison Burgers,Fox and Briar
59,One-Pot-Creamy-Vegan-Tahini-Noodles-1687753,4,One Pot Creamy Vegan Tahini Noodles,Sweet C's Designs
60,Copycat-Mongolian-Beef-1602587,4,Copycat Mongolian Beef,Gluten Free With L.B.
61,Skillet-Beef-_-Broccoli-1549837,4,Skillet Beef & Broccoli,Unilever North America
62,Stir-Fried-Celery-in-Meat-Sauce-1712403,4,Stir-Fried Celery in Meat Sauce,The Wednesday Chef
63,Asian-Sensation-Slow-Cooker-Chicken-1708586,4,Asian Sensation Slow Cooker Chicken,Slow Cooker Recipes
64,Thai-Basil-Tofu-_Vegan_-1687047,3,Thai Basil Tofu [Vegan],One Green Planet
65,Yaki-Udon-1707379,4,Yaki Udon,Tara's Multicultural Table
66,Spicy-Crab-Noodles-1686112,4,Spicy Crab Noodles,Lindy Sez
67,Shrimp-Tofu-Pad-Thai-Noodles-1708578,4,Shrimp Tofu Pad Thai Noodles,Posh Journal
68,Chicken-Manchurian-1703465,3,Chicken Manchurian,National Made Easy
69,One-Pot-Kung-Pao-Chicken-1628872,4,One Pot Kung Pao Chicken,Go Eat and Repeat
70,Shrimp-Fried-Rice-1707914,3,Shrimp Fried Rice,Betty Crocker
71,Spicy-Asian-eggplant-and-quinoa-1700835,4,Spicy Asian eggplant and quinoa,Julia's Album
72,Thai-Turkey-Meatballs-over-Ginger-Coconut-Basmati-Rice-1711223,4,Thai Turkey Meatballs over Ginger Coconut Basmati Rice,Destination Delish
73,Thai-Yellow-Curry-1687916,4,Thai Yellow Curry,Rasa Malaysia
74,15-Minute-Lazy-Noodles-1602057,4,15-Minute Lazy Noodles,The Woks of Life
75,Teriyaki-Chicken-1630919,4,Teriyaki Chicken,Num's the Word
76,Chicken-Pad-Thai-1547622,4,Chicken Pad Thai,Cooking Classy
77,5-Ingredient-Coconut-Curry-499242,4,5 Ingredient Coconut Curry,Pinch of Yum
78,Kung-Pao-Chicken-1696588,3,Kung Pao Chicken,Pasadena Daisy
79,Honey-Sriracha-Grilled-Chicken-Skewers-1100928,4,Honey Sriracha Grilled Chicken Skewers,My Organized Chaos
80,Asian-Tuna-Tacos-1696709,4,Asian Tuna Tacos,Spry Living
81,Sticky-Vietnamese-Caramel-Chicken-1700934,4,Sticky Vietnamese Caramel Chicken,Get Inspired Everyday!
82,Honey-Garlic-Chicken-1638267,4,Honey Garlic Chicken,Kawaling Pinoy
83,Classic-Pad-Thai-1489520,4,Classic Pad Thai,Taste
84,Easy_-Tasty-Roasted-Tofu-1683290,3,"Easy, Tasty Roasted Tofu",About.com Kosher
85,Taiwanese-Pork-Chops-1700321,3,Taiwanese Pork Chops,Yummy
86,Slow-Cooker-Korean-Beef-1682238,4,Slow Cooker Korean Beef,Let's Dish
87,Spicy-Ginger-Chicken-_-Vegetables-1549292,4,Spicy Ginger Chicken & Vegetables,Unilever North America
88,Ginger-Miso-Stir-Fry-with-Broccoli-and-Tofu-1697970,4,Ginger Miso Stir Fry with Broccoli and Tofu,Healthy. Happy. Life.
89,Light-and-Healthy-Vegetarian-Lo-Mein-1701782,3,Light and Healthy Vegetarian Lo Mein,Andie Mitchell
90,Kung-Pao-Chicken-and-Snap-Peas-with-Spiralized-Onions-1709662,4,Kung Pao Chicken and Snap Peas with Spiralized Onions,Inspiralized
91,Quick-and-easy-spicy-broiled-shrimp-309433,5,Quick and Easy Spicy Broiled Shrimp,Kalyn's Kitchen
92,Beef-Massaman-Curry-1635773,4,Beef Massaman Curry,Rasa Malaysia
93,Thai-Basil-Tofu-Stir-Fry-1688505,4,Thai Basil Tofu Stir Fry,Veggie Souls
94,Lo-Mein-Stir-Fry-1688640,4,Lo Mein Stir Fry,Veggie Souls
95,Crispy-honey-ginger-chicken-333723,5,Crispy Honey Ginger Chicken,How Sweet It Is
96,Thai-Style-Garlic-Chicken-681331,4,Thai-Style Garlic Chicken,Fuss Free Cooking
97,Shrimp-With-Garlic-Green-Beans-1687246,4,Shrimp With Garlic Green Beans,Delicious Alternatives
98,Stout-braised-short-ribs-with-soy-and-honey-310237,5,Stout-Braised Short Ribs with Soy and Honey,Big Girls Small Kitchen
99,Laing-1689000,4,Laing,Recipe ni Juan
100,Easy-Chicken-Teriyaki-Bowls-1559772,4,Easy Chicken Teriyaki Bowls,Cravings of a Lunatic
101,Mall-Chicken-Teriyaki-1564167,4,Mall Chicken Teriyaki,The Woks of Life
102,Vegetarian-Zucchini-Noodle-Stir-Fry-1710278,4,Vegetarian Zucchini Noodle Stir Fry,Sinful Nutrition
103,Chopped-Chicken-Sesame-Noodle-Bowls-1704438,4,Chopped Chicken Sesame Noodle Bowls,Prevention RD
104,Miso-Honey-Chicken-1635368,4,Miso Honey Chicken,A Spicy Perspective
105,Chicken-Chop-Suey-1699258,4,Chicken Chop Suey,Delicious as it Looks
106,Buddha-Bowl-1689519,4,Buddha Bowl,A Sweet and Savory Life
107,Turkey-Ramen-1706855,3,Turkey Ramen,Team Beachbody
108,Easy-Better-Than-Takeout-Chicken-Fried-Rice-1529444,4,Easy Better-Than-Takeout Chicken Fried Rice,Averie Cooks
109,Stir-fried-Pork-in-Garlic-Sauce-1624597,3,Stir-fried Pork in Garlic Sauce,Pork - Be Inspired
110,Vietnamese-Beef-Stew-Bo-Kho-1707741,3,Vietnamese Beef Stew – Bò Kho,Tasty Kitchen
111,Korean-Beef-Bowl-575704,4,Korean Beef Bowl,Damn Delicious
112,Thai-Peanut-Noodles-with-Shrimp-1704477,3,Thai Peanut Noodles with Shrimp,Clean Eating
113,Easy-Massaman-Curry-1627577,3,Easy Massaman Curry,Delicious.
114,Broiled-Salmon-with-Thai-Sweet-Chili-Glaze-Once-Upon-A-Chef-200053,5,Broiled Salmon with Thai Sweet Chili Glaze,Once Upon A Chef
115,Japchae-_Chap-Chae_-1627510,4,Japchae (Chap Chae),Rasa Malaysia
116,Vietnamese-Restaurant-Style-Grilled-Lemongrass-Pork-_Thit-Heo-Nuong-Xa_-1035987,4,Vietnamese Restaurant-Style Grilled Lemongrass Pork (Thit Heo Nuong Xa),Viet World Kitchen
117,Grilled-Thai-Chicken-1640077,4,Grilled Thai Chicken,Jeanette's Healthy Living
118,Vegetarian-dirty-Thai-fried-quinoa-1064150,4,Vegetarian dirty Thai fried quinoa,Eat Good 4 Life
119,Sticky-Slow-Cooker-Chicken-1057479,4,Sticky Slow Cooker Chicken,It Is a Keeper
120,Skinny-coconut-shrimp-351912,5,Skinny Coconut Shrimp,Skinnytaste
121,Magically-moist-adobo-salmon-296946,4,Magically Moist Adobo Salmon,Unilever North America
122,Clean-Eating-Baked-Thai-Salmon-1111281,4,Clean Eating Baked Thai Salmon,ifoodreal
123,Honey-Garlic-Chicken-1623779,4,Honey Garlic Chicken,Kawaling Pinoy
124,Grilled-Sesame-Asian-Shrimp-and-Vegetables-1693167,3,Grilled Sesame Asian Shrimp and Vegetables,The Nutritionist Reviews
125,Asian-Garlic-Tofu-1597905,4,Asian Garlic Tofu,Spicy Southern Kitchen
126,SWEET-and-SOUR-CHICKEN-_-Asian-inspired-sauce-_-bell-pepper_-carrot_-pineapple-_-with-white-rice-1708841,4,"SWEET and SOUR CHICKEN * Asian inspired sauce * bell pepper, carrot, pineapple * with white rice",Seasonal Holiday Recipe Exchange
127,Chicken-Spring-Rolls-1259563,4,Chicken Spring Rolls,LaaLoosh
128,Korean-Pork-Chops-1709439,4,Korean Pork Chops,The Adventure Bite
129,Grilled-Scallops-510612,5,Grilled Scallops,Food Republic
130,Baked-Hoisin-Chicken-1071251,4,Baked Hoisin Chicken,Rasa Malaysia
131,Sticky-Asian-Pork-Ribs-1704120,4,Sticky Asian Pork Ribs,Basement Bakehouse
132,Teriyaki-Chicken-Skewers-with-Sesame-Zucchini-Noodles-1700400,4,Teriyaki Chicken Skewers with Sesame Zucchini Noodles,Recipe Runner
133,Korean-BBQ-Tofu-_Vegan_-1696673,3,Korean BBQ Tofu [Vegan],One Green Planet
134,Thai-Basil-Chicken-1568468,4,Thai Basil Chicken,Skinnytaste
135,Stir-Fried-Beef-and-Sugar-Snap-Peas-1703486,3,Stir-Fried Beef and Sugar Snap Peas,New York Times Cooking
136,Grilled-Ginger-Soy-Chicken-1123042,4,Grilled Ginger-Soy Chicken,Laughing Spatula
137,Crispy-Sesame-Beef-1539480,4,Crispy Sesame Beef,Damn Delicious
138,Lemony-chickpea-stir-fry-308865,5,Lemony Chickpea Stir-fry,101 Cookbooks
139,Healthy-One-Pot-Asian-Pasta-1179181,4,Healthy One Pot Asian Pasta,Yankee Kitchen Ninja
140,Gluten-Free-Beer-Can-Chicken-with-Asian-Glaze-_-Fathers-Day-BBQ-1700619,4,Gluten Free Beer Can Chicken with Asian Glaze | Father’s Day BBQ,Abbey's Kitchen
141,Spicy-Pork-Fried-Rice-1683199,4,Spicy Pork Fried Rice,Family Food on the Table
142,Shrimp-Lo-Mein-1710290,4,Shrimp Lo Mein,TheMountainKitchen
143,Thai-Garlic-Chicken-1180140,4,Thai Garlic Chicken,Singapore Food
144,Roasted-salmon-with-balsamic-sauce-309887,5,Roasted Salmon with Balsamic Sauce,Kalyn's Kitchen
145,Fish-in-Green-Curry-_SeafoodRecipesWorldwide-1693901,4,Fish in Green Curry #SeafoodRecipesWorldwide,Fish and Seafood Recipes Worldwide
146,Matt-Damon_s-Beef-Satay-Skewers-379566,4,Matt Damon's Beef Satay Skewers,People
147,Thai-Coconut-Curry-Shrimp-Noodle-Bowls-1629645,4,Thai Coconut Curry Shrimp Noodle Bowls,How Sweet It Is
148,Teriyaki-Chicken-497028,4,Teriyaki Chicken,Rasa Malaysia
149,Salmon-with-Thai-style-dressing-1699187,3,Salmon with Thai-style dressing,Delicious.
150,Skillet-Asian-beef-with-snow-peas-and-mushrooms-1627070,3,Skillet Asian beef with snow peas and mushrooms,She Knows
151,Panda-Express-Black-Pepper-Chicken-930562,4,Panda Express Black Pepper Chicken,Mye's Kitchen
152,Asian-stir-fry-303637,4,Asian Stir-fry,Unilever North America
153,Sesame-Honey-Chicken-622256,3,Sesame Honey Chicken,Skinny Ms
154,Beef-Stir-Fry-with-Chopped-Broccoli-1171475,4,Beef Stir Fry with Chopped Broccoli,Panlasang Pinoy
155,Daeji-Bulgogi-_Korean-Spicy-BBQ-Pork_-Closet-Cooking-55002,5,Daeji Bulgogi (Korean Spicy BBQ Pork),Closet Cooking
156,Malaysian-Curry-Chicken-1707434,4,Malaysian Curry Chicken,Nyonya Cooking
157,Ginger-Pork-Noodle-1690933,4,Ginger Pork Noodle,Little Mom That Could
158,Make-ahead-Crockpot-Apricot-Ginger-Chicken-_with-Soy-Sauce_-1637001,4,Make-ahead Crockpot Apricot Ginger Chicken (with Soy Sauce),New Leaf Wellness
159,Simple-Sweet-And-Sour-Chicken-1696953,3,Simple Sweet And Sour Chicken,BBC
160,Asian-Style-Salmon-1571818,4,Asian Style Salmon,The Brooklyn Cook
161,Vietnamese-Lemongrass-Chicken-Rice-Noodles-1711387,4,Vietnamese Lemongrass Chicken Rice Noodles,The Foodolic
162,Asian-Grilled-Chicken-1679646,4,Asian Grilled Chicken,Jamie Cooks It Up
163,Slow-Cooker-Sesame-Beef-1689668,4,Slow Cooker Sesame Beef,Creme de la Crumb
164,Teriyaki-Chicken-1698386,4,Teriyaki Chicken,The Leaner Approach
165,Quick-and-Easy-Scallops-with-Asian-Noodles-and-Seaweed-Salad-1704406,3,Quick and Easy Scallops with Asian Noodles and Seaweed Salad,Berries and Spice
166,Tom-Kha-Gai-1680711,4,Tom Kha Gai,Rasa Malaysia
167,Korean-Style-Pork-Chops-1540310,3,Korean-Style Pork Chops,Mother Thyme
168,Garlic-shrimp-in-coconut-milk_-tomatoes-and-cilantro-352570,5,"Garlic Shrimp in Coconut Milk, Tomatoes and Cilantro",Skinnytaste
169,Soy-and-Sesame-Glazed-Scallops-1613018,4,Soy and Sesame Glazed Scallops,Lisa G Cooks
170,10-Minute-Stir-Fry-1192417,4,10 Minute Stir Fry,Diana Rambles
171,Sesame-Chicken-1047725,4,Sesame Chicken,Fake Ginger
172,Apricot-Chicken-Simply-Recipes-42534,5,Apricot Chicken,Simply Recipes
173,Shrimp-Pad-Thai-on-the-Lighter-Side-1688341,4,Shrimp Pad Thai on the Lighter Side,Skinnytaste
174,Thai-chicken-and-pineapple-stir-fry-352598,5,Thai Chicken and Pineapple Stir Fry,Skinnytaste
175,Vietnamese-Caramel-Chicken-1182299,4,Vietnamese Caramel Chicken,Rasa Malaysia
176,Korean-Fried-Chicken-771738,4,Korean Fried Chicken,Damn Delicious
177,Asian-Pork-Noodles-with-Spinach-1698298,3,Asian Pork Noodles with Spinach,Food & Wine
178,Easy-Chicken-Fried-Rice-1696650,3,Easy Chicken Fried Rice,YourLifeChoices
179,Spicy-Soba-Noodles-1698771,3,Spicy Soba Noodles,jenessasdinners.blogspot.com
180,Congee-_savory-Rice-Porridge_-1702317,4,Congee (savory Rice Porridge),The Briny
181,Salmon-with-Hoisin_-Orange_-and-Bok-Choy-1686291,3,"Salmon with Hoisin, Orange, and Bok Choy",Bon Appétit
182,Filipino-Adobo-Chicken-574146,4,Filipino Adobo Chicken,Skinnytaste
183,Asian-Rice-Noodle-Bowl-1627580,4,Asian Rice Noodle Bowl,Love and Zest
184,Sweet-Korean-Lentils-1621340,4,Sweet Korean Lentils,It Doesn't Taste Like Chicken
185,Chicken-Adobo-1119125,4,Chicken Adobo,Panlasang Pinoy
186,Orange-Pork-Stir-Fry-1668366,4,Orange Pork Stir Fry,Simply Whisked
187,Kung-Pao-Shrimp-1694935,4,Kung Pao Shrimp,Prevention RD
188,Better-Than-Take-Out-Crispy-Sesame-Beef-1063605,4,Better Than Take-Out Crispy Sesame Beef,Lauren's Latest
189,Chili-and-Garlic-Spiced-Beef-and-Broccoli-Stir-Fry-1682525,4,Chili and Garlic Spiced Beef and Broccoli Stir Fry,Mother Rimmy's
190,Homemade-Chicken-Fried-Rice-1578991,4,Homemade Chicken Fried Rice,Stockpiling Moms
191,Green-Coconut-Curry-Spring-Veggie-Bowls-with-Zucchini-Noodles-1683253,4,Green Coconut Curry Spring Veggie Bowls with Zucchini Noodles,Food Faith Fitness
192,Pad-Thai-1685951,3,Pad Thai,New York Times Cooking
193,Pork-Adobo-Serious-Eats-200865,5,Pork Adobo,Serious Eats
194,Spicy-Asian-Salmon-and-Broccoli-Florets-1699949,4,Spicy Asian Salmon and Broccoli Florets,Mother Rimmy's
195,Stir-Fried-Lettuce-With-Seared-Tofu-and-Red-Pepper-1700108,3,Stir-Fried Lettuce With Seared Tofu and Red Pepper,New York Times Cooking
196,Sauteed-Teriyaki-Tofu-1584918,4,Sauteed Teriyaki Tofu,Chef Times Two
197,Pyaji-Mutton-1701499,4,Pyaji Mutton,FoodFlavor.In
198,Thai-Red-Curry-Shrimp-1687644,4,Thai Red Curry Shrimp,Seafood and Shellfish
199,Sweet-and-Sour-Pork-1690977,4,Sweet and Sour Pork,Your Tea Blog
200,Asian-style-pork-chops-with-rice-pilaf-299126,4,Asian-style Pork Chops With Rice Pilaf,Unilever North America
201,Honey-Sesame-Chicken-1119182,4,Honey Sesame Chicken,OMG Chocolate Desserts
202,Lemon-achiote-grilled-tofu-308855,5,Lemon Achiote Grilled Tofu,101 Cookbooks
203,4-Ingredient-Peanut-Chicken-Ramen-1097144,3,4-Ingredient Peanut Chicken Ramen,Tablespoon
204,Prawn-and-Spinach-Curry-1685357,4,Prawn and Spinach Curry,Finding Feasts
205,Korean-BBQ-Steak-Bowls-with-Spicy-Sesame-Dressing-1618113,4,Korean BBQ Steak Bowls with Spicy Sesame Dressing,Pinch of Yum
206,Coconut-chicken-365393,5,Coconut Chicken,Jo Cooks
207,Shrimp-In-Thai-Coconut-Sauce-1508679,4,Shrimp In Thai Coconut Sauce,Foodie Crush
208,Shrimp-Pad-Thai-1686277,3,Shrimp Pad Thai,21 Day Sugar Detox
209,Slow-Cooker-Asian-Beef-Recipe-_WeekdaySupper-1684817,4,Slow Cooker Asian Beef Recipe #WeekdaySupper,Family Foodie
210,Kung-Pao-Chicken-1634634,3,Kung Pao Chicken,Honest Cooking
211,Chicken-Fried-Quinoa-1087384,4,Chicken Fried Quinoa,Emily Bites
212,Easy-Vegan-Pad-Thai-1552176,3,Easy Vegan Pad Thai,Peta
213,Easy-Chicken-Teriyaki-1176204,4,Easy Chicken Teriyaki,Panlasang Pinoy
214,Yoshinoya-Beef-Bowls-474828,4,Yoshinoya Beef Bowls,Iowa Girl Eats
215,Chicken-satay-with-spicy-peanut-sauce-297007,4,Chicken Satay With Spicy Peanut Sauce,Unilever North America
216,Spicy-Chicken-Noodle-Stir-Fry-1683577,4,Spicy Chicken Noodle Stir Fry,Ev's Eats
217,Spicy-Peanut-Butter-Noodles-1698207,4,Spicy Peanut Butter Noodles,Crumb
218,Plant-based-Malaysian-Satay-Noodles-_Vegan-_-gluten_-grain-_sugar-free_-1678652,4,"Plant-based Malaysian Satay Noodles (Vegan + gluten, grain &sugar-free)",Opti Cook
219,Chicken-Satay-with-Peanut-Sauce-1685869,3,Chicken Satay with Peanut Sauce,Food & Wine
220,Grilled-Peanut-Chicken-Allrecipes,4,Grilled Peanut Chicken,AllRecipes
221,Easy-Chicken-Fried-Rice-475210,4,Easy Chicken Fried Rice,Iowa Girl Eats
222,Carrot-and-Tofu-Toss-977610,4,Carrot and Tofu Toss,In Fine Balance
223,Easy-Korean-Beef-and-Rice-_Ground-Beef-Recipe_-1006277,4,Easy Korean Beef and Rice {Ground Beef Recipe},Creations by Kara
224,Gochujang-Pork-Shoulder-Steaks-792235,3,Gochujang Pork Shoulder Steaks,Bon Appétit
225,Peanut-Sesame-Chicken-Rice-Paper-Rolls-1555865,3,Peanut Sesame Chicken Rice Paper Rolls,Cooking Channel
226,Thai-Holy-Basil-Pork-1622758,4,Thai Holy Basil Pork,Curious Nut
227,One-Pot-Salmon-Teriyaki-1043852,3,One-Pot Salmon Teriyaki,popsugar.com
228,Asian-Sesame-Chicken-Stir-Fry-_FODMAP-friendly_-770130,4,Asian Sesame Chicken Stir Fry (FODMAP friendly),Well Balanced
229,Miso-Stir-Fry-1703202,4,Miso Stir-Fry,The Edgy Veg
230,Simple-Minced-Pork-Noodles-595899,4,Simple Minced Pork Noodles,Chubby Hubby
231,Asian_Style-Pork-Chops-Martha-Stewart,4,Asian-Style Marinated Pork Chops,Martha Stewart
232,Teriyaki-Chicken-Fried-Rice-932415,4,Teriyaki Chicken Fried Rice,Wine and Glue
233,Stir-Fried-Swiss-Chard-and-Red-Peppers-1695877,3,Stir-Fried Swiss Chard and Red Peppers,New York Times Cooking
234,Korean-bbq-marinade-308131,5,Korean BBQ Marinade,The Kitchn
235,Daging-Masak-Kicap-_Soy-Sauce-Beef_-497096,4,Daging Masak Kicap (Soy Sauce Beef),Rasa Malaysia
236,Teriyaki-Chicken-1202249,4,Teriyaki Chicken,Add a Pinch
237,Spaghetti-Squash-Shrimp-Pad-Thai-495981,4,Spaghetti Squash Shrimp Pad Thai,Closet Cooking
238,Egg-Plant-and-Beef-with-Sweet-and-Sour-Sauce-1688832,4,Egg Plant and Beef with Sweet and Sour Sauce,Japan Food Addict
239,Fiery-Hot-Noodles-with-Bell-Peppers-1193219,4,Fiery Hot Noodles with Bell Peppers,Love Food Eat
240,Thai-Basil-Squid-496898,4,Thai Basil Squid,Rasa Malaysia
241,Gochujang-Glazed-Salmon-1628693,4,Gochujang-Glazed Salmon,Skinnytaste
242,Grilled-Beef-Satays-with-Peanut-Sauce-1687858,4,Grilled Beef Satays with Peanut Sauce,EverythingZommer.com
243,Slow-Cooker-General-Tso_s-Chicken-611629,3,Slow Cooker General Tso's Chicken,A Year of Slow Cooking
244,Pad-Kee-Mao-1022705,3,Pad Kee Mao,New York Times Cooking
245,Coconut-Marinated-Short-Rib-Kebabs-with-Peanut-Chile-Oil-1688476,3,Coconut-Marinated Short Rib Kebabs with Peanut-Chile Oil,Bon Appétit
246,Three-Cups-Chicken--Easy-Taiwanese-1702820,4,Three Cups Chicken- Easy Taiwanese,Taste Of Asian Food
247,Slow-Cooker-Beef-_-Broccoli-1221656,4,Slow Cooker Beef & Broccoli,Emily Bites
248,Sweet-and-Sour-Chicken-_Without-all-the-deep-frying__-1517484,4,Sweet and Sour Chicken {Without all the deep-frying!},Yammie's Noshery
249,Zesty-Sriracha-Shrimp-and-Quinoa-1088552,4,Zesty Sriracha Shrimp and Quinoa,Julie's Eats & Treats
250,Thai-green-curry-308011,5,Thai Green Curry,The Kitchn
251,Kona-Chicken-Allrecipes,4,Kona Chicken,AllRecipes
252,Pork-adobo-_pork-cooked-in-a-pickling-style-as-in-the-phillipines_-309366,5,Pork Adobo (Pork Cooked in a Pickling Style as in the Phillipines),Kalyn's Kitchen
253,Filipino-Pancit-499335,4,Filipino Pancit,Pinch of Yum
254,Curried-noodle-patties-308910,5,Curried Noodle Patties,101 Cookbooks
255,Spicy-Peanut-Tofu-Bowl-with-Coconut-Forbidden-Rice-1703781,4,Spicy Peanut Tofu Bowl with Coconut Forbidden Rice,Vanilla And Bean
256,Easy-Beef-and-Broccoli-633386,3,Easy Beef and Broccoli,Damn Delicious
257,Asian-Beef-Vegetable-Stir-Fry-1303738,5,Asian Beef Vegetable Stir Fry,Beef. It's What's For Dinner. -brand
258,Sticky_-Spicy-Pork-Ribs-1665952,3,"Sticky, Spicy Pork Ribs",The Splendid Table
259,Aubergine-Stuffed-with-Chickpea-Spinach-Curry-1688647,4,Aubergine Stuffed with Chickpea-Spinach Curry,Veggie Souls
260,Vietnamese-Lemongrass-Chicken-1698567,3,Vietnamese Lemongrass Chicken,James Beard Foundation
261,Thai-Coconut-Curry-Shrimp-1571511,4,Thai Coconut Curry Shrimp,Skinnytaste
262,Sesame-Crusted-Tuna-Steaks-682497,4,Sesame-Crusted Tuna Steaks,My Gourmet Connection
263,Kongnamul-bap-_korean-beansprout-rice-bowl_-351025,5,Kongnamul Bap (Korean Beansprout Rice Bowl),Closet Cooking
264,Fried-Fish-with-Chili-Sauce-1694084,4,Fried Fish with Chili Sauce,Real Thai Recipes
265,Better-Than-Takeout-Cashew-Chicken-1614791,4,Better-Than-Takeout Cashew Chicken,Averie Cooks
266,The-Best-And-Most-Surprising-Food-For-Healthy-Skin-Braised-Pork-Feet-1643412,4,The Best And Most Surprising Food For Healthy Skin – Braised Pork Feet,ChineseFoodsRecipe.com
267,Korean-Beef-with-Brown-Rice-1213045,4,Korean Beef with Brown Rice,BerryMorins Bits and Tips
268,Teriyaki-Chicken-Noodle-Bowls-1639361,4,Teriyaki Chicken Noodle Bowls,Damn Delicious
269,10-Minute-Vegetable-Quinoa-Fried-Rice-1078696,4,10 Minute Vegetable Quinoa “Fried Rice”,Simply Quinoa
270,Vietnamese-Marinade-755202,4,Vietnamese Marinade,Bite
271,Kung-Pao-Chicken-1344396,4,Kung Pao Chicken,AlloverUnique
272,Chicken-Thighs-Marinated-with-Homemade-Ssam-Paste-1690817,3,Chicken Thighs Marinated with Homemade Ssam Paste,Food & Wine
273,Asian-Tin-Foil-Dinners-1693335,4,Asian Tin Foil Dinners,Kiwi And Carrot
274,P_F_-Chang_s-Lemon-Pepper-Shrimp-1613777,3,P.F. Chang's Lemon Pepper Shrimp,Todd Wilbur's Top Secret Recipes
275,Vegetable-Chow-Mein-1598261,4,Vegetable Chow Mein,Masala Herb
276,Spicy-Basil-Chicken-1583668,4,Spicy Basil Chicken,"Dinners, Dishes and Desserts"
277,Crockpot-Korean-Tacos-1686422,4,Crockpot Korean Tacos,Eating Richly
278,Slow-Cooker-Caramelized-Chicken-676353,4,Slow Cooker Caramelized Chicken,Skinny Ms
279,Beef-Teriyaki-Skewers-1684342,4,Beef Teriyaki Skewers,Over The Big Moon
280,Sesame-Ginger-Carrot-Noodle-Stir-Fry-with-Bok-Choy-and-Crispy-Tofu-1697960,4,Sesame Ginger Carrot Noodle Stir Fry with Bok Choy and Crispy Tofu,The Endless Meal
281,Cilantro-Thai-Grilled-Chicken-1009248,4,Cilantro Thai Grilled Chicken,Delicious Edibles
282,Chicken-and-Asparagus-Teriyaki-Stir-Fry-1532223,4,Chicken and Asparagus Teriyaki Stir-Fry,Skinnytaste
283,Easy-One-Pan-Chicken-Fried-Rice-1553714,4,Easy One-Pan Chicken Fried Rice,FAB Haute Mama
284,Asian-Salmon-in-Foil-965623,4,Asian Salmon in Foil,Damn Delicious
285,Spicy-Thai-Noodles-with-Chicken-1533388,4,Spicy Thai Noodles with Chicken,"Dinners, Dishes and Desserts"
286,Bo-Ssam-1694784,4,Bo Ssam,What's Gaby Cooking
287,Steamed-Pompano-with-Ginger-Soy-Sauce-1641185,4,Steamed Pompano with Ginger-Soy Sauce,All FIsh Seafood Recipes
288,Succulent-Pork-Chops-Allrecipes_1,4,Succulent Pork Chops,AllRecipes
289,Thai-Green-Chicken-Curry-1702498,3,Thai Green Chicken Curry,Tenplay
290,Asian-Style-Steak-1074312,4,Asian Style Steak,Not Enough Cinnamon
