,id,rating,recipeName,sourceDisplayName
291,Easy-20-Minute-Shrimp-Fried-Rice-1257590,4,Easy 20 Minute Shrimp Fried Rice,The Chunky Chef
292,Asian-Fusion-Slow-Cooker-Pulled-Pork-Tacos-1707845,4,Asian Fusion Slow-Cooker Pulled Pork Tacos,Family Spice
293,Thai-Yellow-Curry-1687774,4,Thai Yellow Curry,Rasa Malaysia
294,Honey-Sesame-Chicken-1603280,4,Honey Sesame Chicken,Cooking  And Cooking
295,Ham-fried-rice-369486,4,Ham Fried Rice,Real Mom Kitchen
296,Sweet-and-spicy-honey-grilled-shrimp-371158,5,Sweet and Spicy Honey Grilled Shrimp,Our Best Bites
297,Dhaka-Chicken-Masala-1703471,3,Dhaka Chicken Masala,National Made Easy
298,The-Ultimate-Asian-Flank-Steak-Marinade-1180430,4,The Ultimate Asian Flank Steak Marinade,Just a Taste
299,Dal-Gosht-Recipe_-Pakistani-1681227,4,"Dal Gosht Recipe, Pakistani",Fa's Kitchen
300,Thai-Flank-Steak-Kebobs-1692672,4,Thai Flank Steak Kebobs,Simply Stacie
301,Ginger-Miso-Noodles-With-Eggplant-1703967,4,Ginger Miso Noodles With Eggplant,Love and Lemons
302,Salmon_-Rice-_-Broccoli-Mess-1695681,4,"Salmon, Rice & Broccoli Mess",Ramona's Cuisine
303,Asian-Sesame-Beef-Skewers-1688786,4,Asian Sesame Beef Skewers,The Black Peppercorn
304,Japchae-1696970,4,Japchae,AlloverUnique
305,Hoisin-Glazed-Baked-Salmon-1019572,5,Hoisin Glazed Baked Salmon,Simply Recipes
306,Vietnamese-Caramel-Ginger-Chicken-recipe-_Ga-Kho-Gung_-992384,4,Vietnamese Caramel Ginger Chicken recipe (Ga Kho Gung),Vietnamesefood
307,African-Veg-Curry-Naturally-Ella-46396,5,African Veg Curry,Naturally Ella
308,Chicken-breasts-with-cilantro-and-red-thai-curry-peanut-sauce-309929,5,Chicken Breasts with Cilantro and Red Thai Curry Peanut Sauce,Kalyn's Kitchen
309,15-Minute-Cauliflower-Chicken-Fried-Rice-1635385,4,15 Minute Cauliflower Chicken Fried Rice,Joyful Healthy Eats
310,Orange-pan-glazed-tempeh-308798,5,Orange Pan-glazed Tempeh,101 Cookbooks
311,Crockpot-Thai-Sweet-Chili-Ribs-1187057,4,Crockpot Thai Sweet Chili Ribs,The Eat More Food Project
312,Malaysian-style-Chicken-763101,3,Malaysian-style Chicken,Delicious Magazine
313,Spicy-Garlic-Pork-Stir-Fry-1601699,4,Spicy Garlic Pork Stir Fry,Nutmeg Nanny
314,Sticky-Asian-Grilled-Chicken-1208225,4,Sticky Asian Grilled Chicken,Creme de la Crumb
315,Vietnamese-Lemongrass-Chicken-497053,4,Vietnamese Lemongrass Chicken,Rasa Malaysia
316,Asian-spiced-tilapia-with-udon-351471,5,Asian Spiced Tilapia with Udon,The Naptime Chef
317,Garlicky-Shrimp-Stir-frywith-Shiitakes-and-Bok-Choy-1647318,4,Garlicky Shrimp Stir-fry with Shiitakes and Bok Choy,Skinnytaste
318,Coconut-Pineapple-Shrimp-Skewers-1629005,4,Coconut Pineapple Shrimp Skewers,Well Plated
319,Beef-Bulgogi-1607393,4,Beef Bulgogi,AllRecipes
320,The-Perfect-Baked-Tofu-750937,4,The Perfect Baked Tofu,Healthy Tipping Point
321,Quick-Chicken_-Vegetable-and-Noodle-Stir-Fry-1689934,4,"Quick Chicken, Vegetable and Noodle Stir Fry",Cooking for Busy Mums
322,Thai-Chicken-Fried-Rice-1020927,5,Thai Chicken Fried Rice,Skinnytaste
323,Dak-Bulgogi-_Korean-BBQ-Chicken_-1185329,4,Dak Bulgogi (Korean BBQ Chicken),Korean Bapsang
324,Grilled-salmon-with-asian-dipping-sauce-309793,5,Grilled Salmon with Asian Dipping Sauce,Kalyn's Kitchen
325,Grilled-Thai-Coconut-Lime-Skirt-Steak-1171143,4,Grilled Thai Coconut Lime Skirt Steak,Healthy Seasonal Recipes
326,Fried-Chicken-with-Garlic-and-Soy-Sauce-_Thit-Ga-Chien-Toi-Xi-Dau_-992370,4,Fried Chicken with Garlic and Soy Sauce (Thịt Gà Chiên Tỏi Xì Dầu),Vietnamesefood
327,3_-Easy-Chicken-Lo-Mein-1174535,3,3. Easy Chicken Lo Mein,All Women Stalk
328,Tinolang-Manok-sa-Upo-1641484,4,Tinolang Manok sa Upo,Kawaling Pinoy
329,Chicken-adobo-_chicken-cooked-in-soy-sauce-and-vinegar_-309266,5,Chicken Adobo (Chicken cooked in soy sauce and vinegar),Kalyn's Kitchen
330,Quick-_-Easy-Teriyaki-Chicken-Stir-fry-1626179,4,Quick & Easy Teriyaki Chicken Stir-fry,The Belly Rules The Mind
331,Pancit-Molo-1704448,4,Pancit Molo,Recipe ni Juan
332,Honey-_-Sriracha-Chicken-Thighs-755444,4,Honey + Sriracha Chicken Thighs,Healthy. Delicious.
333,Thai-Coconut-Curry-Shrimp-1020936,5,Thai Coconut Curry Shrimp,Skinnytaste
334,Spicy-Orange-Shrimp-1534970,4,Spicy Orange Shrimp,Fake Ginger
335,Thai-Red-Curry-Chicken-1219043,3,Thai Red Curry Chicken,The Candida Diet
336,Vietnamese-Caramelized-Pork-Salad-Bowls-1700548,4,Vietnamese Caramelized Pork Salad Bowls,The Café Sucré Farine
337,Thai-Inspired-Ground-Turkey-Stir-Fry-with-Basil-and-Peppers-_Low-Carb_-Gluten-Free_-757358,4,"Thai-Inspired Ground Turkey Stir-Fry with Basil and Peppers (Low-Carb, Gluten-Free)",Kalyn's Kitchen
338,Chicken-Stir-Fry-1181352,4,Chicken Stir Fry,Panlasang Pinoy
339,Laab-_thai-minced-pork-salad_-335963,5,Laab (Thai Minced Pork Salad),Saveur
340,Chicken-Fried-Rice-1229337,4,Chicken Fried Rice,Panlasang Pinoy
341,Easy-Five-Spice-Chicken-Wings---Gluten-Free-1181564,4,Easy Five Spice Chicken Wings - Gluten Free,Seasonal Cravings
342,Spicy-Shrimp-and-Cabbage-Stir-Fry-1613222,4,Spicy Shrimp and Cabbage Stir Fry,Kendra's Treats
343,Spicy-Thai-Cashew-Chicken-Noodles-1662857,4,Spicy Thai Cashew Chicken Noodles,Jar Of Lemons
344,Miso-Butter-Shrimp-514042,5,Miso Butter Shrimp,Steamy Kitchen
345,Super-moist-asian-crusted-chicken-298003,4,Super-moist Asian Crusted Chicken,Unilever North America
346,Spicy-Cauliflower-Steak-with-Miso-Sauce-1695794,3,Spicy Cauliflower Steak with Miso Sauce,VegNews
347,Thai-Peanut-Chicken-and-Noodles-1693444,3,Thai Peanut Chicken and Noodles,Betty Crocker
348,Miracle-Noodle-Pad-Thai-1710990,3,Miracle Noodle Pad Thai,Miracle Noodle
349,Bistek_-Filipino-Beef-Steak-771768,4,Bistek: Filipino Beef Steak,Casa Veneracion
350,Thai-shrimp-curry-315041,5,Thai Shrimp Curry,Steamy Kitchen
351,Pork-with-Black-Pepper-Stir-Fry-Sauce-460187,3,Pork with Black Pepper Stir-Fry Sauce,Williams-Sonoma
352,Easy-Teriyaki-Chicken-997993,4,Easy Teriyaki Chicken,The Wicked Noodle
353,Thai-chicken-enchiladas-333595,5,Thai Chicken Enchiladas,How Sweet It Is
354,Thai-Beef-And-Mixed-Pepper-Stir-fry-1685748,3,Thai Beef And Mixed Pepper Stir-fry,BBC
355,Sweet-and-Sticky-Korean-Fried-Chicken-497194,4,Sweet and Sticky Korean Fried Chicken,Rasa Malaysia
356,Beef-Stir-fry-Filipino-style-_PhilippineRestaurantMenu-1695425,4,Beef Stir-fry Filipino-style #PhilippineRestaurantMenu,Philippine Restaurants Menu
357,Thai-Basil-Chicken-1103344,4,Thai Basil Chicken,Immaculate Bites
358,Banh-Mi-Bowls-With-Sticky-Tofu-1679719,4,Banh Mi Bowls With Sticky Tofu,Choosing Chia
359,Cedar-Planked-Asian-Salmon-1687276,4,Cedar Planked Asian Salmon,Self Proclaimed Foodie
360,Chicken-Teriyaki-Stir-Fry-1587966,3,Chicken Teriyaki Stir-Fry,Everyday Dishes
361,Skinny-Stir-Fry-with-Peanut-Sauce-1599890,4,Skinny Stir-Fry with Peanut Sauce,Skinny Kitchen
362,Slow-Cooker-Teriyaki-Chicken-1633777,4,Slow Cooker Teriyaki Chicken,Family Food on the Table
363,Healthy-Thai-Sesame-Patties-677352,4,Healthy Thai Sesame Patties,Apple of my Eye
364,Cold-ginger_-soy-and-honey-sesame-noodles-349266,4,"Cold Ginger, Soy and Honey Sesame Noodles",Every Day with Rachael Ray
365,Thai-style-grilled-pork-neck-302570,4,Thai Style Grilled Pork Neck,Serious Eats
366,One-Pot-Black-Pepper-Chicken-1036362,4,One-Pot Black Pepper Chicken,Skinny Ms
367,Coconut-curry-chicken-349352,5,Coconut Curry Chicken,Every Day with Rachael Ray
368,Honey-Soy-Chicken-564580,4,Honey Soy Chicken,Table for Two
369,Thai-Basil-Beef-Bowls-1616959,4,Thai Basil Beef Bowls,Cooking Classy
370,Mince-Pork-Rice-Bowl-1695254,4,Mince Pork Rice Bowl,Finding Feasts
371,Asian-Glazed-Turkey-Meatballs-1636640,4,Asian Glazed Turkey Meatballs,FoodySchmoody
372,Thai-Barbecue-Chicken-513979,5,Thai Barbecue Chicken,Kalyn's Kitchen
373,Black-pepper-tofu-345212,5,Black Pepper Tofu,Lottie + Doof
374,Lemongrass-Cilantro-Chicken-1581669,4,Lemongrass Cilantro Chicken,Rasa Malaysia
375,Thai-Coconut-Peanut-Chicken-1617423,4,Thai Coconut Peanut Chicken,The Girl Who Ate Everything
376,Creamy-Thai-Stir-Fry-with-Coconut-Milk-1682817,4,Creamy Thai Stir Fry with Coconut Milk,Girl vs. Grid
377,Szechuan-Eggplant-Stirfry-1678871,4,Szechuan Eggplant Stirfry,Upraised Living
378,Low-Carb-Vegan-Chow-Mein-1635764,4,Low Carb Vegan Chow Mein,Running on Real Food
379,Ginger-Beef-Stir-Fry-486032,4,Ginger Beef Stir Fry,The Comfort of Cooking
380,Pad-See-Ew-1000210,4,Pad See Ew,Table for Two
381,Beef-_-Bok-Choy-977743,3,Beef & Bok Choy,Diabetic Living
382,Korean-Braised-Short-Ribs-_Galbi-Jjim_-1707591,4,Korean Braised Short Ribs (Galbi Jjim),AllRecipes
383,Lamb-Rice-Bowls-w_-Lots-of-Veggies-1688994,4,Lamb Rice Bowls w/ Lots of Veggies,Finding Feasts
384,Egg-Roll-in-a-Bowl-1068301,4,Egg Roll in a Bowl,Gluten Free with Southern Charm
385,Easy-Thai-Chicken-1188576,4,Easy Thai Chicken,Damn Delicious
386,Vietnamese-Caramel-Shrimp-_Tom-Rim_-571612,4,Vietnamese Caramel Shrimp (Tom Rim),Closet Cooking
387,15-Minute-Pad-Thai-1589607,4,15 Minute Pad Thai,Feasting at Home
388,Crock-Pot-Honey-Garlic-Chicken-Breast-975879,4,Crock Pot Honey Garlic Chicken Breast,101 Cooking for Two
389,Spicy-Thai-Beef-and-Jasmine-Rice-1678042,4,Spicy Thai Beef and Jasmine Rice,Skinnytaste
390,Low-Calorie-Singapore-Noodles-991832,3,Low Calorie Singapore Noodles,Great British Chefs
391,Spring-Roll-Bowls-1680781,4,Spring Roll Bowls,PureWow
392,Thai-Beef-Salad-1046256,4,Thai Beef Salad,Reluctant Housedad's Recipe Shed
393,Total-Choice-Spicy-Thai-Chicken-Bowl-995250,3,Total Choice Spicy Thai Chicken Bowl,The Dr.Oz Show
394,20-Minute-Spicy-Thai-Noodle-Bowls-1021726,4,20 Minute Spicy Thai Noodle Bowls,Life Made Simple
395,Hoisin-and-Ginger-Shredded-Pork-902648,4,Hoisin and Ginger Shredded Pork,The Kitchn
396,Easy-Sweet-and-Sour-Chicken-573589,4,Easy Sweet and Sour Chicken,Momsdish.com
397,Soy_Glazed-Salmon-Martha-Stewart,4,Soy-Glazed Salmon,Martha Stewart
398,Ginger-Chicken-Stir-Fry-with-Broccoli-1537621,4,Ginger Chicken Stir-Fry with Broccoli,Little Spice Jar
399,Sticky-Sweet-Chile-Lime-Chicken-1080528,4,Sticky Sweet Chile Lime Chicken,Naked Cuisine
400,Thai-Green-Curry-Chicken-1566798,4,Thai Green Curry Chicken,"Dinners, Dishes and Desserts"
401,Thai-green-curry-coconut-shrimp-with-basil-352548,5,Thai Green Curry Coconut Shrimp with Basil,Skinnytaste
402,Asian-Citrus-Salmon-991022,3,Asian Citrus Salmon,Joy Bauer
403,Sesame-Ginger-Beef-_-Broccoli-1680184,4,Sesame-Ginger Beef & Broccoli,Inspired Edibles
404,10-Minute-Spicy-Shrimp-Stir-Fry-1561793,4,10 Minute Spicy Shrimp Stir Fry,Domestic Superhero
405,Claypot-Thai-Glass-Noodles-with-Prawns-1698277,4,Claypot Thai Glass Noodles with Prawns,Noob Cook
406,Chili-Glazed-Salmon-With-Bok-Choy-1186079,3,Chili-Glazed Salmon With Bok Choy,popsugar.com
407,Smoky-Hoisin-Steak-Sliders-with-Marinated-Radishes-and-Spicy-Asian-Slaw-1705077,4,Smoky Hoisin Steak Sliders with Marinated Radishes and Spicy Asian Slaw,The Cozy Apron
408,Garlic-Teriyaki-Tempeh-and-Broccoli-1567550,4,Garlic Teriyaki Tempeh and Broccoli,Eating Birdfood
409,_Slow-Cooker_-Mongolian-Beef-1022482,4,{Slow Cooker} Mongolian Beef,The Recipe Rebel
410,Thai-Red-Curry-with-Shrimp-1687469,4,Thai Red Curry with Shrimp,Mama Loves Food
411,Cold-Peanut-Noodles-1704804,3,Cold Peanut Noodles,Martha Stewart
412,Sesame-Pulled-Pork-1566315,4,Sesame Pulled Pork,A Dash of Sanity
413,Mango-Chicken-Curry-Simply-Recipes-42837,5,Mango Chicken Curry,Simply Recipes
414,Wok-Fried-Salt-_-Pepper-Chicken-1620530,4,Wok-Fried Salt & Pepper Chicken,Food Nouveau
415,Ca-Kho-To-Recipe---Vietnamese-Caramelized-_-Braised-Fish-1181385,4,Cá Kho Tộ Recipe - Vietnamese Caramelized & Braised Fish,Hungry Huy
416,African-Carribean-Shrimp-Fried-Rice-1680293,4,African Carribean Shrimp Fried Rice,Immaculate Bites
417,Panang-Curry-with-Chicken-638871,4,Panang Curry with Chicken,My Style Recipe
418,Easy-Asian-Dry-Rub-Chicken-1567862,4,Easy Asian Dry Rub Chicken,The Woks of Life
419,One-Pot-Curry-Shrimp-1598067,4,One-Pot Curry Shrimp,Skinny Ms
420,Gkai-Pad-Gka-prow_-Which-is-Spicy-Thai-Basil-Chicken-1682810,4,"Gkai Pad Gka-prow, Which is Spicy Thai Basil Chicken",SippitySup
421,Spicy-Sesame-Noodles-with-Chicken-1374521,4,Spicy Sesame Noodles with Chicken,Emily Bites
422,Creamy-Miso-Chicken-Pasta-511731,5,Creamy Miso Chicken Pasta,Steamy Kitchen
423,12-Minute-Chicken-and-Broccoli-991496,4,12-Minute Chicken and Broccoli,Gimme Some Oven
424,Chicken-Chow-Mein-1574465,4,Chicken Chow Mein,Life Made Sweeter
425,Korean-Galbi-_-Eggs-1685542,4,Korean Galbi + Eggs,Archives.
426,Pork-Fried-Rice-1051019,4,Pork Fried Rice,Cookistry
427,Thai-Green-Curry-chicken-1612560,4,Thai Green Curry chicken,Chew Out Loud
428,Khao-Soi-With-Chicken-1639760,3,Khao Soi With Chicken,Delicious Magazine
429,FRIED-TOFU-WITH-THAI-SPECIAL-SAUCE-1697951,4,FRIED TOFU WITH THAI SPECIAL SAUCE,Kushi's Kitchen
430,Asian-BBQ-Pork-Spareribs-1616990,3,Asian BBQ Pork Spareribs,Tasting Table
431,Kare-Kare-989051,4,Kare-Kare,Kawaling Pinoy
432,Easy-Chicken-Stir-Fry-Skillet-1187167,3,Easy Chicken Stir-Fry Skillet,Kraft
433,Fried-Rice-with-Shrimp-and-Salty-Egg-_Com-Chien-Tom-Trung-Muoi_-992270,4,Fried Rice with Shrimp and Salty Egg (Cơm Chiên Tôm Trứng Muối),Vietnamesefood
434,Chili-Garlic-Chicken-Stir-Fry-1638019,4,Chili Garlic Chicken Stir Fry,Small Town Woman
435,Steamed-Whole-Tilapia-with-Ginger-and-Soy-Sauce-1662616,4,Steamed Whole Tilapia with Ginger and Soy Sauce,All FIsh Seafood Recipes
436,Bicol-Express-1213198,4,Bicol Express,Panlasang Pinoy
437,Korean-Beef-1233461,4,Korean Beef,Healthy Recipes
438,Miso-Chicken-Epicurious-53121,5,Miso Chicken,Epicurious
439,Honey-Orange-Chicken-759730,4,Honey Orange Chicken,Paleo Food Kitchen
440,Vietnamese-Style-Grilled-Lemongrass-Pork-1103724,4,Vietnamese Style Grilled Lemongrass Pork,Ang Sarap
441,Korean-Spicy-Pork-Bulgogi-_Dweji-Bulgogi-or-Jeyeuk-Bokkum-_-1121887,4,Korean Spicy Pork Bulgogi (Dweji Bulgogi 돼지불고기 or Jeyeuk Bokkum 제육볶음),Week of Menus
442,Thai-Peanut-Beef-1179757,4,Thai Peanut Beef,Damn Delicious
443,Miso-Roast-Chicken-513358,5,Miso Roast Chicken,Steamy Kitchen
444,Chengdu-Style-Noodles-with-Coconut-Lime-Shrimp-1696812,4,Chengdu Style Noodles with Coconut Lime Shrimp,Jeanie and Lulu's Kitchen
445,Pork-and-Snap-Pea-Stir-Fry-with-Ramen-1649246,4,Pork and Snap Pea Stir-Fry with Ramen,My Gourmet Connection
446,Thai-Chicken-_-Mango-Stir-Fry-1686629,3,Thai Chicken & Mango Stir-Fry,webmd.com
447,Grilled-Whole-Fish-With-Lemongrass_-Chiles-and-Coconut-1687309,3,"Grilled Whole Fish With Lemongrass, Chiles and Coconut",New York Times Cooking
448,Soy-Sauce-Chicken-1643413,4,Soy Sauce Chicken,AllRecipes
449,Orange-Tempeh-1627606,4,Orange Tempeh,The Wannabe Chef
450,Thai-Sweet-Chili-and-Orange-Scallops-677060,4,Thai Sweet Chili and Orange Scallops,My Gourmet Connection
451,Miso-Glazed-Short-Ribs-1625760,4,Miso Glazed Short Ribs,Girls Can Grill
452,Chicken-and-Vegetable-Stir-Fry-1159317,3,Chicken and Vegetable Stir-Fry,McCormick
453,Quick-and-Easy-Mapo-Tofu-1685611,4,Quick and Easy Mapo Tofu,Tikichris
454,Green-Curry-497295,4,Green Curry,Rasa Malaysia
455,Perfect-Sesame-Chicken-1610338,4,Perfect Sesame Chicken,AllRecipes
456,Roasted-Miso-Chicken-1640481,4,Roasted Miso Chicken,Real Housemoms
457,Teriyaki-Pork-Chop-1189317,4,Teriyaki Pork Chop,Panlasang Pinoy
458,Recipe-of-San-Pai-1681569,4,Recipe of San Pai,196 Flavors
459,Thai-Basil-Beef-_Pad-Gra-Prow_-1190932,4,Thai Basil Beef (Pad Gra Prow),The Woks of Life
460,Grilled-five-spice-shrimp-350099,5,Grilled Five-Spice Shrimp,Every Day with Rachael Ray
461,Slow-Cooker-Korean-Beef-1014032,4,Slow Cooker Korean Beef,Damn Delicious
462,Mandarin-chicken-369811,4,Mandarin Chicken,Real Mom Kitchen
463,Gingered-Beef-and-Noodles-1679576,3,Gingered Beef and Noodles,Pillsbury.com
464,Korean-Marinated-Beef-1128489,4,Korean Marinated Beef,Merry About Town
465,Crispy-Beef-with-Sticky-Orange-Sauce-676434,3,Crispy Beef with Sticky Orange Sauce,Honest Cooking
466,Tawa-Chicken-recipe_-Tawa-Murgh-1544473,4,"Tawa Chicken recipe, Tawa Murgh",Fa's Kitchen
467,The-New-South-Asian-Twist-On-Blackened-Chicken-That-Will-Have-Your-Taste-Buds-Dancing-1588552,4,The New South Asian Twist On Blackened Chicken That Will Have Your Taste Buds Dancing,Recipe Station
468,Teriyaki-Honey-Chicken-623519,3,Teriyaki Honey Chicken,Once a Month Meals
469,Rice-Noodles-With-Chicken-1032814,3,Rice Noodles With Chicken,New York Times Cooking
470,ANTS-CLIMBING-A-TREE-_-MA-YI-SHANG-SHU-1630883,4,ANTS CLIMBING A TREE / MA YI SHANG SHU,What To Cook Today
471,Nutty-tofu-noodles-349637,5,Nutty Tofu Noodles,Every Day with Rachael Ray
472,Cook-Thai-Chicken-Curry-1525508,3,Cook Thai Chicken Curry,Men's Health
473,Huli-Huli-Chicken-Bites-1679595,4,Huli Huli Chicken Bites,Barefeet In The Kitchen
474,Slow-Cooker-Sesame-Chicken-Drumsticks-1579795,4,Slow Cooker Sesame Chicken Drumsticks,Art From My Table
475,Thai-Chicken-Lettuce-Cups-1287660,4,Thai Chicken Lettuce Cups,LaaLoosh
476,Thai-Cashews-with-Chicken-1049375,4,Thai Cashews with Chicken,The Wanderlust Kitchen
477,Korean-kalbi-321918,5,Korean Kalbi,Food52
478,Easy-Asian-Style-Chicken-Fried-Rice-1693151,4,Easy Asian Style Chicken Fried Rice,Island Smile
479,Crispy-Tofu-with-Thai-Chili-Paste_-Cashews-and-Kale-1624019,4,"Crispy Tofu with Thai Chili Paste, Cashews and Kale",Inquiring Chef
480,Slow-Cooker-Asian-Short-Ribs-1562309,4,Slow Cooker Asian Short Ribs,Damn Delicious
481,Spicy-Chicken-Fried-Rice-629932,3,Spicy Chicken Fried Rice,Gimme Some Oven
482,Slow-Cooker-Korean-Beef-771730,4,Slow Cooker Korean Beef,Damn Delicious
483,Slow-Cooker-Lemongrass-Pork-1687096,4,Slow-Cooker Lemongrass Pork,Foodie with Family
484,Tea-Smoked-Pork-Chops-1638903,4,Tea Smoked Pork Chops,That Recipe
485,Ramen-Cakes-with-Asian-Chicken-Salad-1684381,4,Ramen Cakes with Asian Chicken Salad,Foodie Girl Chicago
486,Miso_Glazed-Cod-Martha-Stewart,4,Miso-Glazed Cod,Martha Stewart
487,Pork-Bulgogi-Martha-Stewart,4,Pork Bulgogi,Martha Stewart
488,Honey-Soy-Broiled-Salmon-from-Eating-Well-1602792,3,Honey-Soy Broiled Salmon from Eating Well,Livestrong
489,World_s-Best-Pad-Thai_-1686544,3,World's Best Pad Thai!,Thai Food About.com
490,Superfood-Thai-Green-Curry-1600045,3,Superfood Thai Green Curry,The Chalkboard
491,Thai-Sweet-Chili-Chicken-1087714,4,Thai Sweet Chili Chicken,Rasa Malaysia
492,Crispy-baked-thai-peanut-sauce-coated-chicken-358087,5,Crispy Baked Thai Peanut Sauce Coated Chicken,Closet Cooking
493,Slow-Cooker-Teriyaki-Chicken-1172037,4,Slow Cooker Teriyaki Chicken,12Tomatoes
494,Grilled-asian-kabobs-299661,4,Grilled Asian Kabobs,Unilever North America
495,Chicken-Rendang-1624430,4,Chicken Rendang,Rasa Malaysia
496,Thai-Grilled-Pork-511269,5,Thai Grilled Pork,Leite's Culinaria
497,Roasted-Chicken-With-Asparagus-1594006,4,Roasted Chicken With Asparagus,AlloverUnique
498,Beef-Pot-Stickers-_Gyoza_-1593517,4,Beef Pot Stickers (Gyoza),Life Made Simple
499,Cracked-Crab-Thai-Curry_-_Bu-Pad-Pong-Kari_-1678756,3,"Cracked Crab Thai Curry, 'Bu Pad Pong Kari'",Thai Supermarket Online
