,id,rating,recipeName,sourceDisplayName
0,Mexican-Turkey-Crescent-Bake-685407,4,Mexican Turkey Crescent Bake,
1,Beef-Enchilada-Crescents-685426,4,Beef Enchilada Crescents,
2,Taco-Crescent-Ring-768363,4,Taco Crescent Ring,
3,Easy-Taco-Casserole-1708398,4,Easy Taco Casserole,Winstead Wandering
4,Mexican-Beef-and-Rice-Skillet-1710641,4,Mexican Beef and Rice Skillet,I Wash You Dry
5,Easy-Crescent-Taco-Bake-746777,4,Easy Crescent Taco Bake,
6,Healthy-Chicken-Fajitas-2-SmartPoints-1711103,4,Healthy Chicken Fajitas – 2 SmartPoints,healthy weight watchers recipes
7,Mexican-Chicken-Casserole-1665949,4,Mexican Chicken Casserole,Enjoy cooking
8,Sour-Cream-Chicken-Enchilada-Pie-1709177,4,Sour Cream Chicken Enchilada Pie,Southern Bite
9,Mexican-Rice-with-Black-Beans-1688636,4,Mexican Rice with Black Beans,Veggie Souls
10,Amazing-Taco-Casserole-1711336,4,Amazing Taco Casserole,My Mommy Style
11,Easy-Chicken-Enchilada-Crescent-Bake-685429,4,Easy Chicken Enchilada Crescent Bake,
12,Tilapia-Fish-Tacos-with-Tropical-Salsa-1709145,4,Tilapia Fish Tacos with Tropical Salsa,Dinner at the Zoo
13,Mexican-Stuffed-Peppers-With-Quinoa-_-Black-Beans-1706254,4,Mexican Stuffed Peppers With Quinoa & Black Beans,Love and Lentils
14,Vegetarian-Enchilada-Skillet-1709326,4,Vegetarian Enchilada Skillet,Delicious Knowledge
15,Chicken-Tacos-with-Creamy-Roasted-Poblano-Sauce-1700660,4,Chicken Tacos with Creamy Roasted Poblano Sauce,Fusion Craftiness
16,Cheesy-Burrito-Casserole-1697404,4,Cheesy Burrito Casserole,Ann's Entitled Life
17,Chipotle-Lime-Chicken-Tacos-1600898,4,Chipotle Lime Chicken Tacos,Tasty Thin
18,30-Minute-Creamy-Chicken-Enchiladas-1709077,4,30 Minute Creamy Chicken Enchiladas,Reviewz and Newz
19,Chicken-Enchiladas-1623523,4,Chicken Enchiladas,What's That Smell?
20,Easy-Chicken-Enchilada-Casserole-500471,4,Easy Chicken Enchilada Casserole,Jo Cooks
21,Taco-Bake-1689708,4,Taco Bake,Can't Stay Out of the Kitchen
22,Chipotle-Shrimp-Tacos-1581958,4,Chipotle Shrimp Tacos,Heather Christo
23,Creamy-White-Chicken-Enchiladas-1710664,4,Creamy White Chicken Enchiladas,Domestically Speaking
24,Layered-Chicken-Enchilada-Bake-1702240,4,Layered Chicken Enchilada Bake,Emily Bites
25,Slow-Cooker-Pork-Carnitas-Tacos-1712773,4,Slow Cooker Pork Carnitas Tacos,Everyday Good Thinking
26,One-Pan-Mexican-Quinoa-1621595,3,One Pan Mexican Quinoa,Heart Connect
27,W_O_W_-Enchilada-Casserole-1712717,3,W.O.W. Enchilada Casserole,Trader Joe's
28,Tex-Mex-Chicken-Chile-Rellenos-1712681,4,Tex Mex Chicken Chile Rellenos,Garlic And Zest
29,Mexican-Style-Lasagna-Bake-1695229,4,Mexican Style Lasagna Bake,Skinny Ms
30,Roasted-Sweet-Potato-and-Black-Bean-Enchilada-1713172,4,Roasted Sweet Potato and Black Bean Enchilada,Super Healthy Kids
31,Mexican-Skillet-Casserole-1622926,3,Mexican Skillet Casserole,popsugar.com
32,Mexican-One-Pan-Pasta-1701878,4,Mexican One Pan Pasta,Bake Eat Repeat
33,Chili-Lime-Skirt-Steak-Fajitas-1705657,4,Chili Lime Skirt Steak Fajitas,Grill Girl
34,Mexican-Mac-_-Cheese-_-3-SmartPoints-_-1619974,4,Mexican Mac & Cheese ( 3 SmartPoints ),Smart Points Recipes
35,One-Pot-Stove-Top-Enchiladas---Summer-Style-1599428,4,One Pot Stove Top Enchiladas - Summer Style,She Likes Food
36,One-Skillet-Mexican-Quinoa-1688506,4,One Skillet Mexican Quinoa,Veggie Souls
37,Crock-Pot-Mexican-Meatballs-with-Fire-Roasted-Chipotle-Sauce-1708910,4,Crock-Pot Mexican Meatballs with Fire-Roasted Chipotle Sauce,Rubies and Radishes
38,Mexican-Beef-_-Corn-Casserole-1549294,4,Mexican Beef & Corn Casserole,Unilever North America
39,Lazy-Girl-Sweet-_-Spicy-Lime-Chicken-1083609,4,Lazy Girl Sweet + Spicy Lime Chicken,Food and The City
40,4-Ingredient-Healthy-Chicken-Enchilada-Casserole-1579975,4,4-Ingredient Healthy Chicken Enchilada Casserole,The Seasoned Mom
41,Beef-Enchiladas-1689526,4,Beef Enchiladas,I Heart Nap Time
42,Mexican-Pork-Chops-1690382,4,Mexican Pork Chops,Cooking with Books
43,Green-Chile-Creamy-Chicken-Taco-Boats-1706520,3,Green Chile Creamy Chicken Taco Boats,Old El Paso
44,Chile-Colorado-Burritos-1549478,4,Chile Colorado Burritos,Nom Nom Nom
45,Chicken-Enchiladas-1624206,4,Chicken Enchiladas,Joy in Every Season
46,Crock-Pot-Beef-Carnitas-Tacos-1573238,4,Crock Pot Beef Carnitas Tacos,Dinner with the Donnells
47,Coca-Cola-Carnitas-1697335,4,Coca-Cola Carnitas,I Am A Honey Bee
48,6-Ingredient-Green-Chile-Chicken-Enchiladas-_Gluten-Free-_-Double-Batch-for-the-Freezer_-1700178,4,6-Ingredient Green Chile Chicken Enchiladas {Gluten Free + Double Batch for the Freezer},Gluten Free Jess
49,Chicken-Tinga-Tostadas-1712141,4,Chicken Tinga Tostadas,That Square Plate
50,Discada-Tacos-1709998,4,Discada Tacos,Mexicrave Recipes
51,Easy-Baked-Tacos-1683213,4,Easy Baked Tacos,Julie's Eats & Treats
52,Creamy-Chicken-Enchiladas-1597583,4,Creamy Chicken Enchiladas,All She Cooks
53,Pork-Enchilada-Stuffed-Poblano-Peppers-1710840,4,Pork Enchilada Stuffed Poblano Peppers,The Defined Dish
54,Easy-Mexican-Tin-Foil-Dinners-1700467,4,Easy Mexican Tin Foil Dinners,Faithfully Gluten Free
55,Cream-Cheese-Chicken-Enchiladas-1709354,4,Cream Cheese Chicken Enchiladas,For the Love of Crust
56,Layered-Enchilada-Bake-1707178,3,Layered Enchilada Bake,Kraft
57,Tacos-al-Pastor-1709786,4,Tacos al Pastor,Hispanic Kitchen
58,Bacon-wrapped-jalapeno-popper-stuffed-chicken-351514,5,Bacon Wrapped Jalapeno Popper Stuffed Chicken,Closet Cooking
59,Chipotle-Chicken-Recipe-_Copycat_-1710613,4,Chipotle Chicken Recipe (Copycat),Culinary Hill
60,Broiled-or-grilled-pollo-sabroso-352036,5,Broiled or Grilled Pollo Sabroso,Skinnytaste
61,Taco-Tater-Casserole-1703567,4,Taco Tater Casserole,The Girl Who Ate Everything
62,Carnitas-Tacos-with-Tomatillo-Salsa-1712616,3,Carnitas Tacos with Tomatillo Salsa,Tasting Table
63,Easy-Chicken-Santa-Fe-472830,5,Easy Chicken Santa Fe,Recipe Girl
64,9-1707323,4,9,healthy weight watchers recipes
65,Chipotle-Chicken-Enchilada-Bake-1294681,3,Chipotle Chicken Enchilada Bake,Mission Brand
66,One-Pan-Taco-Salsa-Chicken-Dinner-with-Cilantro-and-Lime-1699309,4,One Pan Taco Salsa Chicken Dinner with Cilantro and Lime,Meal Diva
67,Mexican-Zucchini-Burrito-Boats-1684037,4,Mexican Zucchini Burrito Boats,Growing Gluten Free
68,Chicken-Enchiladas-With-Salsa-Verde-1699550,3,Chicken Enchiladas With Salsa Verde ,New York Times Cooking
69,Chipotle-Lime-Fish-Tacos-1602537,4,Chipotle Lime Fish Tacos,Closet Cooking
70,Crock-Pot-Enchilada-Tacos-1708355,4,Crock Pot Enchilada Tacos,Mix and Match Mama
71,Small-Batch-Green-Salsa-Verde-Chicken-Enchiladas-1707326,4,Small Batch Green Salsa Verde Chicken Enchiladas,Ambitious Kitchen
72,Grilled-Shrimp-Tacos-with-Pickled-Onions-1708202,3,Grilled Shrimp Tacos with Pickled Onions,Bon Appétit
73,Cheesy-Chicken-_-Corn-Stuffed-Chiles-1694937,4,Cheesy Chicken & Corn Stuffed Chiles,Prevention RD
74,8-Ingredient-Nachos-Madness-1681244,4,8 Ingredient Nachos Madness,Munchkin Time
75,Spaghetti-Squash-Enchilada-Boats-_Grain-free_-780110,4,Spaghetti Squash Enchilada Boats (Grain-free),Detoxinista
76,Grilled-Scallops-with-Tomato-Mango-Salsa-and-Tomatillo-Guacamole-1709425,3,Grilled Scallops with Tomato Mango Salsa and Tomatillo Guacamole,Honest Cooking
77,Vegetarian-Enchiladas-1579421,4,Vegetarian Enchiladas,Manjula's Kitchen
78,Monterrey-Chicken-Bake-1180899,4,Monterrey Chicken Bake,thepinningmama
79,Beef-Tortilla-Taco-Casserole-1693198,3,Beef Tortilla Taco Casserole,Pillsbury.com
80,Shrimp-Burritos-with-Mango-Salsa-1712593,4,Shrimp Burritos with Mango Salsa,The Messy Baker by Jenny
81,Pork-Carnitas-1707736,4,Pork Carnitas,Body Rebooted
82,Beef-Enchilada-1639020,4,Beef Enchilada,Add a Pinch
83,Taco-Casserole-1603020,4,Taco Casserole,Cooking with Ruthie
84,20-Minute-Summer-Enchilada-Skillet-1643519,3,20 Minute Summer Enchilada Skillet,Hungry Hobby
85,Fajita-Stuffed-Chicken-1582342,4,Fajita-Stuffed Chicken,AlloverUnique
86,Cilantro-Lime-Chicken-995867,4,Cilantro Lime Chicken,Add a Pinch
87,Mexican-Steak-_-Salsa-Rice-1596127,3,Mexican Steak & Salsa Rice,Unilever North America
88,Beef-Enchiritos-1712990,4,Beef Enchiritos,Hispanic Kitchen
89,Chicken-_-Green-Chili-Enchiladas-1632601,3,Chicken & Green Chili Enchiladas,Kraft
90,Tequila-Shrimp-Tostadas-1465394,4,Tequila Shrimp Tostadas,Sugar Dish Me
91,Cuban-Spiced-Sockeye-Tacos-with-Lime-Crema-1710496,4,Cuban Spiced Sockeye Tacos with Lime Crema,Climbing Grier Mountain
92,One-Pot-Lazy-Stuffed-Peppers-1119428,3,One Pot Lazy Stuffed Peppers,Everyday Dishes
93,Easy-Chicken-Enchiladas-1708264,4,Easy Chicken Enchiladas,Real Housemoms
94,3-Ingredient-Slow-Cooker-Taco-Chicken-1703866,4,3-Ingredient Slow Cooker Taco Chicken,Kristine's Kitchen
95,Mexican-Steak-_-Avocado-Salsa-1701926,4,Mexican Steak & Avocado Salsa,Tastes of Lizzy T
96,Santa-Fe-Enchilada-Bake-1702313,3,Santa Fe Enchilada Bake,Kraft
97,Grilled-Pork-and-Scallion-Tacos-1711033,4,Grilled Pork and Scallion Tacos,Riegl Palate
98,Green-chili-turkey-burgers-345488,5,Green Chili Turkey Burgers,Elana's Pantry
99,Easy-Chicken-Sour-Cream-Enchiladas-Your-Family-will-Love-1524373,4,Easy Chicken Sour Cream Enchiladas Your Family will Love,Popsicle Blog
100,Mexican-Chicken-Alfredo-1699991,4,Mexican Chicken Alfredo,The Virtuous Wife
101,Crock-Pot-leftover-Pork-Carnitas-1708505,3,Crock-Pot leftover Pork Carnitas,Meatloaf and Melodrama
102,New-Mexico-Green-Chile-Stew-1626452,4,New Mexico Green Chile Stew,Cooks and kid
103,Easy-Stacked-Chicken-Enchiladas-1100610,4,Easy Stacked Chicken Enchiladas,Simple Nourished Living
104,Easy-Enchilada-Cups-1553757,4,Easy Enchilada Cups,Gimme Some Oven
105,Hominy-Quesadillas-with-Grilled-Tomatillo-Salsa-1708796,3,Hominy Quesadillas with Grilled Tomatillo Salsa,Vegetarian Times
106,Easy-Baked-Chimichangas-1690365,4,Easy Baked Chimichangas,It Is a Keeper
107,Crock-Pot-Chicken-Fajitas-1454358,4,Crock Pot Chicken Fajitas,Life in the Lofthouse
108,Bell-Pepper-_-Chickpea-Tacos-w_-Avocado-Green-Chile-Sauce-1705352,4,Bell Pepper & Chickpea Tacos w/ Avocado Green Chile Sauce,Veggie Inspired
109,Taco-Bake-1641594,3,Taco Bake,Kraft
110,Enchilada-Stuffed-Chicken-Skillet-_Inside-Out-Chicken-Enchiladas_-1710244,4,Enchilada Stuffed Chicken Skillet (Inside-Out Chicken Enchiladas),Cookie Rookie
111,Taco-Salad-With-Homemade-Shells-1712265,4,Taco Salad With Homemade Shells,The Ramblings Of An Aspiring Small Town Girl
112,Easy-Beef-Enchiladas-472736,5,Easy Beef Enchiladas,Recipe Girl
113,Black-Bean-Tacos-with-Spiralized-Jicama-and-Avocado-Mash-1709647,4,Black Bean Tacos with Spiralized Jicama and Avocado Mash,Inspiralized
114,Mexican-Grilled-Shrimp-with-Corn-Salsa-1703661,4,Mexican Grilled Shrimp with Corn Salsa,No. 2 Pencil
115,Chicken-Enchiladas-1573895,4,Chicken Enchiladas,Add a Pinch
116,Carne-Asada-Street-Tacos-1068485,4,Carne Asada Street Tacos,"I'm Bored, Let's Go"
117,Lazy-Girls-Chicken-Enchilada-Casserole-475009,4,Lazy Girl’s Chicken Enchilada Casserole,Iowa Girl Eats
118,Spicy-Cheesy-Mini-Meatloaves-1080700,5,Spicy Cheesy Mini Meatloaves,Velveeta Brand
119,Chicken-Flautas-1071609,4,Chicken Flautas,Tried and Tasty
120,Mexican-Lasagna-with-Chicken-and-Black-Beans-1700533,4,Mexican Lasagna with Chicken and Black Beans,The Lemon Bowl
121,Crawfish-Enchiladas-1585406,3,Crawfish Enchiladas,McCormick
122,Chicken-Mole-Closet-Cooking-55004,5,Chicken Mole,Closet Cooking
123,Mexican-Lasagna-Skillet-1699883,3,Mexican Lasagna Skillet,Betty Crocker
124,Chipotle-Lime-Chicken-Taco-Bowl-with-Mango-Chipotle-Sauce-1684493,4,Chipotle Lime Chicken Taco Bowl with Mango Chipotle Sauce,Spoonful of Flavor
125,Steak-Fajitas-1550110,4,Steak Fajitas,Livin Paleo
126,Slow-Cooker-Beef-Tostada_s-1710084,4,Slow Cooker Beef Tostada's,Miz Helen's Country Cottage
127,Crockpot-Cheesy-Chicken-Enchilada-Rice-Bowls-1666708,4,Crockpot Cheesy Chicken Enchilada Rice Bowls,Sweet Tooth Sweet Life
128,Slow-Cooker-Enchilada-Quinoa-1696350,4,Slow Cooker Enchilada Quinoa,Two Peas & Their Pod
129,Mexican-Sliced-Steak-Tacos-1705546,3,Mexican Sliced Steak Tacos,Rachael Ray Show
130,Slow-Cooker-Mexican-Chicken-1641144,3,Slow-Cooker Mexican Chicken,Betty Crocker
131,Chicken-Fajita-1603524,4,Chicken Fajita,Add a Pinch
132,One-Pot-Enchilada-Pasta-1669296,4,One Pot Enchilada Pasta,I Heart Nap Time
133,Homemade-Enchiladas-1078716,4,Homemade Enchiladas,Lemons and Laughs
134,Chili-Lime-Chicken-Tenders-1130363,4,Chili Lime Chicken Tenders,Plain Chicken
135,Creamy-Mexican-Slow-Cooker-Chicken-Low-Carb_-Gluten-Free-1616350,4,"Creamy Mexican Slow Cooker Chicken – Low Carb, Gluten Free","Peace, Love and Low Carb"
136,Chipotle-Lime-Fish-Tacos-Closet-Cooking-54935,5,Chipotle Lime Fish Tacos,Closet Cooking
137,Salsa-Verde-Chicken-Enchiladas-1704464,4,Salsa Verde Chicken Enchiladas,from cats to cooking
138,Mexican-Macaroni-and-Cheese---3-Smartpoints-1443062,4,Mexican Macaroni and Cheese - 3 Smartpoints,Weight Watchers Recipes Blog
139,Tequila-Lime-Shrimp-from-Mexico_s-Rancho-La-Puerta-1600455,4,Tequila Lime Shrimp from Mexico's Rancho La Puerta,The Lemon Bowl
140,Enchilada-Casserole-1617717,4,Enchilada Casserole,Add a Pinch
141,Red-bean-chili-307200,5,Red Bean Chili,Smitten Kitchen
142,Slow-Cooker-Cilantro-Lime-Chicken-575846,4,Slow Cooker Cilantro Lime Chicken,Pip and Ebby
143,Cheesy-Chicken-Enchiladas-1626121,4,Cheesy Chicken Enchiladas,Faithfully Free
144,Mexican-Brown-Rice-Bake-Gluten-Free-1066656,4,Mexican Brown Rice Bake – Gluten Free,The Honour System
145,Chicken-Taco-Casserole-1706333,4,Chicken Taco Casserole,Enjoy cooking
146,Chile-Verde-1622157,4,Chile Verde,Olives-n-Okra
147,Cilantro-Lime-Chicken-Zucchini-1063725,3,Cilantro Lime Chicken Zucchini,Penny Pincher Jenny
148,21-Day-Fix-Approved-Chicken-Enchiladas-_Homemade-Sauce_-1215487,4,21 Day Fix Approved Chicken Enchiladas (Homemade Sauce),Adventures of a Shrinking Princess
149,Chipotle-Chicken-Kabobs-with-Avocado-Cream-Sauce-475301,4,Chipotle Chicken Kabobs with Avocado Cream Sauce,Annie's Eats
150,Chipotle-Lime-Cabbage-Fish-Tacos-1703238,3,Chipotle-Lime Cabbage Fish Tacos,Mountain Cravings
151,Foil-Pack-Chicken-Enchiladas-1686105,3,Foil-Pack Chicken Enchiladas,Kraft
152,Easy-Cheesy-Chicken-Enchiladas-1557581,4,Easy Cheesy Chicken Enchiladas,Live Love Texas
153,Clean-Eating-Taco-Shrimp-1031786,4,Clean Eating Taco Shrimp,The Gracious Pantry
154,Beef-and-Bean-Taco-Casserole-1697979,3,Beef and Bean Taco Casserole,Betty Crocker
155,Fiesta-Chicken-Crockpot-1113907,3,Fiesta Chicken Crockpot,My Litter One Deal at A Time
156,Grilled-Chipotle-Chicken-Tacos-1643111,4,Grilled Chipotle Chicken Tacos,Girl Gone Gourmet
157,Shredded-Pork-Tacos-with-Pinto-Beans-and-Slaw-1695917,4,Shredded Pork Tacos with Pinto Beans and Slaw,Hezzi-D's Books and Cooks
158,Chicken-Enchilada-Casserole-1171469,4,Chicken Enchilada Casserole,Panlasang Pinoy
159,Skillet-Tortilla-Pizza-Simply-Recipes-287096,5,Skillet Tortilla Pizza,Simply Recipes
160,Vegan-Tacos-with-California-Walnuts-1700552,4,Vegan Tacos with California Walnuts,Nutrition A La Natalie
161,Chicken-Chilaquiles-1069553,4,Chicken Chilaquiles,A Pretty Life in the Suburbs
162,MEXICAN-CHICKEN-753885,4,MEXICAN CHICKEN,Linda's Low Carb Menus
163,Cilantro-Lime-Grilled-Chicken-1195411,4,Cilantro Lime Grilled Chicken,Closet Cooking
164,Easy-Weeknight-Enchiladas-1065931,4,Easy Weeknight Enchiladas,Dispatches from the Castle
165,Black-Bean-Vegan-Enchiladas-971043,4,Black Bean Vegan Enchiladas,Light Orange Bean
166,Baked-Chimichanga-1581099,4,Baked Chimichanga,Julie's Eats & Treats
167,Simple-Chicken-Enchilada-Casserole-1567561,4,Simple Chicken Enchilada Casserole,Moroccan Mom
168,Mexican-Tinga-De-Pollo-1593343,4,Mexican Tinga De Pollo,Alwayz Bakin
169,Low-Carb-Mexican-Tamale-Skillet-Pie-_Gluten-Free_-Grain-Free_-1690031,4,"Low Carb Mexican Tamale Skillet Pie (Gluten Free, Grain Free)",Sugar-Free Mom
170,Cilantro-lime-shrimp-352105,5,Cilantro Lime Shrimp,Skinnytaste
171,Monterrey-Chicken-Bake-1018788,4,Monterrey Chicken Bake,thepinningmama
172,Shredded-Pork-Burrito-Bowls-1699822,3,Shredded Pork Burrito Bowls,Ziploc
173,Slow-Cooker-Black-Bean-Mole---Perfect-For-Tacos_-1698005,4,Slow Cooker Black Bean Mole - Perfect For Tacos!,Grub du Jour
174,Individual-Chicken-Taco-Casseroles-1678223,4,Individual Chicken Taco Casseroles,Day by day in our world
175,Shredded-Mexican-Beef-1023349,4,Shredded Mexican Beef,Valerie's Kitchen
176,Paleo-Taco-Bowl-1628527,4,Paleo Taco Bowl,My Suburban Kitchen
177,Skinny-Mexican-Casserole-1554841,4,Skinny Mexican Casserole,Damn Delicious
178,Green-Chili-Cream-Cheese-Enchiladas-1639475,4,Green Chili Cream Cheese Enchiladas,Bombshell Bling
179,Pork-Hatch-Green-Chili-1547317,4,Pork Hatch Green Chili,Three Olives Branch
180,Grilled-Mexican-Lime-Chicken-1188856,4,Grilled Mexican Lime Chicken,The Girl Who Ate Everything
181,Cheesy-Mexican-Bubble-Up-Bake-1643497,3,Cheesy Mexican Bubble-Up Bake,Pillsbury.com
182,Easy-Skillet-Chicken-Chilaquiles-1619166,4,Easy Skillet Chicken Chilaquiles,The Pioneer Woman
183,Enmoladas-_Chicken-Mole-Enchiladas_-Closet-Cooking-55003,5,Enmoladas (Chicken Mole Enchiladas),Closet Cooking
184,Chicken-Tacos-Once-Upon-A-Chef-199931,5,Chicken Tacos,Once Upon A Chef
185,Buffalo-Chicken-Taquitos-1186877,4,Buffalo Chicken Taquitos,Emily Bites
186,Oyster-Mushroom-Tacos-with-Sweet-Mango-Salsa-1698760,3,Oyster Mushroom Tacos with Sweet Mango Salsa,Chef Chloe
187,Beef-and-Green-Chile-Enchiladas-1680135,3,Beef and Green Chile Enchiladas,Betty Crocker
188,MEXICAN-STUFFED-PEPPERS-1678500,4,MEXICAN STUFFED PEPPERS,Linda's Low Carb Menus
189,Grilled-Lime-Chicken-Taco-1622643,4,Grilled Lime Chicken Taco,Posh Journal
190,No-Roll-Mexican-Rice-Enchiladas-1680132,3,No-Roll Mexican Rice Enchiladas,Betty Crocker
191,Slow-Cooker-Pineapple-Salsa-Chicken-aka-Mexican-Delight-1199965,4,Slow Cooker Pineapple Salsa Chicken aka Mexican Delight,Real Life Dinner
192,Carne-bistec---colombian-steak-with-onions-and-tomatoes-352004,5,Carne Bistec - Colombian Steak with Onions and Tomatoes,Skinnytaste
193,Braised-Chipotle-Pork-Butt-Tacos-1707500,3,Braised Chipotle Pork Butt Tacos,ABC
194,4-Ingredient-Slow-Cooker-Mexican-Shredded-Chicken-1600798,4,4-Ingredient Slow Cooker Mexican Shredded Chicken,Eat Cake For Dinner
195,5-Ingredient-Mexican-Quinoa-Stuffed-Peppers-1098884,4,5-Ingredient Mexican Quinoa Stuffed Peppers,Gimme Some Oven
196,Creamy-Salsa-Chicken-1578355,4,Creamy Salsa Chicken,"Dinners, Dishes and Desserts"
197,Cilantro-and-lime-fish-tacos-351065,5,Cilantro and Lime Fish Tacos,Closet Cooking
198,Enchiladas-Suizas-1612926,4,Enchiladas Suizas,Kitchen Nostalgia
199,Chile-rellenos-bake-309598,5,Chile Rellenos Bake,Kalyn's Kitchen
200,Mexican-Pulled-Beef-Tacos-1001235,4,Mexican Pulled Beef Tacos,Many Kitchens
201,Ranch-Chicken-Enchiladas-676318,4,Ranch Chicken Enchiladas,Life in the Lofthouse
202,Buffalo-chicken-enchiladas-333322,5,Buffalo Chicken Enchiladas,How Sweet It Is
203,Bean-and-cheese-enchiladas-365041,5,Bean and Cheese Enchiladas,Eat at Home
204,Mexican-Style-Lasagna-1080710,5,Mexican Style Lasagna,Velveeta Brand
205,One-Pot-Mexican-Rice-Skillet-Dinner-1619915,4,One-Pot Mexican Rice Skillet Dinner,Two Healthy Kitchens
206,Spicy-Chicken-Tacos-1179178,4,Spicy Chicken Tacos,Bobbi's Kozy Kitchen
207,Chicken-Enchiladas-1238029,4,Chicken Enchiladas,Simple Homemaking
208,Sour-Cream-_-Chicken-Enchiladas-1690862,4,Sour Cream & Chicken Enchiladas,Enjoy cooking
209,Recipe-for-Grilled-Corn_-Peppers-_-Black-Bean-Tacos-with-Creamy-Poblano-Sauce-1697885,4,"Recipe for Grilled Corn, Peppers & Black Bean Tacos with Creamy Poblano Sauce",Grab a Plate
210,Carne-Asada-1011512,4,Carne Asada,En.Kung-Food
211,Enchiladas-Con-Carne-1685128,3,Enchiladas Con Carne ,New York Times Cooking
212,Chicken-Enchiladas-With-Salsa-Verde-1687156,3,Chicken Enchiladas With Salsa Verde ,New York Times Cooking
213,Chilli-Con-Carne-574487,3,Chilli Con Carne,BBC
214,White-Chicken-and-Cheese-Enchilada-Casserole-1706348,4,White Chicken and Cheese Enchilada Casserole,Enjoy cooking
215,One-Pot-Mexican-Pasta-Skillet-1455351,4,One Pot Mexican Pasta Skillet,The Garlic Diaries
216,Chicken-Enchilada-Casserole-1679590,4,Chicken Enchilada Casserole,All She Cooks
217,Arroz-Con-Pollo-Simply-Recipes-43033,5,Arroz Con Pollo,Simply Recipes
218,Cheese-Enchiladas-1018019,4,Cheese Enchiladas,Life As Mom
219,Taco-Pasta-_glutenfree-_vegan-1183010,4,Taco Pasta – #glutenfree #vegan,Vegetarian Mamma
220,Chipotle-Lime-Salmon-1089347,4,Chipotle Lime Salmon,Closet Cooking
221,Shrimp-fajitas-352465,5,Shrimp Fajitas,Skinnytaste
222,Chicken-Enchilada-Casserole-1693970,4,Chicken Enchilada Casserole,The Harvest Kitchen
223,Quinoa-Burrito-Bowl-1065602,4,Quinoa Burrito Bowl,Divas Run For Bling
224,Mexi-chicken-campanelle-dinner-334784,5,Mexi-Chicken Campanelle Dinner,Picky Palate
225,Chicken-Enchilada-Casserole-1630054,4,Chicken Enchilada Casserole,Cravings of a Lunatic
226,Taco-Pasta-1027604,4,Taco Pasta,Plain Chicken
227,Too-easy-enchiladas-351527,4,Too Easy Enchiladas,Real Mom Kitchen
228,Clean-Eating-Tortilla-Chicken-Stew-763011,4,Clean Eating Tortilla Chicken Stew,The Gracious Pantry
229,Slow-cooker-black-beans-with-cilantro-309967,5,Slow Cooker Black Beans with Cilantro,Kalyn's Kitchen
230,One-Skillet-Cheesy-Enchilada-Bake-1642780,4,One-Skillet Cheesy Enchilada Bake,The Baker Chick NYC
231,Turkey-stuffed-peppers-352582,5,Turkey Stuffed Peppers,Skinnytaste
232,Slow-Cooker-Taco-Meat-1071354,4,Slow Cooker Taco Meat,Kandy's Kitchen Kreations
233,Green-Chile-Sour-Cream-Enchilada-Chicken-Breasts-1613131,4,Green Chile Sour Cream Enchilada Chicken Breasts,Boulder Locavore
234,Simple-Perfect-Enchiladas-1689517,4,Simple Perfect Enchiladas,Paula Deen
235,Chipotle-Pork-Soft-Tacos-1695284,4,Chipotle Pork Soft Tacos,A Year of Slow Cooking Blog
236,Chili-Lime-Chicken-Marinade-1083728,4,Chili Lime Chicken Marinade,The Honour System
237,How-To-Make-Pork-Carnitas-Recipe-_-Como-Hacer-Carnitas-de-Puerco-1066797,4,How To Make Pork Carnitas Recipe / Cómo Hacer Carnitas de Puerco,Mexico in My Kitchen
238,Easy-Slow-Cooker-Chicken-Fajitas-1700982,4,Easy Slow Cooker Chicken Fajitas,Chew Nibble Nosh
239,Cheesy-Grilled-Mexican-Chicken-1203080,4,Cheesy Grilled Mexican Chicken,Favorite Family Recipes
240,Mexican-Bowtie-Pasta-Bake-497878,4,Mexican Bowtie Pasta Bake,Noble Pig
241,Slow-Cooker-Ranch-Chicken-Tacos-976889,4,Slow Cooker Ranch Chicken Tacos,Who Needs A Cape
242,Crock-pot-beef-tacos-in-soft-tortilla-bread-334849,5,Crock Pot Beef Tacos In Soft Tortilla Bread,Picky Palate
243,Chicken-Enchilada-Casserole-499402,4,Chicken Enchilada Casserole,Pinch of Yum
244,CREAMY-CROCKPOT-MEXICAN-CHICKEN-1068298,4,CREAMY CROCKPOT MEXICAN CHICKEN,"The Thrifty, Frugal Mom"
245,Chipotle-Shrimp-Tacos-1038092,4,Chipotle Shrimp Tacos,Nutmeg Nanny
246,Mexican-Lasagna-1662927,4,Mexican Lasagna,Recipes That Crock
247,Chile-Colorado-Burritos-608961,3,Chile Colorado Burritos,Food Pusher
248,Four-Cheese-Chicken-Enchiladas-622289,3,Four Cheese Chicken Enchiladas,Sargento
249,Southwest-Chicken-Skillet-1039268,4,Southwest Chicken Skillet,What 2 Make
250,Mexican-Tator-Tot-Casserole-Tots-never-go-out-of-style-on-the-dinner-table_-1226572,4,Mexican Tator Tot Casserole – Tots never go out of style on the dinner table!,Vegetarian Mamma
251,Mexican-Zucchini-Burrito-Boats-1617775,4,Mexican Zucchini Burrito Boats,Making Thyme for Health
252,Chipotle-lime-chicken-skewers-303274,4,Chipotle-lime Chicken Skewers,Unilever North America
253,Tequila-Lime-Chicken-Enchiladas-1612955,4,Tequila Lime Chicken Enchiladas,Grits and Pinecones
254,Mexican-Burrito-Bowl-with-Cashew-Chipotle-Cream-Sauce-1707223,4,Mexican Burrito Bowl with Cashew Chipotle Cream Sauce,Foolproof Living
255,Crockpot-Tacos-al-Pastor-1617400,4,Crockpot Tacos al Pastor,Bound By Food
256,Best-Chicken-Enchiladas-Ever_-901894,4,Best Chicken Enchiladas Ever!,Gimme Some Oven
257,Baked-Crispy-Chicken-Taquitos-1117283,4,Baked Crispy Chicken Taquitos,Try Anything Once
258,Pork-Burritos-1694386,4,Pork Burritos,Real Mom Kitchen
259,MARIO-BATALI-Skirt-Steak-with-Chipotle-Mexican-Corn-1701606,4,MARIO BATALI Skirt Steak with Chipotle Mexican Corn,Chew Recipes
260,Mexican-Steak-_-Salsa-Rice-940218,3,Mexican Steak & Salsa Rice,Knorr.com
261,Pork-Tenderloin-Carnitas-1680488,4,Pork Tenderloin Carnitas,Feasting Not Fasting
262,Mexican-Beef-_-Rice-Casserole-1587698,3,Mexican Beef & Rice Casserole,Kraft
263,Cheesy-Chili-Mac-550653,4,Cheesy Chili Mac,Tracey's Culinary Adventures
264,Avocado-And-Chipotle-Shrimp-Tostadas-With-Spicy-Cilantro-Lime-Crema-1710432,4,Avocado And Chipotle Shrimp Tostadas With Spicy Cilantro Lime Crema,Growing Up Bilingual
265,Rotel-Chicken-Mexican-Casserole-1310196,3,Rotel Chicken Mexican Casserole,MyRecipes
266,Slow-Cooker-Chipotle-Beef-Tinga-Tacos-1695949,4,Slow Cooker Chipotle Beef Tinga Tacos,from cats to cooking
267,Four-cheese-enchilada-bake-296551,4,Four Cheese Enchilada Bake,Unilever North America
268,The-Easiest-Slow-Cooker-Taco-Meat-Ever_-1093420,4,The Easiest Slow Cooker Taco Meat Ever!,The Life Jolie Blog
269,Mango-Margarita-Chicken-1074637,4,Mango Margarita Chicken,I Wash You Dry
270,One-Pan-Lazy-Chicken-Enchiladas-1241218,3,One Pan Lazy Chicken Enchiladas,Everyday Dishes
271,Simple-Chicken-Enchiladas-1617893,4,Simple Chicken Enchiladas,The Kitchen is My Playground
272,Queso-taco-pasta-bake-334946,5,Queso Taco Pasta Bake,Picky Palate
273,Chicken-Enchilada-Recipe-with-Homemade-Enchilada-Sauce-1633220,4,Chicken Enchilada Recipe with Homemade Enchilada Sauce,Moms Need To Know
274,Stuffed-Poblano-Peppers-950525,4,Stuffed Poblano Peppers,Healthy Recipes
275,Taco-Cupcakes-568704,4,Taco Cupcakes,Life in the Lofthouse
276,Chicken-Enchiladas-631083,3,Chicken Enchiladas,Add a Pinch
277,Easy-Cheese-Enchiladas-1290637,4,Easy Cheese Enchiladas,Bobbi's Kozy Kitchen
278,Mexican-Tinga-Allrecipes,5,Mexican Tinga,AllRecipes
279,Grilled-Taco-and-Lime-Chicken-for-Tacos-575843,4,Grilled Taco and Lime Chicken for Tacos,Picky Palate
280,Smokey-Grilled-Chicken-Quesadillas-with-Chipotle-Lime-Sour-Cream-1690790,3,Smokey Grilled Chicken Quesadillas with Chipotle Lime Sour Cream,NourishedPeach
281,Chickpea-Tacos-1145721,3,Chickpea Tacos,Instructables
